{"id":57439328,"isReadOnly":false,"metaTags":null,"order":65536,"headHtml":null,"customCss":null,"headerHtml":"<section class=\"u-clearfix u-header u-block-47fc-1\" custom-posts-hash=\"[]\" data-style=\"header-imglogo-menu\" data-post-id=\"post3\" data-section-properties=\"{&quot;grid-spacing&quot;:&quot;0&quot;,&quot;align&quot;:&quot;left&quot;,&quot;stretch&quot;:true}\" id=\"sec-b1b1\" data-source=\"\" data-id=\"47fc\">\n  <div class=\"u-clearfix u-sheet u-block-47fc-2\">\n    \n    <nav class=\"u-menu u-menu-dropdown u-offcanvas u-block-47fc-11\">\n      <div class=\"menu-collapse\" style=\"font-size: 1rem; letter-spacing: 0px;\">\n        <a class=\"u-button-style u-custom-left-right-menu-spacing u-custom-padding-bottom u-custom-top-bottom-menu-spacing u-nav-link u-text-active-palette-1-base u-text-hover-palette-2-base\" href=\"#\"><svg class=\"u-svg-link\" viewBox=\"0 0 24 24\"><use xmlns:xlink=\"http://www.w3.org/1999/xlink\" xlink:href=\"#menu-hamburger\"></use></svg><svg class=\"u-svg-content\" version=\"1.1\" id=\"menu-hamburger\" viewBox=\"0 0 16 16\" x=\"0px\" y=\"0px\" xmlns:xlink=\"http://www.w3.org/1999/xlink\" xmlns=\"http://www.w3.org/2000/svg\">    <g>        <rect y=\"1\" width=\"16\" height=\"2\"></rect>        <rect y=\"7\" width=\"16\" height=\"2\"></rect>        <rect y=\"13\" width=\"16\" height=\"2\"></rect>    </g></svg></a>\n      </div>\n      <div class=\"u-nav-container\">\n        <ul class=\"u-nav u-unstyled u-block-47fc-18\"><li class=\"u-nav-item\"><a class=\"u-button-style u-nav-link u-text-active-palette-1-base u-text-hover-palette-2-base\" href=\"Renzo-Vega.html\" data-page-id=\"2344617661\" style=\"padding: 10px 20px;\">Renzo Vega</a>\n<div class=\"fake u-nav-popup u-block-47fc-20\"><ul class=\"u-h-spacing-20 u-nav u-unstyled u-v-spacing-10 u-block-47fc-19\"><li class=\"u-nav-item\"><a class=\"u-button-style u-nav-link u-white\" href=\"#\">Menu Item1</a>\n</li><li class=\"u-nav-item\"><a class=\"u-button-style u-nav-link u-white\" href=\"#\">Menu Item2</a>\n</li><li class=\"u-nav-item\"><a class=\"u-button-style u-nav-link u-white\" href=\"#\">Menu Item3</a>\n</li></ul>\n</div></li></ul>\n      </div>\n      <div class=\"u-nav-container-collapse\">\n        <div class=\"u-black u-container-style u-inner-container-layout u-opacity u-opacity-95 u-sidenav u-block-47fc-14\">\n          <div class=\"u-inner-container-layout u-sidenav-overflow\">\n            <div class=\"u-menu-close u-block-47fc-15\"></div>\n            <ul class=\"u-align-center u-nav u-popupmenu-items u-unstyled u-block-47fc-16\"><li class=\"u-nav-item\"><a class=\"u-button-style u-nav-link\" href=\"Renzo-Vega.html\" data-page-id=\"2344617661\">Renzo Vega</a>\n<div class=\"fake u-nav-popup u-block-47fc-21\"><ul class=\"u-h-spacing-20 u-nav u-unstyled u-v-spacing-10 u-block-47fc-17\"><li class=\"u-nav-item\"><a class=\"u-button-style u-nav-link u-white\">Menu Item 1</a>\n</li><li class=\"u-nav-item\"><a class=\"u-button-style u-nav-link u-white\">Menu Item 2</a>\n</li><li class=\"u-nav-item\"><a class=\"u-button-style u-nav-link u-white\">Menu Item 3</a>\n</li></ul>\n</div></li></ul>\n          </div>\n        </div>\n        <div class=\"u-black u-menu-overlay u-opacity u-opacity-70\"></div>\n      </div>\n    </nav>\n  </div>\n  <style data-mode=\"XL\" data-visited=\"true\">@media (min-width: 1200px){ .u-block-47fc-1 {background-image: none}\n.u-block-47fc-2 {min-height: 80px}\n.u-block-47fc-11 {margin-top: 22px; margin-right: 0px; margin-bottom: 22px; margin-left: auto}\n.u-block-47fc-18 {font-size: 1rem; letter-spacing: 0px}\n.u-block-47fc-19 {box-shadow: 2px 2px 8px 0 rgba(var(--grey-50-r),var(--grey-50-g),var(--grey-50-b),1)}\n.u-block-47fc-16 {font-size: 1.25rem}\n.u-block-47fc-17 {box-shadow: 2px 2px 8px 0 rgba(var(--grey-50-r),var(--grey-50-g),var(--grey-50-b),1)} }</style>\n  <style data-mode=\"LG\" data-visited=\"true\">@media (max-width: 1199px) and (min-width: 992px){ .u-block-47fc-1 {background-image: none}\n.u-block-47fc-2 {min-height: 80px}\n.u-block-47fc-11 {width: auto; margin-top: 22px; margin-right: 0px; margin-bottom: 22px; margin-left: auto}\n.u-block-47fc-18 {font-size: 1rem; letter-spacing: 0px}\n.u-block-47fc-19 {box-shadow: 2px 2px 8px 0 rgba(var(--grey-50-r),var(--grey-50-g),var(--grey-50-b),1)}\n.u-block-47fc-16 {font-size: 1.25rem}\n.u-block-47fc-17 {box-shadow: 2px 2px 8px 0 rgba(var(--grey-50-r),var(--grey-50-g),var(--grey-50-b),1)} }</style>\n  <style data-mode=\"MD\" data-visited=\"true\">@media (max-width: 991px) and (min-width: 768px){ .u-block-47fc-1 {background-image: none}\n.u-block-47fc-2 {min-height: 80px}\n.u-block-47fc-11 {width: auto; margin-top: 22px; margin-right: 0px; margin-bottom: 22px; margin-left: auto}\n.u-block-47fc-18 {font-size: 1rem; letter-spacing: 0px}\n.u-block-47fc-19 {box-shadow: 2px 2px 8px 0 rgba(var(--grey-50-r),var(--grey-50-g),var(--grey-50-b),1)}\n.u-block-47fc-16 {font-size: 1.25rem}\n.u-block-47fc-17 {box-shadow: 2px 2px 8px 0 rgba(var(--grey-50-r),var(--grey-50-g),var(--grey-50-b),1)} }</style>\n  <style data-mode=\"SM\" data-visited=\"true\">@media (max-width: 767px) and (min-width: 576px){ .u-block-47fc-1 {background-image: none}\n.u-block-47fc-2 {min-height: 80px}\n.u-block-47fc-11 {width: auto; margin-top: 22px; margin-right: 0px; margin-bottom: 22px; margin-left: auto}\n.u-block-47fc-18 {font-size: 1rem; letter-spacing: 0px}\n.u-block-47fc-19 {box-shadow: 2px 2px 8px 0 rgba(var(--grey-50-r),var(--grey-50-g),var(--grey-50-b),1)}\n.u-block-47fc-16 {font-size: 1.25rem}\n.u-block-47fc-17 {box-shadow: 2px 2px 8px 0 rgba(var(--grey-50-r),var(--grey-50-g),var(--grey-50-b),1)} }</style>\n  <style data-mode=\"XS\" data-visited=\"true\">@media (max-width: 575px){ .u-block-47fc-1 {background-image: none}\n.u-block-47fc-2 {min-height: 80px}\n.u-block-47fc-11 {width: auto; margin-top: 22px; margin-right: 0px; margin-bottom: 22px; margin-left: auto}\n.u-block-47fc-18 {font-size: 1rem; letter-spacing: 0px}\n.u-block-47fc-19 {box-shadow: 2px 2px 8px 0 rgba(var(--grey-50-r),var(--grey-50-g),var(--grey-50-b),1)}\n.u-block-47fc-16 {font-size: 1.25rem}\n.u-block-47fc-17 {box-shadow: 2px 2px 8px 0 rgba(var(--grey-50-r),var(--grey-50-g),var(--grey-50-b),1)} }</style>\n</section>","footerHtml":"<section class=\"u-align-center u-clearfix u-footer u-grey-80 u-block-79f6-1\" custom-posts-hash=\"T\" data-style=\"footer-1-text\" data-post-id=\"post7\" data-section-properties=\"{&quot;grid-spacing&quot;:&quot;30&quot;,&quot;spacingAdditional&quot;:&quot;none&quot;,&quot;align&quot;:&quot;&quot;,&quot;stretch&quot;:true}\" id=\"sec-d217\" data-source=\"\" data-id=\"79f6\">\n  <div class=\"u-clearfix u-sheet u-block-79f6-2\">\n    <p class=\"u-small-text u-text u-text-variant u-block-79f6-6\">Texto de muestra. Haz click para seleccionar el elemento de Texto.</p>\n  </div>\n  <style data-mode=\"XL\">@media (min-width: 1200px){ .u-block-79f6-1 {background-image: none}\n.u-block-79f6-2 {min-height: 120px}\n.u-block-79f6-6 {width: 417px; margin-top: 49px; margin-bottom: 49px; margin-left: auto; margin-right: auto} }</style>\n  <style data-mode=\"LG\">@media (max-width: 1199px) and (min-width: 992px){ .u-block-79f6-1 {background-image: none}\n.u-block-79f6-2 {min-height: 99px}\n.u-block-79f6-6 {width: 417px; margin-top: 49px; margin-bottom: 49px; margin-left: auto; margin-right: auto} }</style>\n  <style data-mode=\"MD\">@media (max-width: 991px) and (min-width: 768px){ .u-block-79f6-1 {background-image: none}\n.u-block-79f6-2 {min-height: 76px}\n.u-block-79f6-6 {width: 417px; margin-top: 49px; margin-bottom: 49px; margin-left: auto; margin-right: auto} }</style>\n  <style data-mode=\"SM\">@media (max-width: 767px) and (min-width: 576px){ .u-block-79f6-1 {background-image: none}\n.u-block-79f6-2 {min-height: 57px}\n.u-block-79f6-6 {width: 417px; margin-top: 49px; margin-bottom: 49px; margin-left: auto; margin-right: auto} }</style>\n  <style data-mode=\"XS\">@media (max-width: 575px){ .u-block-79f6-1 {background-image: none}\n.u-block-79f6-2 {min-height: 36px}\n.u-block-79f6-6 {width: 340px; margin-top: 49px; margin-bottom: 49px; margin-left: auto; margin-right: auto} }</style>\n</section>","hideBacklink":null,"homePageId":"2344617661","dateUpdated":1701058752356,"settings":"{\"colorScheme\":{\"bodyColors\":[\"#111111\",\"#ffffff\"],\"bgColor\":\"#ffffff\",\"colors\":[\"#478ac9\",\"#db545a\",\"#f1c50e\",\"#2cccc4\",\"#b9c1cc\"],\"customColors\":[{\"color\":\"#328ac9\",\"status\":0,\"transparency\":1,\"index\":0},{\"color\":\"#393e46\",\"status\":0,\"transparency\":1,\"index\":1},{\"color\":\"#32efe9\",\"status\":0,\"transparency\":1,\"index\":2},{\"color\":\"#32e0c4\",\"status\":0,\"transparency\":1,\"index\":3},{\"color\":\"#040707\",\"status\":0,\"transparency\":1,\"index\":4},{\"color\":\"#190754\",\"status\":0,\"transparency\":1,\"index\":5},{\"color\":\"#6d0bce\",\"status\":0,\"transparency\":1,\"index\":6},{\"color\":\"#110827\",\"status\":0,\"transparency\":1,\"index\":7},{\"color\":\"#8ce8e3\",\"status\":0,\"transparency\":1,\"index\":8},{\"color\":\"#014b4b\",\"status\":0,\"transparency\":1,\"index\":9},{\"color\":\"#060015\",\"status\":0,\"transparency\":1,\"index\":10},{\"color\":\"#291c47\",\"status\":0,\"transparency\":1,\"index\":11},{\"color\":\"#1d1531\",\"status\":0,\"transparency\":1,\"index\":12},{\"color\":\"#0d002f\",\"status\":0,\"transparency\":1,\"index\":13},{\"color\":\"#a2fffa\",\"status\":0,\"transparency\":1,\"index\":14},{\"color\":\"#00e2ec\",\"status\":0,\"transparency\":1,\"index\":15}],\"shadingContrast\":\"body-alt-color\",\"whiteContrast\":\"body-color\",\"bgContrast\":\"body-color\",\"name\":\"u15\"},\"fontScheme\":{\"name\":\"custom-font-family-7\",\"default\":true,\"fonts\":{\"heading\":\"Fira Mono\",\"text\":\"Open Sans, sans-serif\",\"accent\":\"Arial, sans-serif\",\"headingTitle\":\"Fira Mono\",\"textTitle\":\"Open Sans\"}},\"typography\":{\"name\":\"Normal-1\",\"isDefault\":true,\"title\":{\"font-weight\":\"400\",\"font-size\":6,\"line-height\":\"1_1\",\"margin-top\":20,\"margin-bottom\":20,\"LG\":{\"font-size\":4.5},\"SM\":{\"font-size\":3.75},\"XS\":{\"font-size\":3}},\"subtitle\":{\"font-weight\":\"400\",\"font-size\":3,\"line-height\":\"1_1\",\"margin-top\":20,\"margin-bottom\":20,\"SM\":{\"font-size\":2.25},\"XS\":{\"font-size\":1.875}},\"h1\":{\"font-weight\":\"400\",\"font-size\":4.5,\"line-height\":\"1_1\",\"margin-top\":20,\"margin-bottom\":20,\"LG\":{\"font-size\":3.75},\"SM\":{\"font-size\":3},\"XS\":{\"font-size\":2.25}},\"h2\":{\"font-weight\":\"400\",\"font-size\":3,\"line-height\":\"1_1\",\"margin-top\":20,\"margin-bottom\":20,\"SM\":{\"font-size\":2.25},\"XS\":{\"font-size\":1.875}},\"h3\":{\"font-weight\":\"400\",\"font-size\":2.25,\"line-height\":\"1_2\",\"margin-top\":20,\"margin-bottom\":20,\"SM\":{\"font-size\":1.875},\"XS\":{\"font-size\":1.5}},\"h4\":{\"font-weight\":\"400\",\"font-size\":1.5,\"line-height\":\"1_2\",\"margin-top\":20,\"margin-bottom\":20},\"h5\":{\"font-weight\":\"400\",\"font-size\":1.25,\"line-height\":\"1_2\",\"margin-top\":20,\"margin-bottom\":20},\"h6\":{\"font-weight\":\"400\",\"font-size\":1.125,\"line-height\":\"1_2\",\"margin-top\":20,\"margin-bottom\":20},\"largeText\":{\"font-size\":1.5,\"margin-top\":20,\"margin-bottom\":20},\"smallText\":{\"font-size\":0.875,\"margin-top\":20,\"margin-bottom\":20},\"text\":{\"font-size\":1.125,\"margin-top\":20,\"margin-bottom\":20,\"line-height\":\"1_6\",\"SM\":{\"font-size\":1}},\"hyperlink\":{\"font-size\":1.125,\"text-color\":\"palette-1-base\",\"line-height\":\"1_6\",\"SM\":{\"font-size\":1}},\"link\":{},\"button\":{\"color\":\"palette-1-base\",\"margin-top\":20,\"margin-bottom\":20},\"blockquote\":{\"font-size\":1.125,\"font-style\":\"italic\",\"indent\":20,\"border\":4,\"border-color\":\"palette-1-base\",\"margin-top\":20,\"margin-bottom\":20,\"line-height\":\"1_6\",\"SM\":{\"font-size\":1}},\"metadata\":{\"margin-top\":20,\"margin-bottom\":20,\"line-height\":\"1_6\"},\"list\":{\"font-size\":1.125,\"margin-top\":20,\"margin-bottom\":20,\"line-height\":\"1_6\",\"SM\":{\"font-size\":1}},\"orderedlist\":{\"font-size\":1.125,\"margin-top\":20,\"margin-bottom\":20,\"line-height\":\"1_6\",\"SM\":{\"font-size\":1}},\"postContent\":{\"font-size\":1.125,\"margin-top\":20,\"margin-bottom\":20,\"line-height\":\"1_6\",\"SM\":{\"font-size\":1}},\"theme\":{\"gradient\":\"\",\"image\":\"\",\"sheet-width-xl\":1140,\"sheet-width-lg\":940,\"sheet-width-md\":720,\"sheet-width-sm\":540,\"sheet-width-xs\":340},\"htmlBaseSize\":16,\"form-input\":{\"border\":1,\"border-color\":\"grey-30\",\"borders\":\"top right bottom left\",\"color\":\"white\",\"text-color\":\"black\"}},\"backToTop\":\"<span style=\\\"height: 64px; width: 64px; margin-left: 0px; margin-right: auto; margin-top: 0px; background-image: none; right: 20px; bottom: 20px; padding: 15px\\\" class=\\\"u-back-to-top u-icon u-icon-circle u-opacity u-opacity-85 u-palette-1-base\\\" data-href=\\\"#\\\">\\n        <svg class=\\\"u-svg-link\\\" preserveAspectRatio=\\\"xMidYMin slice\\\" viewBox=\\\"0 0 551.13 551.13\\\">\\n            <use xmlns:xlink=\\\"http://www.w3.org/1999/xlink\\\" xlink:href=\\\"#svg-1d98\\\"></use>\\n        </svg>\\n        <svg class=\\\"u-svg-content\\\" enable-background=\\\"new 0 0 551.13 551.13\\\" viewBox=\\\"0 0 551.13 551.13\\\" xmlns=\\\"http://www.w3.org/2000/svg\\\" id=\\\"svg-1d98\\\">\\n            <path d=\\\"m275.565 189.451 223.897 223.897h51.668l-275.565-275.565-275.565 275.565h51.668z\\\"></path>\\n        </svg>\\n    </span>\",\"themeBackLinks\":\"{\\\"data-wp-back-link\\\":\\\"https://nicepage.com/wordpress-themes\\\",\\\"data-wp-back-link-title\\\":\\\"WordPress Theme\\\",\\\"data-jm-back-link\\\":\\\"https://nicepage.com/joomla-templates\\\",\\\"data-jm-back-link-title\\\":\\\"Joomla Templates\\\"}\",\"lang\":\"es\",\"payment\":{\"services\":{}},\"langs\":[{\"id\":\"1\",\"name\":\"es\",\"title\":\"Spanish\"}],\"homePageId\":\"2344617661\",\"id\":57439328,\"dialog\":[{\"id\":\"1\",\"name\":\"Payment Popup\",\"type\":\"payment\",\"sectionAnchorId\":\"sec-e9ca\",\"html\":\"<section class=\\\"u-black u-clearfix u-container-style u-dialog-block u-dialog-open u-opacity u-opacity-70 u-payment-dialog u-valign-middle u-block-6793-1\\\" style=\\\"\\\" data-id=\\\"6793\\\" data-posts-content=\\\"[{'images':[],'maps':[],'videos':[],'icons':[{}],'textWidth':'','textHeight':'','id':1,'groupId':1,'headingProp':'h5','textProp':'text'},{'images':[],'maps':[],'videos':[],'icons':[],'textWidth':'','textHeight':'','id':2,'groupId':1,'headingProp':'h5','textProp':'text'}]\\\" custom-posts-hash=\\\"[T,T,T]\\\" data-style=\\\"payment-dialog\\\" id=\\\"sec-e9ca\\\" data-source=\\\"Sketch\\\">\\n  <div style=\\\"width: 570px; min-height: 578px; height: auto; box-shadow: 0px 0px 8px 0px rgba(var(--black-r),var(--black-g),var(--black-b),0.2); margin-top: 60px; margin-bottom: 60px; margin-left: auto; margin-right: auto\\\" class=\\\"u-align-center u-container-style u-dialog u-radius-25 u-shape-round u-white u-block-6793-2\\\">\\n    <div class=\\\"u-container-layout u-valign-top u-block-6793-3\\\" style=\\\"padding-top: 34px; padding-bottom: 34px; padding-left: 35px; padding-right: 35px\\\">\\n      <h5 class=\\\"u-align-left u-text u-block-6793-26\\\" style=\\\"font-weight: 700; margin-top: 0px; margin-right: 165.016px; margin-bottom: 0px; margin-left: 0px\\\">Buy Now</h5>\\n      <div class=\\\"u-expanded-width u-products u-block-6793-5\\\" style=\\\"margin-top: 30px; margin-bottom: 0px\\\" data-site-sorting-prop=\\\"created\\\" data-site-sorting-order=\\\"desc\\\">\\n        <div class=\\\"u-list-control\\\"></div>\\n        <div class=\\\"u-repeater u-block-6793-6\\\" style=\\\"grid-template-columns: 100%; min-height: 206px; grid-gap: 10px\\\">\\n          <div class=\\\"u-container-style u-products-item u-repeater-item u-block-6793-7\\\" style=\\\"\\\">\\n            <div class=\\\"u-container-layout u-similar-container u-block-6793-8\\\" style=\\\"padding-top: 0px; padding-left: 0px; padding-right: 0px; padding-bottom: 30px\\\">\\n              <h5 class=\\\"u-align-left u-product-control u-text u-block-6793-27\\\" style=\\\"background-image: none; margin-top: 0px; margin-bottom: 0px; margin-left: 0px; margin-right: 0px\\\">\\n                <a class=\\\"u-product-title-link\\\" href=\\\"#\\\">Product 1 Title</a>\\n              </h5>\\n              <div class=\\\"u-align-left u-product-control u-product-desc u-text u-block-6793-29\\\" style=\\\"font-size: 0.875rem; margin-top: 20px; margin-left: 0px; margin-right: 0px; margin-bottom: 0px\\\">\\n                <p>Sample text. Lorem ipsum dolor sit amet, consectetur adipiscing elit nullam nunc justo sagittis suscipit ultrices.</p>\\n              </div>\\n              <div class=\\\"u-align-left u-product-control u-product-quantity u-block-6793-35\\\" style=\\\"width: 125px; margin-top: 30px; margin-right: auto; margin-bottom: 0px; margin-left: 0px\\\">\\n                <div class=\\\"u-hidden u-quantity-label\\\">Quantity</div>\\n                <div class=\\\"u-border-1 u-border-grey-30 u-quantity-input u-radius-50\\\">\\n                  <a class=\\\"disabled minus u-button-style u-quantity-button u-text-body-color\\\">\\n                    <svg xmlns=\\\"http://www.w3.org/2000/svg\\\" viewBox=\\\"0 0 16 16\\\"><path d=\\\"m 4 8 h 8\\\" fill=\\\"none\\\" stroke=\\\"currentColor\\\" stroke-width=\\\"1\\\" fill-rule=\\\"evenodd\\\"></path></svg>\\n                  </a>\\n                  <input class=\\\"u-input u-block-6793-36\\\" type=\\\"text\\\" value=\\\"1\\\" pattern=\\\"[0-9]+\\\" style=\\\"\\\">\\n                  <a class=\\\"plus u-button-style u-quantity-button u-text-body-color\\\">\\n                    <svg xmlns=\\\"http://www.w3.org/2000/svg\\\" viewBox=\\\"0 0 16 16\\\"><path d=\\\"m 4 8 h 8 M 8 4 v 8\\\" fill=\\\"none\\\" stroke=\\\"currentColor\\\" stroke-width=\\\"1\\\" fill-rule=\\\"evenodd\\\"></path></svg>\\n                  </a>\\n                </div>\\n              </div>\\n              <div class=\\\"u-align-left u-product-control u-product-price u-block-6793-12\\\" style=\\\"margin-top: -34px; margin-right: 0px; margin-bottom: 0px; margin-left: auto\\\">\\n                <div class=\\\"u-price-wrapper u-spacing-10\\\">\\n                  <div class=\\\"u-hide-price u-old-price\\\" style=\\\"text-decoration: line-through !important;\\\">$20</div>\\n                  <div class=\\\"u-price\\\" style=\\\"font-size: 1.25rem; font-weight: 700;\\\">$17</div>\\n                </div>\\n              </div>\\n            </div>\\n          </div>\\n        </div>\\n        <div class=\\\"u-list-control\\\"></div>\\n      </div>\\n      <div class=\\\"u-expanded-width u-payment-services u-tab-links-align-justify u-tab-payment u-tab-vertical u-tabs u-block-6793-38\\\" data-payment-order-approved-message=\\\"Your order has been approved. Thank you!\\\" data-payment-order-cancelled-message=\\\"Unable to process your order. Please try again later.\\\" style=\\\"min-height: 250px; min-width: 50px; margin-top: 0px; margin-bottom: 0px; margin-left: 0px; margin-right: 0px\\\">\\n        <ul class=\\\"u-tab-list u-unstyled u-block-6793-39\\\" role=\\\"tablist\\\" style=\\\"\\\">\\n          <li class=\\\"u-tab-item u-block-6793-40\\\" role=\\\"presentation\\\" style=\\\"\\\">\\n            <a class=\\\"active u-active-grey-10 u-button-style u-payment-paypal u-tab-link u-text-body-color u-block-6793-41\\\" id=\\\"link-tab-9cb3\\\" href=\\\"#tab-9cb3\\\" role=\\\"tab\\\" aria-controls=\\\"tab-9cb3\\\" aria-selected=\\\"true\\\" style=\\\"\\\">\\n              <input type=\\\"radio\\\" class=\\\"u-field-input u-grey-15 u-radius-15\\\" name=\\\"payment-group\\\" checked=\\\"checked\\\">\\n              <span>Paypal</span>\\n              <svg class=\\\"u-svg-content\\\" xmlns=\\\"http://www.w3.org/2000/svg\\\" x=\\\"0px\\\" y=\\\"0px\\\"><path fill=\\\"#009EE3\\\" d=\\\"M11,5.9H18c3.8,0,5.2,1.9,4.9,4.7c-0.3,4.7-3.2,7.2-6.9,7.2h-1.9c-0.5,0-0.8,0.3-0.9,1.3l-0.8,4.3\\n  c-0.1,0.3-0.2,0.5-0.5,0.6H7.6c-0.4,0-0.5-0.3-0.4-1l2.6-16C9.9,6.3,10.2,5.9,11,5.9z\\\"></path><path fill=\\\"#113984\\\" d=\\\"M6.7,0h7.1c2,0,4.3,0.1,5.9,1.5c1.1,0.9,1.6,2.4,1.5,4c-0.4,5.4-3.7,8.5-8,8.5H9.6c-0.6,0-0.9,0.4-1.2,1.5\\n  l-0.9,5.1C7.4,21,7.3,21.3,7,21.3H2.6C2,21.3,1.9,21,2,20.1L5.2,1.3C5.3,0.4,5.7,0,6.7,0z\\\"></path><path fill=\\\"#172C70\\\" d=\\\"M8.6,14.8l1.3-7.9c0.1-0.7,0.5-1,1.3-1h7.1c1.2,0,2.1,0.2,2.8,0.5c-0.7,4.8-3.8,7.5-7.9,7.5H9.6\\n  C9.1,13.9,8.8,14.1,8.6,14.8z\\\"></path></svg>\\n            </a>\\n          </li>\\n          <li class=\\\"u-tab-item u-block-6793-42\\\" role=\\\"presentation\\\" style=\\\"\\\">\\n            <a class=\\\"u-active-grey-10 u-button-style u-payment-stripe u-tab-link u-text-body-color u-block-6793-43\\\" id=\\\"link-tab-ab80\\\" href=\\\"#tab-ab80\\\" role=\\\"tab\\\" aria-controls=\\\"tab-ab80\\\" aria-selected=\\\"false\\\" style=\\\"\\\">\\n              <input type=\\\"radio\\\" class=\\\"u-field-input u-grey-15 u-radius-15\\\" name=\\\"payment-group\\\">\\n              <span>Stripe</span>\\n              <svg class=\\\"u-svg-content\\\" xmlns=\\\"http://www.w3.org/2000/svg\\\" x=\\\"0px\\\" y=\\\"0px\\\" viewBox=\\\"0 0 24 24\\\"><path fill=\\\"#635BFF\\\" d=\\\"M14,9.2c-2.3-0.8-3.4-1.5-3.4-2.4c0-0.8,0.8-1.3,2-1.3c2.3,0,4.7,0.8,6.4,1.6l0.9-5.5\\n  c-1.3-0.5-4-1.6-7.7-1.6C9.6,0,7.5,0.7,5.8,1.9C4.1,3.2,3.4,4.9,3.4,7.2c0,4,2.6,5.7,6.8,7.2c2.7,0.9,3.6,1.6,3.6,2.5\\n  c0,0.9-0.9,1.6-2.4,1.6c-1.9,0-5.2-0.9-7.3-2.1L3,22c1.8,0.9,5.1,2,8.7,2c2.8,0,5.1-0.7,6.6-1.9c1.8-1.3,2.7-3.2,2.7-5.7\\n  C20.9,12.3,18.2,10.7,14,9.2L14,9.2z\\\"></path></svg>\\n            </a>\\n          </li>\\n        </ul>\\n        <div class=\\\"u-tab-content u-block-6793-44\\\" style=\\\"\\\">\\n          <div class=\\\"u-container-style u-payment-paypal u-tab-active u-tab-pane u-block-6793-45\\\" id=\\\"tab-9cb3\\\" role=\\\"tabpanel\\\" aria-labelledby=\\\"link-tab-9cb3\\\" style=\\\"\\\">\\n            <div class=\\\"u-container-layout u-payment-services-inner u-block-6793-46\\\" style=\\\"padding-top: 20px; padding-right: 0; padding-bottom: 0; padding-left: 0\\\" data-payment-loading-message=\\\"Loading...\\\">Here you will see the payment buttons on the live website.</div>\\n          </div>\\n          <div class=\\\"u-container-style u-payment-stripe u-tab-pane u-block-6793-47\\\" id=\\\"tab-ab80\\\" role=\\\"tabpanel\\\" aria-labelledby=\\\"link-tab-ab80\\\" style=\\\"\\\">\\n            <div class=\\\"u-container-layout u-block-6793-48\\\" style=\\\"padding-top: 20px; padding-right: 0; padding-bottom: 0; padding-left: 0\\\">\\n              <a href=\\\"#\\\" class=\\\"u-btn u-button-style u-stripe-button u-block-6793-49\\\" style=\\\"width: 100%; margin-top: 0; margin-bottom: 0; margin-left: auto; margin-right: auto\\\">Pay with Stripe</a>\\n            </div>\\n          </div>\\n        </div>\\n      </div>\\n    </div><button class=\\\"u-dialog-close-button u-icon u-text-grey-40 u-block-6793-4\\\" style=\\\"width: 20.0939px; height: 20.0939px; left: auto; top: 35.9532px; position: absolute; right: 35px; padding-top: 0px; padding-bottom: 0px; padding-left: 0px; padding-right: 0px\\\"><svg class=\\\"u-svg-link\\\" preserveAspectRatio=\\\"xMidYMin slice\\\" viewBox=\\\"0 0 16 16\\\" style=\\\"\\\"><use xmlns:xlink=\\\"http://www.w3.org/1999/xlink\\\" xlink:href=\\\"#svg-efe9\\\"></use></svg><svg xmlns=\\\"http://www.w3.org/2000/svg\\\" xmlns:xlink=\\\"http://www.w3.org/1999/xlink\\\" version=\\\"1.1\\\" xml:space=\\\"preserve\\\" class=\\\"u-svg-content\\\" viewBox=\\\"0 0 16 16\\\" x=\\\"0px\\\" y=\\\"0px\\\" id=\\\"svg-efe9\\\"><rect x=\\\"7\\\" y=\\\"0\\\" transform=\\\"matrix(0.7071 -0.7071 0.7071 0.7071 -3.3138 8.0002)\\\" width=\\\"2\\\" height=\\\"16\\\"></rect><rect x=\\\"0\\\" y=\\\"7\\\" transform=\\\"matrix(0.7071 -0.7071 0.7071 0.7071 -3.3138 8.0002)\\\" width=\\\"16\\\" height=\\\"2\\\"></rect></svg></button>\\n  </div>\\n  <style data-mode=\\\"XL\\\" data-visited=\\\"true\\\">@media (max-width: 0px) { .u-block-6793-2 {width: 570px; min-height: 578px; height: auto; box-shadow: 0px 0px 8px 0px rgba(var(--black-r),var(--black-g),var(--black-b),0.2); margin-top: 60px; margin-bottom: 60px; margin-left: auto; margin-right: auto}\\n.u-block-6793-3 {padding-top: 34px; padding-bottom: 34px; padding-left: 35px; padding-right: 35px}\\n.u-block-6793-26 {font-weight: 700; margin-top: 0px; margin-right: 165.016px; margin-bottom: 0px; margin-left: 0px}\\n.u-block-6793-5 {margin-top: 30px; margin-bottom: 0px}\\n.u-block-6793-6 {grid-template-columns: 100%; min-height: 206px; grid-gap: 10px}\\n.u-block-6793-8 {padding-top: 0px; padding-left: 0px; padding-right: 0px; padding-bottom: 30px}\\n.u-block-6793-27 {background-image: none; margin-top: 0px; margin-bottom: 0px; margin-left: 0px; margin-right: 0px}\\n.u-block-6793-29 {font-size: 0.875rem; margin-top: 20px; margin-left: 0px; margin-right: 0px; margin-bottom: 0px}\\n.u-block-6793-35 {width: 125px; margin-top: 30px; margin-right: auto; margin-bottom: 0px; margin-left: 0px}\\n.u-block-6793-12 {margin-top: -34px; margin-right: 0px; margin-bottom: 0px; margin-left: auto}\\n.u-block-6793-38 {min-height: 250px; min-width: 50px; margin-top: 0px; margin-bottom: 0px; margin-left: 0px; margin-right: 0px}\\n.u-block-6793-46 {padding-top: 20px; padding-right: 0; padding-bottom: 0; padding-left: 0}\\n.u-block-6793-48 {padding-top: 20px; padding-right: 0; padding-bottom: 0; padding-left: 0}\\n.u-block-6793-49 {width: 100%; margin-top: 0; margin-bottom: 0; margin-left: auto; margin-right: auto}\\n.u-block-6793-4 {width: 20.0939px; height: 20.0939px; left: auto; top: 35.9532px; position: absolute; right: 35px; padding-top: 0px; padding-bottom: 0px; padding-left: 0px; padding-right: 0px} }</style>\\n  <style data-mode=\\\"LG\\\" data-visited=\\\"true\\\">@media (max-width: 0px) { .u-block-6793-2 {box-shadow: 0px 0px 8px 0px rgba(var(--black-r),var(--black-g),var(--black-b),0.2); width: 570px; height: auto; margin-top: 60px; margin-left: auto; margin-right: auto; margin-bottom: 60px; min-height: 578px}\\n.u-block-6793-3 {padding-top: 34px; padding-bottom: 34px; padding-left: 35px; padding-right: 35px}\\n.u-block-6793-26 {font-weight: 700; margin-top: 0px; margin-right: 165px; margin-bottom: 0px; margin-left: 0px}\\n.u-block-6793-5 {margin-top: 30px; margin-bottom: 0px}\\n.u-block-6793-6 {grid-template-columns: 100%; min-height: 206px; grid-gap: 10px}\\n.u-block-6793-8 {padding-top: 0px; padding-left: 0px; padding-right: 0px; padding-bottom: 30px}\\n.u-block-6793-27 {background-image: none; margin-top: 0px; margin-bottom: 0px; margin-left: 0px; margin-right: 0px}\\n.u-block-6793-29 {font-size: 0.875rem; margin-top: 20px; margin-left: 0px; margin-right: 0px; margin-bottom: 0px}\\n.u-block-6793-35 {width: 125px; margin-top: 30px; margin-right: auto; margin-bottom: 0px; margin-left: 0px}\\n.u-block-6793-12 {margin-top: -34px; margin-right: 0px; margin-bottom: 0px; margin-left: auto}\\n.u-block-6793-38 {min-height: 250px; min-width: 50px; margin-top: 0px; margin-bottom: 0px}\\n.u-block-6793-46 {padding-top: 20px; padding-bottom: 0; padding-left: 0; padding-right: 0}\\n.u-block-6793-48 {padding-top: 20px; padding-bottom: 0; padding-left: 0; padding-right: 0}\\n.u-block-6793-49 {width: 100%; margin-top: 0; margin-bottom: 0; margin-left: auto; margin-right: auto}\\n.u-block-6793-4 {width: 20.0939px; height: 20.0939px; left: auto; top: 35.9532px; position: absolute; right: 35px; padding-top: 0px; padding-bottom: 0px; padding-left: 0px; padding-right: 0px} }</style>\\n  <style data-mode=\\\"MD\\\" data-visited=\\\"true\\\">@media (max-width: 0px) { .u-block-6793-2 {box-shadow: 0px 0px 8px 0px rgba(var(--black-r),var(--black-g),var(--black-b),0.2); width: 570px; height: auto; margin-top: 60px; margin-left: auto; margin-right: auto; margin-bottom: 60px; min-height: 578px}\\n.u-block-6793-3 {padding-top: 30px; padding-bottom: 30px; padding-left: 30px; padding-right: 30px}\\n.u-block-6793-26 {font-weight: 700; margin-top: 0px; margin-right: 165px; margin-bottom: 0px; margin-left: 0px}\\n.u-block-6793-5 {margin-top: 30px; margin-bottom: 0px}\\n.u-block-6793-6 {grid-template-columns: 100%; min-height: 206px; grid-gap: 10px}\\n.u-block-6793-8 {padding-top: 0px; padding-left: 0px; padding-right: 0px; padding-bottom: 30px}\\n.u-block-6793-27 {background-image: none; margin-top: 0px; margin-bottom: 0px; margin-left: 0px; margin-right: 0px}\\n.u-block-6793-29 {font-size: 0.875rem; margin-top: 20px; margin-left: 0px; margin-right: 0px; margin-bottom: 0px}\\n.u-block-6793-35 {width: 125px; margin-top: 30px; margin-right: auto; margin-bottom: 0px; margin-left: 0px}\\n.u-block-6793-12 {margin-top: -34px; margin-right: 0px; margin-bottom: 0px; margin-left: auto}\\n.u-block-6793-38 {min-height: 250px; min-width: 50px; margin-top: 0px; margin-bottom: 0px}\\n.u-block-6793-46 {padding-top: 20px; padding-bottom: 0px; padding-left: 0px; padding-right: 0px}\\n.u-block-6793-48 {padding-top: 20px; padding-bottom: 0px; padding-left: 0px; padding-right: 0px}\\n.u-block-6793-49 {width: 100%; margin-top: 0; margin-bottom: 0; margin-left: auto; margin-right: auto}\\n.u-block-6793-4 {width: 20.0939px; height: 20.0939px; left: auto; top: 31.9532px; position: absolute; right: 30px; padding-top: 0px; padding-bottom: 0px; padding-left: 0px; padding-right: 0px} }</style>\\n  <style data-mode=\\\"SM\\\" data-visited=\\\"true\\\">@media (max-width: 0px) { .u-block-6793-2 {box-shadow: 0px 0px 8px 0px rgba(var(--black-r),var(--black-g),var(--black-b),0.2); width: 540px; height: auto; margin-top: 60px; margin-left: auto; margin-right: auto; margin-bottom: 60px; min-height: 578px}\\n.u-block-6793-3 {padding-top: 30px; padding-bottom: 30px; padding-left: 30px; padding-right: 30px}\\n.u-block-6793-26 {font-weight: 700; margin-top: 0px; margin-right: 165px; margin-bottom: 0px; margin-left: 0px}\\n.u-block-6793-5 {margin-top: 30px; margin-bottom: 0px}\\n.u-block-6793-6 {grid-template-columns: 100%; min-height: 206px; grid-gap: 10px}\\n.u-block-6793-8 {padding-top: 0px; padding-left: 0px; padding-right: 0px; padding-bottom: 30px}\\n.u-block-6793-27 {background-image: none; margin-top: 0px; margin-bottom: 0px; margin-left: 0px; margin-right: 0px}\\n.u-block-6793-29 {font-size: 0.875rem; margin-top: 20px; margin-left: 0px; margin-right: 0px; margin-bottom: 0px}\\n.u-block-6793-35 {width: 125px; margin-top: 30px; margin-right: auto; margin-bottom: 0px; margin-left: 0px}\\n.u-block-6793-12 {margin-top: -34px; margin-right: 0px; margin-bottom: 0px; margin-left: auto}\\n.u-block-6793-38 {min-height: 250px; min-width: 50px; margin-top: 0px; margin-bottom: 0px}\\n.u-block-6793-46 {padding-top: 20px; padding-bottom: 0px; padding-left: 0px; padding-right: 0px}\\n.u-block-6793-48 {padding-top: 20px; padding-bottom: 0px; padding-left: 0px; padding-right: 0px}\\n.u-block-6793-49 {width: 100%; margin-top: 0; margin-bottom: 0; margin-left: auto; margin-right: auto}\\n.u-block-6793-4 {width: 20.0939px; height: 20.0939px; left: auto; top: 31.9532px; position: absolute; right: 30px; padding-top: 0px; padding-bottom: 0px; padding-left: 0px; padding-right: 0px} }</style>\\n  <style data-mode=\\\"XS\\\" data-visited=\\\"true\\\">@media (max-width: 0px) { .u-block-6793-2 {box-shadow: 0px 0px 8px 0px rgba(var(--black-r),var(--black-g),var(--black-b),0.2); width: 340px; height: auto; margin-top: 60px; margin-left: auto; margin-right: auto; margin-bottom: 60px; min-height: 578px}\\n.u-block-6793-3 {padding-top: 30px; padding-bottom: 30px; padding-left: 20px; padding-right: 20px}\\n.u-block-6793-26 {font-weight: 700; margin-top: 0px; margin-right: 5px; margin-bottom: 0px; margin-left: 0px}\\n.u-block-6793-5 {margin-top: 30px; margin-bottom: 0px}\\n.u-block-6793-6 {grid-template-columns: 100%; min-height: 206px; grid-gap: 10px}\\n.u-block-6793-8 {padding-top: 0px; padding-left: 0px; padding-right: 0px; padding-bottom: 30px}\\n.u-block-6793-27 {background-image: none; margin-top: 0px; margin-bottom: 0px; margin-left: 0px; margin-right: 0px}\\n.u-block-6793-29 {font-size: 0.875rem; margin-top: 20px; margin-left: 0px; margin-right: 0px; margin-bottom: 0px}\\n.u-block-6793-35 {width: 125px; margin-top: 30px; margin-right: auto; margin-bottom: 0px; margin-left: 0px}\\n.u-block-6793-12 {margin-top: -34px; margin-right: 0px; margin-bottom: 0px; margin-left: auto}\\n.u-block-6793-38 {min-height: 250px; min-width: 50px; margin-top: 0px; margin-bottom: 0px}\\n.u-block-6793-46 {padding-top: 20px; padding-bottom: 0px; padding-left: 0px; padding-right: 0px}\\n.u-block-6793-48 {padding-top: 20px; padding-bottom: 0px; padding-left: 0px; padding-right: 0px}\\n.u-block-6793-49 {width: 100%; margin-top: 0; margin-bottom: 0; margin-left: auto; margin-right: auto}\\n.u-block-6793-4 {width: 20.0939px; height: 20.0939px; left: auto; top: 31.9532px; position: absolute; right: 20px; padding-top: 0px; padding-bottom: 0px; padding-left: 0px; padding-right: 0px} }</style>\\n</section>\",\"showOn\":\"click\",\"showOnList\":[]}],\"captchaSiteKey\":\"6LetPRgiAAAAAGX121nVdkYGTN-RfCXh4wAlbDFh\",\"captchaSecretKey\":\"\",\"cookiesSection\":\"<section class=\\\"u-align-center u-block-958f-1 u-clearfix u-cookies-consent u-grey-80\\\" custom-posts-hash=\\\"T\\\" style=\\\"background-image: none\\\" data-post-id=\\\"1\\\" data-section-properties=\\\"{&quot;stretch&quot;:true}\\\" data-id=\\\"958f\\\" data-posts-content=\\\"[{'images':[],'maps':[],'videos':[],'icons':[],'textWidth':874,'textHeight':152,'id':1,'headingProp':'h3','textProp':'text'}]\\\" data-style=\\\"cookie-1\\\" id=\\\"sec-1fae\\\" data-source=\\\"\\\">\\n  <div class=\\\"u-block-958f-2 u-clearfix u-sheet u-valign-middle\\\" style=\\\"min-height: 212px\\\" data-height-lg=\\\"158\\\" data-height-md=\\\"131\\\" data-height-sm=\\\"106\\\" data-height-xs=\\\"225\\\">\\n    <div class=\\\"u-block-958f-7 u-clearfix u-expanded-width u-layout-wrap\\\" style=\\\"margin-top: 30px; margin-bottom: 30px\\\">\\n      <div class=\\\"u-gutter-0 u-layout\\\">\\n        <div class=\\\"u-layout-row\\\">\\n          <div class=\\\"u-block-958f-8 u-container-style u-layout-cell u-left-cell u-size-43-md u-size-43-sm u-size-43-xs u-size-46-lg u-size-46-xl\\\" style=\\\"min-height: 152px\\\">\\n            <div class=\\\"u-block-958f-9 u-container-layout u-valign-middle\\\" style=\\\"padding-top: 30px; padding-bottom: 30px; padding-left: 60px; padding-right: 60px\\\">\\n              <h3 class=\\\"u-block-958f-6 u-text u-text-default\\\" style=\\\"margin-top: 0px; margin-right: 20px; margin-bottom: 0px\\\">Cookies &amp; Privacy</h3>\\n              <p class=\\\"u-block-958f-5 u-text u-text-default\\\" style=\\\"margin-top: 8px; margin-right: 20px; margin-bottom: 0px; margin-left: 0px\\\">This website uses cookies to ensure you get the best experience on our website.</p>\\n            </div>\\n          </div>\\n          <div class=\\\"u-align-left u-block-958f-10 u-container-style u-layout-cell u-right-cell u-size-14-lg u-size-14-xl u-size-17-md u-size-17-sm u-size-17-xs\\\" style=\\\"min-height: 152px\\\">\\n            <div class=\\\"u-block-958f-11 u-container-layout u-valign-middle-lg u-valign-middle-md u-valign-middle-xl u-valign-top-sm u-valign-top-xs\\\" style=\\\"padding-top: 30px; padding-bottom: 30px; padding-left: 30px; padding-right: 30px\\\">\\n              <a href=\\\"###\\\" class=\\\"u-block-958f-3 u-btn u-button-confirm u-button-style u-palette-1-base\\\" style=\\\"margin-top: 0px; margin-right: auto; margin-bottom: 0px; margin-left: 0px\\\">Confirm</a>\\n            </div>\\n          </div>\\n        </div>\\n      </div>\\n    </div>\\n  </div>\\n  <style data-mode=\\\"XL\\\">@media (max-width: 0px) { .u-block-958f-1 {background-image: none}\\n.u-block-958f-2 {min-height: 212px}\\n.u-block-958f-7 {margin-top: 30px; margin-bottom: 30px}\\n.u-block-958f-8 {min-height: 152px}\\n.u-block-958f-9 {padding-top: 30px; padding-bottom: 30px; padding-left: 60px; padding-right: 60px}\\n.u-block-958f-6 {margin-top: 0px; margin-right: 20px; margin-bottom: 0px}\\n.u-block-958f-5 {margin-top: 8px; margin-right: 20px; margin-bottom: 0px; margin-left: 0px}\\n.u-block-958f-10 {min-height: 152px}\\n.u-block-958f-11 {padding-top: 30px; padding-bottom: 30px; padding-left: 30px; padding-right: 30px}\\n.u-block-958f-3 {margin-top: 0px; margin-right: auto; margin-bottom: 0px; margin-left: 0px} }</style>\\n  <style data-mode=\\\"LG\\\">@media (max-width: 0px) { .u-block-958f-1 {background-image: none}\\n.u-block-958f-2 {min-height: 131px}\\n.u-block-958f-7 {margin-top: 30px; margin-bottom: 30px}\\n.u-block-958f-8 {min-height: 125px}\\n.u-block-958f-9 {padding-top: 30px; padding-bottom: 30px; padding-left: 60px; padding-right: 60px}\\n.u-block-958f-6 {margin-top: 0px; margin-right: 0px; margin-bottom: 0px}\\n.u-block-958f-5 {margin-top: 8px; margin-right: 0px; margin-bottom: 0px; margin-left: 0px}\\n.u-block-958f-10 {min-height: 125px}\\n.u-block-958f-11 {padding-top: 30px; padding-bottom: 30px; padding-left: 30px; padding-right: 30px}\\n.u-block-958f-3 {margin-top: 0px; margin-right: auto; margin-bottom: 0px; margin-left: 0px} }</style>\\n  <style data-mode=\\\"MD\\\" data-visited=\\\"true\\\">@media (max-width: 0px) { .u-block-958f-1 {background-image: none}\\n.u-block-958f-2 {min-height: 106px}\\n.u-block-958f-7 {margin-top: 30px; margin-bottom: 30px}\\n.u-block-958f-8 {min-height: 100px}\\n.u-block-958f-9 {padding-top: 30px; padding-bottom: 30px; padding-left: 30px; padding-right: 30px}\\n.u-block-958f-6 {margin-top: 0px; margin-right: 0px; margin-bottom: 0px}\\n.u-block-958f-5 {margin-top: 8px; margin-right: 0px; margin-bottom: 0px; margin-left: 0px}\\n.u-block-958f-10 {min-height: 100px}\\n.u-block-958f-11 {padding-top: 30px; padding-bottom: 30px; padding-left: 30px; padding-right: 30px}\\n.u-block-958f-3 {margin-top: 0px; margin-right: auto; margin-bottom: 0px; margin-left: 0px} }</style>\\n  <style data-mode=\\\"SM\\\" data-visited=\\\"true\\\">@media (max-width: 0px) { .u-block-958f-1 {background-image: none}\\n.u-block-958f-2 {min-height: 225px}\\n.u-block-958f-7 {margin-top: 30px; margin-bottom: 30px}\\n.u-block-958f-8 {min-height: 154px}\\n.u-block-958f-9 {padding-top: 30px; padding-left: 10px; padding-right: 10px; padding-bottom: 20px}\\n.u-block-958f-6 {margin-top: 0px; margin-right: 0px; margin-bottom: 0px}\\n.u-block-958f-5 {margin-top: 8px; margin-right: 0px; margin-bottom: 0px; margin-left: 0px}\\n.u-block-958f-10 {min-height: 65px}\\n.u-block-958f-11 {padding-top: 10px; padding-bottom: 10px; padding-left: 10px; padding-right: 10px}\\n.u-block-958f-3 {margin-top: 0px; margin-right: auto; margin-bottom: 0px; margin-left: 0px} }</style>\\n  <style data-mode=\\\"XS\\\" data-visited=\\\"true\\\">@media (max-width: 0px) { .u-block-958f-1 {background-image: none}\\n.u-block-958f-2 {min-height: 121px}\\n.u-block-958f-7 {margin-top: 30px; margin-bottom: 30px}\\n.u-block-958f-8 {min-height: 100px}\\n.u-block-958f-9 {padding-top: 30px; padding-bottom: 20px; padding-left: 10px; padding-right: 10px}\\n.u-block-958f-6 {margin-top: 0px; margin-right: 0px; margin-bottom: 0px}\\n.u-block-958f-5 {margin-top: 8px; margin-right: 0px; margin-bottom: 0px; margin-left: 0px}\\n.u-block-958f-10 {min-height: 15px}\\n.u-block-958f-11 {padding-top: 10px; padding-bottom: 10px; padding-left: 10px; padding-right: 10px}\\n.u-block-958f-3 {margin-top: 0px; margin-right: auto; margin-bottom: 0px; margin-left: 0px} }</style>\\n</section>\",\"formServices\":{\"3bb8235ec05d61bbade22fc6efaa1c52\":{\"id\":\"3bb8235ec05d61bbade22fc6efaa1c52\",\"type\":\"email\",\"token\":\"b9d0f24a-308e-3fa2-d866-3194eab23ac2\",\"email\":\"renzodanielvegacondori@gmail.com\",\"isVerified\":true}},\"publishNicePageCss\":\"\",\"publishHeaderTranslations\":{},\"publishFooterTranslations\":{},\"cookiesConsent\":{\"publishCookiesSection\":\"<section class=\\\"u-align-center u-clearfix u-cookies-consent u-grey-80 u-cookies-consent\\\" id=\\\"sec-1fae\\\">\\n      <div class=\\\"u-clearfix u-sheet u-valign-middle u-sheet-1\\\">\\n        <div class=\\\"u-clearfix u-expanded-width u-layout-wrap u-layout-wrap-1\\\">\\n          <div class=\\\"u-gutter-0 u-layout\\\">\\n            <div class=\\\"u-layout-row\\\">\\n              <div class=\\\"u-container-style u-layout-cell u-left-cell u-size-43-md u-size-43-sm u-size-43-xs u-size-46-lg u-size-46-xl u-layout-cell-1\\\">\\n                <div class=\\\"u-container-layout u-valign-middle u-container-layout-1\\\">\\n                  <h3 class=\\\"u-text u-text-default u-text-1\\\">Cookies &amp; Privacy</h3>\\n                  <p class=\\\"u-text u-text-default u-text-2\\\">This website uses cookies to ensure you get the best experience on our website.</p>\\n                </div>\\n              </div>\\n              <div class=\\\"u-align-left u-container-style u-layout-cell u-right-cell u-size-14-lg u-size-14-xl u-size-17-md u-size-17-sm u-size-17-xs u-layout-cell-2\\\">\\n                <div class=\\\"u-container-layout u-valign-middle-lg u-valign-middle-md u-valign-middle-xl u-valign-top-sm u-valign-top-xs u-container-layout-2\\\">\\n                  <a href=\\\"###\\\" class=\\\"u-btn u-button-confirm u-button-style u-palette-1-base u-btn-1\\\">Confirm</a>\\n                </div>\\n              </div>\\n            </div>\\n          </div>\\n        </div>\\n      </div>\\n    <style> .u-cookies-consent {\\n  background-image: none;\\n}\\n\\n.u-cookies-consent .u-sheet-1 {\\n  min-height: 212px;\\n}\\n\\n.u-cookies-consent .u-layout-wrap-1 {\\n  margin-top: 30px;\\n  margin-bottom: 30px;\\n}\\n\\n.u-cookies-consent .u-layout-cell-1 {\\n  min-height: 152px;\\n}\\n\\n.u-cookies-consent .u-container-layout-1 {\\n  padding: 30px 60px;\\n}\\n\\n.u-cookies-consent .u-text-1 {\\n  margin-top: 0;\\n  margin-right: 20px;\\n  margin-bottom: 0;\\n}\\n\\n.u-cookies-consent .u-text-2 {\\n  margin: 8px 20px 0 0;\\n}\\n\\n.u-cookies-consent .u-layout-cell-2 {\\n  min-height: 152px;\\n}\\n\\n.u-cookies-consent .u-container-layout-2 {\\n  padding: 30px;\\n}\\n\\n.u-cookies-consent .u-btn-1 {\\n  margin: 0 auto 0 0;\\n}\\n\\n@media (max-width: 1199px) {\\n  .u-cookies-consent .u-sheet-1 {\\n    min-height: 131px;\\n  }\\n\\n  .u-cookies-consent .u-layout-cell-1 {\\n    min-height: 125px;\\n  }\\n\\n  .u-cookies-consent .u-text-1 {\\n    margin-right: 0;\\n  }\\n\\n  .u-cookies-consent .u-text-2 {\\n    margin-right: 0;\\n  }\\n\\n  .u-cookies-consent .u-layout-cell-2 {\\n    min-height: 125px;\\n  }\\n}\\n\\n@media (max-width: 991px) {\\n  .u-cookies-consent .u-sheet-1 {\\n    min-height: 106px;\\n  }\\n\\n  .u-cookies-consent .u-layout-cell-1 {\\n    min-height: 100px;\\n  }\\n\\n  .u-cookies-consent .u-container-layout-1 {\\n    padding-left: 30px;\\n    padding-right: 30px;\\n  }\\n\\n  .u-cookies-consent .u-layout-cell-2 {\\n    min-height: 100px;\\n  }\\n}\\n\\n@media (max-width: 767px) {\\n  .u-cookies-consent .u-sheet-1 {\\n    min-height: 225px;\\n  }\\n\\n  .u-cookies-consent .u-layout-cell-1 {\\n    min-height: 154px;\\n  }\\n\\n  .u-cookies-consent .u-container-layout-1 {\\n    padding-left: 10px;\\n    padding-right: 10px;\\n    padding-bottom: 20px;\\n  }\\n\\n  .u-cookies-consent .u-layout-cell-2 {\\n    min-height: 65px;\\n  }\\n\\n  .u-cookies-consent .u-container-layout-2 {\\n    padding: 10px;\\n  }\\n}\\n\\n@media (max-width: 575px) {\\n  .u-cookies-consent .u-sheet-1 {\\n    min-height: 121px;\\n  }\\n\\n  .u-cookies-consent .u-layout-cell-1 {\\n    min-height: 100px;\\n  }\\n\\n  .u-cookies-consent .u-layout-cell-2 {\\n    min-height: 15px;\\n  }\\n}</style></section>\",\"publishCookiesSectionTranslations\":{},\"hideCookies\":true,\"cookieConfirmCode\":\"\",\"cookiesSection\":\"<section class=\\\"u-align-center u-block-958f-1 u-clearfix u-cookies-consent u-grey-80\\\" custom-posts-hash=\\\"T\\\" style=\\\"background-image: none\\\" data-post-id=\\\"1\\\" data-section-properties=\\\"{&quot;stretch&quot;:true}\\\" data-id=\\\"958f\\\" data-posts-content=\\\"[{'images':[],'maps':[],'videos':[],'icons':[],'textWidth':874,'textHeight':152,'id':1,'headingProp':'h3','textProp':'text'}]\\\" data-style=\\\"cookie-1\\\" id=\\\"sec-1fae\\\" data-source=\\\"\\\">\\n  <div class=\\\"u-block-958f-2 u-clearfix u-sheet u-valign-middle\\\" style=\\\"min-height: 212px\\\" data-height-lg=\\\"158\\\" data-height-md=\\\"131\\\" data-height-sm=\\\"106\\\" data-height-xs=\\\"225\\\">\\n    <div class=\\\"u-block-958f-7 u-clearfix u-expanded-width u-layout-wrap\\\" style=\\\"margin-top: 30px; margin-bottom: 30px\\\">\\n      <div class=\\\"u-gutter-0 u-layout\\\">\\n        <div class=\\\"u-layout-row\\\">\\n          <div class=\\\"u-block-958f-8 u-container-style u-layout-cell u-left-cell u-size-43-md u-size-43-sm u-size-43-xs u-size-46-lg u-size-46-xl\\\" style=\\\"min-height: 152px\\\">\\n            <div class=\\\"u-block-958f-9 u-container-layout u-valign-middle\\\" style=\\\"padding-top: 30px; padding-bottom: 30px; padding-left: 60px; padding-right: 60px\\\">\\n              <h3 class=\\\"u-block-958f-6 u-text u-text-default\\\" style=\\\"margin-top: 0px; margin-right: 20px; margin-bottom: 0px\\\">Cookies &amp; Privacy</h3>\\n              <p class=\\\"u-block-958f-5 u-text u-text-default\\\" style=\\\"margin-top: 8px; margin-right: 20px; margin-bottom: 0px; margin-left: 0px\\\">This website uses cookies to ensure you get the best experience on our website.</p>\\n            </div>\\n          </div>\\n          <div class=\\\"u-align-left u-block-958f-10 u-container-style u-layout-cell u-right-cell u-size-14-lg u-size-14-xl u-size-17-md u-size-17-sm u-size-17-xs\\\" style=\\\"min-height: 152px\\\">\\n            <div class=\\\"u-block-958f-11 u-container-layout u-valign-middle-lg u-valign-middle-md u-valign-middle-xl u-valign-top-sm u-valign-top-xs\\\" style=\\\"padding-top: 30px; padding-bottom: 30px; padding-left: 30px; padding-right: 30px\\\">\\n              <a href=\\\"###\\\" class=\\\"u-block-958f-3 u-btn u-button-confirm u-button-style u-palette-1-base\\\" style=\\\"margin-top: 0px; margin-right: auto; margin-bottom: 0px; margin-left: 0px\\\">Confirm</a>\\n            </div>\\n          </div>\\n        </div>\\n      </div>\\n    </div>\\n  </div>\\n  <style data-mode=\\\"XL\\\">@media (max-width: 0px) { .u-block-958f-1 {background-image: none}\\n.u-block-958f-2 {min-height: 212px}\\n.u-block-958f-7 {margin-top: 30px; margin-bottom: 30px}\\n.u-block-958f-8 {min-height: 152px}\\n.u-block-958f-9 {padding-top: 30px; padding-bottom: 30px; padding-left: 60px; padding-right: 60px}\\n.u-block-958f-6 {margin-top: 0px; margin-right: 20px; margin-bottom: 0px}\\n.u-block-958f-5 {margin-top: 8px; margin-right: 20px; margin-bottom: 0px; margin-left: 0px}\\n.u-block-958f-10 {min-height: 152px}\\n.u-block-958f-11 {padding-top: 30px; padding-bottom: 30px; padding-left: 30px; padding-right: 30px}\\n.u-block-958f-3 {margin-top: 0px; margin-right: auto; margin-bottom: 0px; margin-left: 0px} }</style>\\n  <style data-mode=\\\"LG\\\">@media (max-width: 0px) { .u-block-958f-1 {background-image: none}\\n.u-block-958f-2 {min-height: 131px}\\n.u-block-958f-7 {margin-top: 30px; margin-bottom: 30px}\\n.u-block-958f-8 {min-height: 125px}\\n.u-block-958f-9 {padding-top: 30px; padding-bottom: 30px; padding-left: 60px; padding-right: 60px}\\n.u-block-958f-6 {margin-top: 0px; margin-right: 0px; margin-bottom: 0px}\\n.u-block-958f-5 {margin-top: 8px; margin-right: 0px; margin-bottom: 0px; margin-left: 0px}\\n.u-block-958f-10 {min-height: 125px}\\n.u-block-958f-11 {padding-top: 30px; padding-bottom: 30px; padding-left: 30px; padding-right: 30px}\\n.u-block-958f-3 {margin-top: 0px; margin-right: auto; margin-bottom: 0px; margin-left: 0px} }</style>\\n  <style data-mode=\\\"MD\\\" data-visited=\\\"true\\\">@media (max-width: 0px) { .u-block-958f-1 {background-image: none}\\n.u-block-958f-2 {min-height: 106px}\\n.u-block-958f-7 {margin-top: 30px; margin-bottom: 30px}\\n.u-block-958f-8 {min-height: 100px}\\n.u-block-958f-9 {padding-top: 30px; padding-bottom: 30px; padding-left: 30px; padding-right: 30px}\\n.u-block-958f-6 {margin-top: 0px; margin-right: 0px; margin-bottom: 0px}\\n.u-block-958f-5 {margin-top: 8px; margin-right: 0px; margin-bottom: 0px; margin-left: 0px}\\n.u-block-958f-10 {min-height: 100px}\\n.u-block-958f-11 {padding-top: 30px; padding-bottom: 30px; padding-left: 30px; padding-right: 30px}\\n.u-block-958f-3 {margin-top: 0px; margin-right: auto; margin-bottom: 0px; margin-left: 0px} }</style>\\n  <style data-mode=\\\"SM\\\" data-visited=\\\"true\\\">@media (max-width: 0px) { .u-block-958f-1 {background-image: none}\\n.u-block-958f-2 {min-height: 225px}\\n.u-block-958f-7 {margin-top: 30px; margin-bottom: 30px}\\n.u-block-958f-8 {min-height: 154px}\\n.u-block-958f-9 {padding-top: 30px; padding-left: 10px; padding-right: 10px; padding-bottom: 20px}\\n.u-block-958f-6 {margin-top: 0px; margin-right: 0px; margin-bottom: 0px}\\n.u-block-958f-5 {margin-top: 8px; margin-right: 0px; margin-bottom: 0px; margin-left: 0px}\\n.u-block-958f-10 {min-height: 65px}\\n.u-block-958f-11 {padding-top: 10px; padding-bottom: 10px; padding-left: 10px; padding-right: 10px}\\n.u-block-958f-3 {margin-top: 0px; margin-right: auto; margin-bottom: 0px; margin-left: 0px} }</style>\\n  <style data-mode=\\\"XS\\\" data-visited=\\\"true\\\">@media (max-width: 0px) { .u-block-958f-1 {background-image: none}\\n.u-block-958f-2 {min-height: 121px}\\n.u-block-958f-7 {margin-top: 30px; margin-bottom: 30px}\\n.u-block-958f-8 {min-height: 100px}\\n.u-block-958f-9 {padding-top: 30px; padding-bottom: 20px; padding-left: 10px; padding-right: 10px}\\n.u-block-958f-6 {margin-top: 0px; margin-right: 0px; margin-bottom: 0px}\\n.u-block-958f-5 {margin-top: 8px; margin-right: 0px; margin-bottom: 0px; margin-left: 0px}\\n.u-block-958f-10 {min-height: 15px}\\n.u-block-958f-11 {padding-top: 10px; padding-bottom: 10px; padding-left: 10px; padding-right: 10px}\\n.u-block-958f-3 {margin-top: 0px; margin-right: auto; margin-bottom: 0px; margin-left: 0px} }</style>\\n</section>\"}}","title":"Site1","siteStyleCss":"<style id=\"color-scheme\" color-scheme=\"u15\" color-style=\"multicolor-1\">.u-body {\n--none: transparent;\n--none-darker: transparent;\n--none-r: 255;\n--none-g: 255;\n--none-b: 255;\n--none-contrast: body-color;\n--none-contrast-darker: body-color;\n--none-text-color: var(--body-color);\n--transparent: transparent;\n--transparent-darker: transparent;\n--transparent-r: 255;\n--transparent-g: 255;\n--transparent-b: 255;\n--transparent-contrast: body-color;\n--transparent-contrast-darker: body-color;\n--transparent-text-color: var(--body-color);\n--custom-color-1: #328ac9;\n--custom-color-1-darker: #2d7cb5;\n--custom-color-1-r: 50;\n--custom-color-1-g: 138;\n--custom-color-1-b: 201;\n--custom-color-1-contrast: white;\n--custom-color-1-contrast-darker: white;\n--custom-color-1-text-color: var(--body-alt-color);\n--custom-color-2: #393e46;\n--custom-color-2-darker: #33383f;\n--custom-color-2-r: 57;\n--custom-color-2-g: 62;\n--custom-color-2-b: 70;\n--custom-color-2-contrast: white;\n--custom-color-2-contrast-darker: white;\n--custom-color-2-text-color: var(--body-alt-color);\n--custom-color-3: #32efe9;\n--custom-color-3-darker: #17ede6;\n--custom-color-3-r: 50;\n--custom-color-3-g: 239;\n--custom-color-3-b: 233;\n--custom-color-3-contrast: black;\n--custom-color-3-contrast-darker: black;\n--custom-color-3-text-color: var(--body-color);\n--custom-color-4: #32e0c4;\n--custom-color-4-darker: #20d6b9;\n--custom-color-4-r: 50;\n--custom-color-4-g: 224;\n--custom-color-4-b: 196;\n--custom-color-4-contrast: black;\n--custom-color-4-contrast-darker: black;\n--custom-color-4-text-color: var(--body-color);\n--custom-color-5: #040707;\n--custom-color-5-darker: #040606;\n--custom-color-5-r: 4;\n--custom-color-5-g: 7;\n--custom-color-5-b: 7;\n--custom-color-5-contrast: white;\n--custom-color-5-contrast-darker: white;\n--custom-color-5-text-color: var(--body-alt-color);\n--custom-color-6: #190754;\n--custom-color-6-darker: #17064c;\n--custom-color-6-r: 25;\n--custom-color-6-g: 7;\n--custom-color-6-b: 84;\n--custom-color-6-contrast: white;\n--custom-color-6-contrast-darker: white;\n--custom-color-6-text-color: var(--body-alt-color);\n--custom-color-7: #6d0bce;\n--custom-color-7-darker: #620ab9;\n--custom-color-7-r: 109;\n--custom-color-7-g: 11;\n--custom-color-7-b: 206;\n--custom-color-7-contrast: white;\n--custom-color-7-contrast-darker: white;\n--custom-color-7-text-color: var(--body-alt-color);\n--custom-color-8: #110827;\n--custom-color-8-darker: #0f0723;\n--custom-color-8-r: 17;\n--custom-color-8-g: 8;\n--custom-color-8-b: 39;\n--custom-color-8-contrast: white;\n--custom-color-8-contrast-darker: white;\n--custom-color-8-text-color: var(--body-alt-color);\n--custom-color-9: #8ce8e3;\n--custom-color-9-darker: #6de2db;\n--custom-color-9-r: 140;\n--custom-color-9-g: 232;\n--custom-color-9-b: 227;\n--custom-color-9-contrast: black;\n--custom-color-9-contrast-darker: black;\n--custom-color-9-text-color: var(--body-color);\n--custom-color-10: #014b4b;\n--custom-color-10-darker: #014444;\n--custom-color-10-r: 1;\n--custom-color-10-g: 75;\n--custom-color-10-b: 75;\n--custom-color-10-contrast: white;\n--custom-color-10-contrast-darker: white;\n--custom-color-10-text-color: var(--body-alt-color);\n--custom-color-11: #060015;\n--custom-color-11-darker: #050013;\n--custom-color-11-r: 6;\n--custom-color-11-g: 0;\n--custom-color-11-b: 21;\n--custom-color-11-contrast: white;\n--custom-color-11-contrast-darker: white;\n--custom-color-11-text-color: var(--body-alt-color);\n--custom-color-12: #291c47;\n--custom-color-12-darker: #251940;\n--custom-color-12-r: 41;\n--custom-color-12-g: 28;\n--custom-color-12-b: 71;\n--custom-color-12-contrast: white;\n--custom-color-12-contrast-darker: white;\n--custom-color-12-text-color: var(--body-alt-color);\n--custom-color-13: #1d1531;\n--custom-color-13-darker: #1a132c;\n--custom-color-13-r: 29;\n--custom-color-13-g: 21;\n--custom-color-13-b: 49;\n--custom-color-13-contrast: white;\n--custom-color-13-contrast-darker: white;\n--custom-color-13-text-color: var(--body-alt-color);\n--custom-color-14: #0d002f;\n--custom-color-14-darker: #0c002a;\n--custom-color-14-r: 13;\n--custom-color-14-g: 0;\n--custom-color-14-b: 47;\n--custom-color-14-contrast: white;\n--custom-color-14-contrast-darker: white;\n--custom-color-14-text-color: var(--body-alt-color);\n--custom-color-15: #a2fffa;\n--custom-color-15-darker: #78fff8;\n--custom-color-15-r: 162;\n--custom-color-15-g: 255;\n--custom-color-15-b: 250;\n--custom-color-15-contrast: black;\n--custom-color-15-contrast-darker: black;\n--custom-color-15-text-color: var(--body-color);\n--custom-color-16: #00e2ec;\n--custom-color-16-darker: #00cbd4;\n--custom-color-16-r: 0;\n--custom-color-16-g: 226;\n--custom-color-16-b: 236;\n--custom-color-16-contrast: black;\n--custom-color-16-contrast-darker: white;\n--custom-color-16-text-color: var(--body-color);\n--body-color: #111111;\n--body-color-darker: #0f0f0f;\n--body-color-r: 17;\n--body-color-g: 17;\n--body-color-b: 17;\n--body-color-contrast: white;\n--body-color-contrast-darker: white;\n--body-color-text-color: var(--body-alt-color);\n--body-alt-color: #ffffff;\n--body-alt-color-darker: #e6e6e6;\n--body-alt-color-r: 255;\n--body-alt-color-g: 255;\n--body-alt-color-b: 255;\n--body-alt-color-contrast: black;\n--body-alt-color-contrast-darker: black;\n--body-alt-color-text-color: var(--body-color);\n--bg-color: #ffffff;\n--bg-color-darker: #e6e6e6;\n--bg-color-r: 255;\n--bg-color-g: 255;\n--bg-color-b: 255;\n--bg-color-contrast: black;\n--bg-color-contrast-darker: black;\n--bg-color-text-color: var(--body-color);\n--palette-1-base: #478ac9;\n--palette-1-base-darker: #387cbd;\n--palette-1-base-r: 71;\n--palette-1-base-g: 138;\n--palette-1-base-b: 201;\n--palette-1-base-contrast: white;\n--palette-1-base-contrast-darker: white;\n--palette-1-base-text-color: var(--body-alt-color);\n--palette-1-dark-3: #292e33;\n--palette-1-dark-3-darker: #25292e;\n--palette-1-dark-3-r: 41;\n--palette-1-dark-3-g: 46;\n--palette-1-dark-3-b: 51;\n--palette-1-dark-3-contrast: white;\n--palette-1-dark-3-contrast-darker: white;\n--palette-1-dark-3-text-color: var(--body-alt-color);\n--palette-1-dark-2: #425465;\n--palette-1-dark-2-darker: #3b4c5b;\n--palette-1-dark-2-r: 66;\n--palette-1-dark-2-g: 84;\n--palette-1-dark-2-b: 101;\n--palette-1-dark-2-contrast: white;\n--palette-1-dark-2-contrast-darker: white;\n--palette-1-dark-2-text-color: var(--body-alt-color);\n--palette-1-dark-1: #4c7397;\n--palette-1-dark-1-darker: #446888;\n--palette-1-dark-1-r: 76;\n--palette-1-dark-1-g: 115;\n--palette-1-dark-1-b: 151;\n--palette-1-dark-1-contrast: white;\n--palette-1-dark-1-contrast-darker: white;\n--palette-1-dark-1-text-color: var(--body-alt-color);\n--palette-1: #478ac9;\n--palette-1-darker: #387cbd;\n--palette-1-r: 71;\n--palette-1-g: 138;\n--palette-1-b: 201;\n--palette-1-contrast: white;\n--palette-1-contrast-darker: white;\n--palette-1-text-color: var(--body-alt-color);\n--palette-1-light-1: #77aad9;\n--palette-1-light-1-darker: #5d9ad2;\n--palette-1-light-1-r: 119;\n--palette-1-light-1-g: 170;\n--palette-1-light-1-b: 217;\n--palette-1-light-1-contrast: white;\n--palette-1-light-1-contrast-darker: white;\n--palette-1-light-1-text-color: var(--body-alt-color);\n--palette-1-light-2: #adcce9;\n--palette-1-light-2-darker: #8db8e0;\n--palette-1-light-2-r: 173;\n--palette-1-light-2-g: 204;\n--palette-1-light-2-b: 233;\n--palette-1-light-2-contrast: black;\n--palette-1-light-2-contrast-darker: white;\n--palette-1-light-2-text-color: var(--body-color);\n--palette-1-light-3: #e9f2fa;\n--palette-1-light-3-darker: #c2dbf1;\n--palette-1-light-3-r: 233;\n--palette-1-light-3-g: 242;\n--palette-1-light-3-b: 250;\n--palette-1-light-3-contrast: black;\n--palette-1-light-3-contrast-darker: black;\n--palette-1-light-3-text-color: var(--body-color);\n--palette-2-base: #db545a;\n--palette-2-base-darker: #d63b42;\n--palette-2-base-r: 219;\n--palette-2-base-g: 84;\n--palette-2-base-b: 90;\n--palette-2-base-contrast: white;\n--palette-2-base-contrast-darker: white;\n--palette-2-base-text-color: var(--body-alt-color);\n--palette-2-dark-3: #332929;\n--palette-2-dark-3-darker: #2e2525;\n--palette-2-dark-3-r: 51;\n--palette-2-dark-3-g: 41;\n--palette-2-dark-3-b: 41;\n--palette-2-dark-3-contrast: white;\n--palette-2-dark-3-contrast-darker: white;\n--palette-2-dark-3-text-color: var(--body-alt-color);\n--palette-2-dark-2: #6b4748;\n--palette-2-dark-2-darker: #604041;\n--palette-2-dark-2-r: 107;\n--palette-2-dark-2-g: 71;\n--palette-2-dark-2-b: 72;\n--palette-2-dark-2-contrast: white;\n--palette-2-dark-2-contrast-darker: white;\n--palette-2-dark-2-text-color: var(--body-alt-color);\n--palette-2-dark-1: #a35559;\n--palette-2-dark-1-darker: #934c50;\n--palette-2-dark-1-r: 163;\n--palette-2-dark-1-g: 85;\n--palette-2-dark-1-b: 89;\n--palette-2-dark-1-contrast: white;\n--palette-2-dark-1-contrast-darker: white;\n--palette-2-dark-1-text-color: var(--body-alt-color);\n--palette-2: #db545a;\n--palette-2-darker: #d63b42;\n--palette-2-r: 219;\n--palette-2-g: 84;\n--palette-2-b: 90;\n--palette-2-contrast: white;\n--palette-2-contrast-darker: white;\n--palette-2-text-color: var(--body-alt-color);\n--palette-2-light-1: #e68387;\n--palette-2-light-1-darker: #e0656a;\n--palette-2-light-1-r: 230;\n--palette-2-light-1-g: 131;\n--palette-2-light-1-b: 135;\n--palette-2-light-1-contrast: white;\n--palette-2-light-1-contrast-darker: white;\n--palette-2-light-1-text-color: var(--body-alt-color);\n--palette-2-light-2: #f1b5b8;\n--palette-2-light-2-darker: #ea9296;\n--palette-2-light-2-r: 241;\n--palette-2-light-2-g: 181;\n--palette-2-light-2-b: 184;\n--palette-2-light-2-contrast: black;\n--palette-2-light-2-contrast-darker: white;\n--palette-2-light-2-text-color: var(--body-color);\n--palette-2-light-3: #fbeced;\n--palette-2-light-3-darker: #f3c4c7;\n--palette-2-light-3-r: 251;\n--palette-2-light-3-g: 236;\n--palette-2-light-3-b: 237;\n--palette-2-light-3-contrast: black;\n--palette-2-light-3-contrast-darker: black;\n--palette-2-light-3-text-color: var(--body-color);\n--palette-3-base: #f1c50e;\n--palette-3-base-darker: #d9b10d;\n--palette-3-base-r: 241;\n--palette-3-base-g: 197;\n--palette-3-base-b: 14;\n--palette-3-base-contrast: black;\n--palette-3-base-contrast-darker: white;\n--palette-3-base-text-color: var(--body-color);\n--palette-3-dark-3: #333129;\n--palette-3-dark-3-darker: #2e2c25;\n--palette-3-dark-3-r: 51;\n--palette-3-dark-3-g: 49;\n--palette-3-dark-3-b: 41;\n--palette-3-dark-3-contrast: white;\n--palette-3-dark-3-contrast-darker: white;\n--palette-3-dark-3-text-color: var(--body-alt-color);\n--palette-3-dark-2: #72683f;\n--palette-3-dark-2-darker: #675e39;\n--palette-3-dark-2-r: 114;\n--palette-3-dark-2-g: 104;\n--palette-3-dark-2-b: 63;\n--palette-3-dark-2-contrast: white;\n--palette-3-dark-2-contrast-darker: white;\n--palette-3-dark-2-text-color: var(--body-alt-color);\n--palette-3-dark-1: #b29a36;\n--palette-3-dark-1-darker: #a08b31;\n--palette-3-dark-1-r: 178;\n--palette-3-dark-1-g: 154;\n--palette-3-dark-1-b: 54;\n--palette-3-dark-1-contrast: white;\n--palette-3-dark-1-contrast-darker: white;\n--palette-3-dark-1-text-color: var(--body-alt-color);\n--palette-3: #f1c50e;\n--palette-3-darker: #d9b10d;\n--palette-3-r: 241;\n--palette-3-g: 197;\n--palette-3-b: 14;\n--palette-3-contrast: black;\n--palette-3-contrast-darker: white;\n--palette-3-text-color: var(--body-color);\n--palette-3-light-1: #f5d654;\n--palette-3-light-1-darker: #f3cf35;\n--palette-3-light-1-r: 245;\n--palette-3-light-1-g: 214;\n--palette-3-light-1-b: 84;\n--palette-3-light-1-contrast: black;\n--palette-3-light-1-contrast-darker: black;\n--palette-3-light-1-text-color: var(--body-color);\n--palette-3-light-2: #f9e79b;\n--palette-3-light-2-darker: #f7de75;\n--palette-3-light-2-r: 249;\n--palette-3-light-2-g: 231;\n--palette-3-light-2-b: 155;\n--palette-3-light-2-contrast: black;\n--palette-3-light-2-contrast-darker: black;\n--palette-3-light-2-text-color: var(--body-color);\n--palette-3-light-3: #fef9e6;\n--palette-3-light-3-darker: #fceeb7;\n--palette-3-light-3-r: 254;\n--palette-3-light-3-g: 249;\n--palette-3-light-3-b: 230;\n--palette-3-light-3-contrast: black;\n--palette-3-light-3-contrast-darker: black;\n--palette-3-light-3-text-color: var(--body-color);\n--palette-4-base: #2cccc4;\n--palette-4-base-darker: #28b8b0;\n--palette-4-base-r: 44;\n--palette-4-base-g: 204;\n--palette-4-base-b: 196;\n--palette-4-base-contrast: white;\n--palette-4-base-contrast-darker: white;\n--palette-4-base-text-color: var(--body-alt-color);\n--palette-4-dark-3: #293332;\n--palette-4-dark-3-darker: #252e2d;\n--palette-4-dark-3-r: 41;\n--palette-4-dark-3-g: 51;\n--palette-4-dark-3-b: 50;\n--palette-4-dark-3-contrast: white;\n--palette-4-dark-3-contrast-darker: white;\n--palette-4-dark-3-text-color: var(--body-alt-color);\n--palette-4-dark-2: #41807c;\n--palette-4-dark-2-darker: #3a7370;\n--palette-4-dark-2-r: 65;\n--palette-4-dark-2-g: 128;\n--palette-4-dark-2-b: 124;\n--palette-4-dark-2-contrast: white;\n--palette-4-dark-2-contrast-darker: white;\n--palette-4-dark-2-text-color: var(--body-alt-color);\n--palette-4-dark-1: #2cccc4;\n--palette-4-dark-1-darker: #28b8b0;\n--palette-4-dark-1-r: 44;\n--palette-4-dark-1-g: 204;\n--palette-4-dark-1-b: 196;\n--palette-4-dark-1-contrast: white;\n--palette-4-dark-1-contrast-darker: white;\n--palette-4-dark-1-text-color: var(--body-alt-color);\n--palette-4: #3be8e0;\n--palette-4-darker: #21e5dc;\n--palette-4-r: 59;\n--palette-4-g: 232;\n--palette-4-b: 224;\n--palette-4-contrast: black;\n--palette-4-contrast-darker: black;\n--palette-4-text-color: var(--body-color);\n--palette-4-light-1: #72efe9;\n--palette-4-light-1-darker: #52ebe4;\n--palette-4-light-1-r: 114;\n--palette-4-light-1-g: 239;\n--palette-4-light-1-b: 233;\n--palette-4-light-1-contrast: black;\n--palette-4-light-1-contrast-darker: black;\n--palette-4-light-1-text-color: var(--body-color);\n--palette-4-light-2: #adf6f2;\n--palette-4-light-2-darker: #87f2ec;\n--palette-4-light-2-r: 173;\n--palette-4-light-2-g: 246;\n--palette-4-light-2-b: 242;\n--palette-4-light-2-contrast: black;\n--palette-4-light-2-contrast-darker: black;\n--palette-4-light-2-text-color: var(--body-color);\n--palette-4-light-3: #eafdfc;\n--palette-4-light-3-darker: #bef9f6;\n--palette-4-light-3-r: 234;\n--palette-4-light-3-g: 253;\n--palette-4-light-3-b: 252;\n--palette-4-light-3-contrast: black;\n--palette-4-light-3-contrast-darker: black;\n--palette-4-light-3-text-color: var(--body-color);\n--palette-5-base: #b9c1cc;\n--palette-5-base-darker: #a2adbc;\n--palette-5-base-r: 185;\n--palette-5-base-g: 193;\n--palette-5-base-b: 204;\n--palette-5-base-contrast: black;\n--palette-5-base-contrast-darker: white;\n--palette-5-base-text-color: var(--body-color);\n--palette-5-dark-3: #292d33;\n--palette-5-dark-3-darker: #25292e;\n--palette-5-dark-3-r: 41;\n--palette-5-dark-3-g: 45;\n--palette-5-dark-3-b: 51;\n--palette-5-dark-3-contrast: white;\n--palette-5-dark-3-contrast-darker: white;\n--palette-5-dark-3-text-color: var(--body-alt-color);\n--palette-5-dark-2: #555c66;\n--palette-5-dark-2-darker: #4d535c;\n--palette-5-dark-2-r: 85;\n--palette-5-dark-2-g: 92;\n--palette-5-dark-2-b: 102;\n--palette-5-dark-2-contrast: white;\n--palette-5-dark-2-contrast-darker: white;\n--palette-5-dark-2-text-color: var(--body-alt-color);\n--palette-5-dark-1: #858e99;\n--palette-5-dark-1-darker: #75808c;\n--palette-5-dark-1-r: 133;\n--palette-5-dark-1-g: 142;\n--palette-5-dark-1-b: 153;\n--palette-5-dark-1-contrast: white;\n--palette-5-dark-1-contrast-darker: white;\n--palette-5-dark-1-text-color: var(--body-alt-color);\n--palette-5: #b9c1cc;\n--palette-5-darker: #a2adbc;\n--palette-5-r: 185;\n--palette-5-g: 193;\n--palette-5-b: 204;\n--palette-5-contrast: black;\n--palette-5-contrast-darker: white;\n--palette-5-text-color: var(--body-color);\n--palette-5-light-1: #ccd3db;\n--palette-5-light-1-darker: #b3bec9;\n--palette-5-light-1-r: 204;\n--palette-5-light-1-g: 211;\n--palette-5-light-1-b: 219;\n--palette-5-light-1-contrast: black;\n--palette-5-light-1-contrast-darker: black;\n--palette-5-light-1-text-color: var(--body-color);\n--palette-5-light-2: #e0e5eb;\n--palette-5-light-2-darker: #c4ced9;\n--palette-5-light-2-r: 224;\n--palette-5-light-2-g: 229;\n--palette-5-light-2-b: 235;\n--palette-5-light-2-contrast: black;\n--palette-5-light-2-contrast-darker: black;\n--palette-5-light-2-text-color: var(--body-color);\n--palette-5-light-3: #f5f7fa;\n--palette-5-light-3-darker: #d4dde9;\n--palette-5-light-3-r: 245;\n--palette-5-light-3-g: 247;\n--palette-5-light-3-b: 250;\n--palette-5-light-3-contrast: black;\n--palette-5-light-3-contrast-darker: black;\n--palette-5-light-3-text-color: var(--body-color);\n--grey-40: #999999;\n--grey-40-darker: #8a8a8a;\n--grey-40-r: 153;\n--grey-40-g: 153;\n--grey-40-b: 153;\n--grey-40-contrast: white;\n--grey-40-contrast-darker: white;\n--grey-40-text-color: var(--body-alt-color);\n--grey-30: #b3b3b3;\n--grey-30-darker: #a1a1a1;\n--grey-30-r: 179;\n--grey-30-g: 179;\n--grey-30-b: 179;\n--grey-30-contrast: white;\n--grey-30-contrast-darker: white;\n--grey-30-text-color: var(--body-alt-color);\n--grey-25: #c0c0c0;\n--grey-25-darker: #adadad;\n--grey-25-r: 192;\n--grey-25-g: 192;\n--grey-25-b: 192;\n--grey-25-contrast: black;\n--grey-25-contrast-darker: white;\n--grey-25-text-color: var(--body-color);\n--white: #ffffff;\n--white-darker: #e6e6e6;\n--white-r: 255;\n--white-g: 255;\n--white-b: 255;\n--white-contrast: black;\n--white-contrast-darker: black;\n--white-text-color: var(--body-color);\n--grey-15: #d9d9d9;\n--grey-15-darker: #c3c3c3;\n--grey-15-r: 217;\n--grey-15-g: 217;\n--grey-15-b: 217;\n--grey-15-contrast: black;\n--grey-15-contrast-darker: black;\n--grey-15-text-color: var(--body-color);\n--grey-10: #e5e5e5;\n--grey-10-darker: #cecece;\n--grey-10-r: 229;\n--grey-10-g: 229;\n--grey-10-b: 229;\n--grey-10-contrast: black;\n--grey-10-contrast-darker: black;\n--grey-10-text-color: var(--body-color);\n--grey-5: #f2f2f2;\n--grey-5-darker: #dadada;\n--grey-5-r: 242;\n--grey-5-g: 242;\n--grey-5-b: 242;\n--grey-5-contrast: black;\n--grey-5-contrast-darker: black;\n--grey-5-text-color: var(--body-color);\n--grey-90: #1a1a1a;\n--grey-90-darker: #171717;\n--grey-90-r: 26;\n--grey-90-g: 26;\n--grey-90-b: 26;\n--grey-90-contrast: white;\n--grey-90-contrast-darker: white;\n--grey-90-text-color: var(--body-alt-color);\n--grey-80: #333333;\n--grey-80-darker: #2e2e2e;\n--grey-80-r: 51;\n--grey-80-g: 51;\n--grey-80-b: 51;\n--grey-80-contrast: white;\n--grey-80-contrast-darker: white;\n--grey-80-text-color: var(--body-alt-color);\n--grey-75: #404040;\n--grey-75-darker: #3a3a3a;\n--grey-75-r: 64;\n--grey-75-g: 64;\n--grey-75-b: 64;\n--grey-75-contrast: white;\n--grey-75-contrast-darker: white;\n--grey-75-text-color: var(--body-alt-color);\n--black: #000000;\n--black-darker: #000000;\n--black-r: 0;\n--black-g: 0;\n--black-b: 0;\n--black-contrast: white;\n--black-contrast-darker: white;\n--black-text-color: var(--body-alt-color);\n--grey-70: #4d4d4d;\n--grey-70-darker: #454545;\n--grey-70-r: 77;\n--grey-70-g: 77;\n--grey-70-b: 77;\n--grey-70-contrast: white;\n--grey-70-contrast-darker: white;\n--grey-70-text-color: var(--body-alt-color);\n--grey-60: #666666;\n--grey-60-darker: #5c5c5c;\n--grey-60-r: 102;\n--grey-60-g: 102;\n--grey-60-b: 102;\n--grey-60-contrast: white;\n--grey-60-contrast-darker: white;\n--grey-60-text-color: var(--body-alt-color);\n--grey-50: #808080;\n--grey-50-darker: #737373;\n--grey-50-r: 128;\n--grey-50-g: 128;\n--grey-50-b: 128;\n--grey-50-contrast: white;\n--grey-50-contrast-darker: white;\n--grey-50-text-color: var(--body-alt-color);\n--grey-dark-3: #212121;\n--grey-dark-3-darker: #1e1e1e;\n--grey-dark-3-r: 33;\n--grey-dark-3-g: 33;\n--grey-dark-3-b: 33;\n--grey-dark-3-contrast: white;\n--grey-dark-3-contrast-darker: white;\n--grey-dark-3-text-color: var(--body-alt-color);\n--grey-dark-2: #333333;\n--grey-dark-2-darker: #2e2e2e;\n--grey-dark-2-r: 51;\n--grey-dark-2-g: 51;\n--grey-dark-2-b: 51;\n--grey-dark-2-contrast: white;\n--grey-dark-2-contrast-darker: white;\n--grey-dark-2-text-color: var(--body-alt-color);\n--grey-dark-1: #454545;\n--grey-dark-1-darker: #3e3e3e;\n--grey-dark-1-r: 69;\n--grey-dark-1-g: 69;\n--grey-dark-1-b: 69;\n--grey-dark-1-contrast: white;\n--grey-dark-1-contrast-darker: white;\n--grey-dark-1-text-color: var(--body-alt-color);\n--grey: #b3b3b3;\n--grey-darker: #a1a1a1;\n--grey-r: 179;\n--grey-g: 179;\n--grey-b: 179;\n--grey-contrast: white;\n--grey-contrast-darker: white;\n--grey-text-color: var(--body-alt-color);\n--grey-light-1: #d9d9d9;\n--grey-light-1-darker: #c3c3c3;\n--grey-light-1-r: 217;\n--grey-light-1-g: 217;\n--grey-light-1-b: 217;\n--grey-light-1-contrast: black;\n--grey-light-1-contrast-darker: black;\n--grey-light-1-text-color: var(--body-color);\n--grey-light-2: #eeeeee;\n--grey-light-2-darker: #d6d6d6;\n--grey-light-2-r: 238;\n--grey-light-2-g: 238;\n--grey-light-2-b: 238;\n--grey-light-2-contrast: black;\n--grey-light-2-contrast-darker: black;\n--grey-light-2-text-color: var(--body-color);\n--grey-light-3: #f6f6f6;\n--grey-light-3-darker: #dddddd;\n--grey-light-3-r: 246;\n--grey-light-3-g: 246;\n--grey-light-3-b: 246;\n--grey-light-3-contrast: black;\n--grey-light-3-contrast-darker: black;\n--grey-light-3-text-color: var(--body-color);\n--color-1-base: #478ac9;\n--color-1-base-darker: #387cbd;\n--color-1-base-r: 71;\n--color-1-base-g: 138;\n--color-1-base-b: 201;\n--color-1-base-contrast: white;\n--color-1-base-contrast-darker: white;\n--color-1-base-text-color: var(--body-alt-color);\n--color-1-dark-3: #292e33;\n--color-1-dark-3-darker: #25292e;\n--color-1-dark-3-r: 41;\n--color-1-dark-3-g: 46;\n--color-1-dark-3-b: 51;\n--color-1-dark-3-contrast: white;\n--color-1-dark-3-contrast-darker: white;\n--color-1-dark-3-text-color: var(--body-alt-color);\n--color-1-dark-2: #425465;\n--color-1-dark-2-darker: #3b4c5b;\n--color-1-dark-2-r: 66;\n--color-1-dark-2-g: 84;\n--color-1-dark-2-b: 101;\n--color-1-dark-2-contrast: white;\n--color-1-dark-2-contrast-darker: white;\n--color-1-dark-2-text-color: var(--body-alt-color);\n--color-1-dark-1: #4c7397;\n--color-1-dark-1-darker: #446888;\n--color-1-dark-1-r: 76;\n--color-1-dark-1-g: 115;\n--color-1-dark-1-b: 151;\n--color-1-dark-1-contrast: white;\n--color-1-dark-1-contrast-darker: white;\n--color-1-dark-1-text-color: var(--body-alt-color);\n--color-1: #478ac9;\n--color-1-darker: #387cbd;\n--color-1-r: 71;\n--color-1-g: 138;\n--color-1-b: 201;\n--color-1-contrast: white;\n--color-1-contrast-darker: white;\n--color-1-text-color: var(--body-alt-color);\n--color-1-light-1: #77aad9;\n--color-1-light-1-darker: #5d9ad2;\n--color-1-light-1-r: 119;\n--color-1-light-1-g: 170;\n--color-1-light-1-b: 217;\n--color-1-light-1-contrast: white;\n--color-1-light-1-contrast-darker: white;\n--color-1-light-1-text-color: var(--body-alt-color);\n--color-1-light-2: #adcce9;\n--color-1-light-2-darker: #8db8e0;\n--color-1-light-2-r: 173;\n--color-1-light-2-g: 204;\n--color-1-light-2-b: 233;\n--color-1-light-2-contrast: black;\n--color-1-light-2-contrast-darker: white;\n--color-1-light-2-text-color: var(--body-color);\n--color-1-light-3: #e9f2fa;\n--color-1-light-3-darker: #c2dbf1;\n--color-1-light-3-r: 233;\n--color-1-light-3-g: 242;\n--color-1-light-3-b: 250;\n--color-1-light-3-contrast: black;\n--color-1-light-3-contrast-darker: black;\n--color-1-light-3-text-color: var(--body-color);\n--color-2-base: #db545a;\n--color-2-base-darker: #d63b42;\n--color-2-base-r: 219;\n--color-2-base-g: 84;\n--color-2-base-b: 90;\n--color-2-base-contrast: white;\n--color-2-base-contrast-darker: white;\n--color-2-base-text-color: var(--body-alt-color);\n--color-2-dark-3: #332929;\n--color-2-dark-3-darker: #2e2525;\n--color-2-dark-3-r: 51;\n--color-2-dark-3-g: 41;\n--color-2-dark-3-b: 41;\n--color-2-dark-3-contrast: white;\n--color-2-dark-3-contrast-darker: white;\n--color-2-dark-3-text-color: var(--body-alt-color);\n--color-2-dark-2: #6b4748;\n--color-2-dark-2-darker: #604041;\n--color-2-dark-2-r: 107;\n--color-2-dark-2-g: 71;\n--color-2-dark-2-b: 72;\n--color-2-dark-2-contrast: white;\n--color-2-dark-2-contrast-darker: white;\n--color-2-dark-2-text-color: var(--body-alt-color);\n--color-2-dark-1: #a35559;\n--color-2-dark-1-darker: #934c50;\n--color-2-dark-1-r: 163;\n--color-2-dark-1-g: 85;\n--color-2-dark-1-b: 89;\n--color-2-dark-1-contrast: white;\n--color-2-dark-1-contrast-darker: white;\n--color-2-dark-1-text-color: var(--body-alt-color);\n--color-2: #db545a;\n--color-2-darker: #d63b42;\n--color-2-r: 219;\n--color-2-g: 84;\n--color-2-b: 90;\n--color-2-contrast: white;\n--color-2-contrast-darker: white;\n--color-2-text-color: var(--body-alt-color);\n--color-2-light-1: #e68387;\n--color-2-light-1-darker: #e0656a;\n--color-2-light-1-r: 230;\n--color-2-light-1-g: 131;\n--color-2-light-1-b: 135;\n--color-2-light-1-contrast: white;\n--color-2-light-1-contrast-darker: white;\n--color-2-light-1-text-color: var(--body-alt-color);\n--color-2-light-2: #f1b5b8;\n--color-2-light-2-darker: #ea9296;\n--color-2-light-2-r: 241;\n--color-2-light-2-g: 181;\n--color-2-light-2-b: 184;\n--color-2-light-2-contrast: black;\n--color-2-light-2-contrast-darker: white;\n--color-2-light-2-text-color: var(--body-color);\n--color-2-light-3: #fbeced;\n--color-2-light-3-darker: #f3c4c7;\n--color-2-light-3-r: 251;\n--color-2-light-3-g: 236;\n--color-2-light-3-b: 237;\n--color-2-light-3-contrast: black;\n--color-2-light-3-contrast-darker: black;\n--color-2-light-3-text-color: var(--body-color);\n--color-3-base: #f1c50e;\n--color-3-base-darker: #d9b10d;\n--color-3-base-r: 241;\n--color-3-base-g: 197;\n--color-3-base-b: 14;\n--color-3-base-contrast: black;\n--color-3-base-contrast-darker: white;\n--color-3-base-text-color: var(--body-color);\n--color-3-dark-3: #333129;\n--color-3-dark-3-darker: #2e2c25;\n--color-3-dark-3-r: 51;\n--color-3-dark-3-g: 49;\n--color-3-dark-3-b: 41;\n--color-3-dark-3-contrast: white;\n--color-3-dark-3-contrast-darker: white;\n--color-3-dark-3-text-color: var(--body-alt-color);\n--color-3-dark-2: #72683f;\n--color-3-dark-2-darker: #675e39;\n--color-3-dark-2-r: 114;\n--color-3-dark-2-g: 104;\n--color-3-dark-2-b: 63;\n--color-3-dark-2-contrast: white;\n--color-3-dark-2-contrast-darker: white;\n--color-3-dark-2-text-color: var(--body-alt-color);\n--color-3-dark-1: #b29a36;\n--color-3-dark-1-darker: #a08b31;\n--color-3-dark-1-r: 178;\n--color-3-dark-1-g: 154;\n--color-3-dark-1-b: 54;\n--color-3-dark-1-contrast: white;\n--color-3-dark-1-contrast-darker: white;\n--color-3-dark-1-text-color: var(--body-alt-color);\n--color-3: #f1c50e;\n--color-3-darker: #d9b10d;\n--color-3-r: 241;\n--color-3-g: 197;\n--color-3-b: 14;\n--color-3-contrast: black;\n--color-3-contrast-darker: white;\n--color-3-text-color: var(--body-color);\n--color-3-light-1: #f5d654;\n--color-3-light-1-darker: #f3cf35;\n--color-3-light-1-r: 245;\n--color-3-light-1-g: 214;\n--color-3-light-1-b: 84;\n--color-3-light-1-contrast: black;\n--color-3-light-1-contrast-darker: black;\n--color-3-light-1-text-color: var(--body-color);\n--color-3-light-2: #f9e79b;\n--color-3-light-2-darker: #f7de75;\n--color-3-light-2-r: 249;\n--color-3-light-2-g: 231;\n--color-3-light-2-b: 155;\n--color-3-light-2-contrast: black;\n--color-3-light-2-contrast-darker: black;\n--color-3-light-2-text-color: var(--body-color);\n--color-3-light-3: #fef9e6;\n--color-3-light-3-darker: #fceeb7;\n--color-3-light-3-r: 254;\n--color-3-light-3-g: 249;\n--color-3-light-3-b: 230;\n--color-3-light-3-contrast: black;\n--color-3-light-3-contrast-darker: black;\n--color-3-light-3-text-color: var(--body-color);\n--color-4-base: #2cccc4;\n--color-4-base-darker: #28b8b0;\n--color-4-base-r: 44;\n--color-4-base-g: 204;\n--color-4-base-b: 196;\n--color-4-base-contrast: white;\n--color-4-base-contrast-darker: white;\n--color-4-base-text-color: var(--body-alt-color);\n--color-4-dark-3: #293332;\n--color-4-dark-3-darker: #252e2d;\n--color-4-dark-3-r: 41;\n--color-4-dark-3-g: 51;\n--color-4-dark-3-b: 50;\n--color-4-dark-3-contrast: white;\n--color-4-dark-3-contrast-darker: white;\n--color-4-dark-3-text-color: var(--body-alt-color);\n--color-4-dark-2: #41807c;\n--color-4-dark-2-darker: #3a7370;\n--color-4-dark-2-r: 65;\n--color-4-dark-2-g: 128;\n--color-4-dark-2-b: 124;\n--color-4-dark-2-contrast: white;\n--color-4-dark-2-contrast-darker: white;\n--color-4-dark-2-text-color: var(--body-alt-color);\n--color-4-dark-1: #2cccc4;\n--color-4-dark-1-darker: #28b8b0;\n--color-4-dark-1-r: 44;\n--color-4-dark-1-g: 204;\n--color-4-dark-1-b: 196;\n--color-4-dark-1-contrast: white;\n--color-4-dark-1-contrast-darker: white;\n--color-4-dark-1-text-color: var(--body-alt-color);\n--color-4: #3be8e0;\n--color-4-darker: #21e5dc;\n--color-4-r: 59;\n--color-4-g: 232;\n--color-4-b: 224;\n--color-4-contrast: black;\n--color-4-contrast-darker: black;\n--color-4-text-color: var(--body-color);\n--color-4-light-1: #72efe9;\n--color-4-light-1-darker: #52ebe4;\n--color-4-light-1-r: 114;\n--color-4-light-1-g: 239;\n--color-4-light-1-b: 233;\n--color-4-light-1-contrast: black;\n--color-4-light-1-contrast-darker: black;\n--color-4-light-1-text-color: var(--body-color);\n--color-4-light-2: #adf6f2;\n--color-4-light-2-darker: #87f2ec;\n--color-4-light-2-r: 173;\n--color-4-light-2-g: 246;\n--color-4-light-2-b: 242;\n--color-4-light-2-contrast: black;\n--color-4-light-2-contrast-darker: black;\n--color-4-light-2-text-color: var(--body-color);\n--color-4-light-3: #eafdfc;\n--color-4-light-3-darker: #bef9f6;\n--color-4-light-3-r: 234;\n--color-4-light-3-g: 253;\n--color-4-light-3-b: 252;\n--color-4-light-3-contrast: black;\n--color-4-light-3-contrast-darker: black;\n--color-4-light-3-text-color: var(--body-color);\n--color-5-base: #b9c1cc;\n--color-5-base-darker: #a2adbc;\n--color-5-base-r: 185;\n--color-5-base-g: 193;\n--color-5-base-b: 204;\n--color-5-base-contrast: black;\n--color-5-base-contrast-darker: white;\n--color-5-base-text-color: var(--body-color);\n--color-5-dark-3: #292d33;\n--color-5-dark-3-darker: #25292e;\n--color-5-dark-3-r: 41;\n--color-5-dark-3-g: 45;\n--color-5-dark-3-b: 51;\n--color-5-dark-3-contrast: white;\n--color-5-dark-3-contrast-darker: white;\n--color-5-dark-3-text-color: var(--body-alt-color);\n--color-5-dark-2: #555c66;\n--color-5-dark-2-darker: #4d535c;\n--color-5-dark-2-r: 85;\n--color-5-dark-2-g: 92;\n--color-5-dark-2-b: 102;\n--color-5-dark-2-contrast: white;\n--color-5-dark-2-contrast-darker: white;\n--color-5-dark-2-text-color: var(--body-alt-color);\n--color-5-dark-1: #858e99;\n--color-5-dark-1-darker: #75808c;\n--color-5-dark-1-r: 133;\n--color-5-dark-1-g: 142;\n--color-5-dark-1-b: 153;\n--color-5-dark-1-contrast: white;\n--color-5-dark-1-contrast-darker: white;\n--color-5-dark-1-text-color: var(--body-alt-color);\n--color-5: #b9c1cc;\n--color-5-darker: #a2adbc;\n--color-5-r: 185;\n--color-5-g: 193;\n--color-5-b: 204;\n--color-5-contrast: black;\n--color-5-contrast-darker: white;\n--color-5-text-color: var(--body-color);\n--color-5-light-1: #ccd3db;\n--color-5-light-1-darker: #b3bec9;\n--color-5-light-1-r: 204;\n--color-5-light-1-g: 211;\n--color-5-light-1-b: 219;\n--color-5-light-1-contrast: black;\n--color-5-light-1-contrast-darker: black;\n--color-5-light-1-text-color: var(--body-color);\n--color-5-light-2: #e0e5eb;\n--color-5-light-2-darker: #c4ced9;\n--color-5-light-2-r: 224;\n--color-5-light-2-g: 229;\n--color-5-light-2-b: 235;\n--color-5-light-2-contrast: black;\n--color-5-light-2-contrast-darker: black;\n--color-5-light-2-text-color: var(--body-color);\n--color-5-light-3: #f5f7fa;\n--color-5-light-3-darker: #d4dde9;\n--color-5-light-3-r: 245;\n--color-5-light-3-g: 247;\n--color-5-light-3-b: 250;\n--color-5-light-3-contrast: black;\n--color-5-light-3-contrast-darker: black;\n--color-5-light-3-text-color: var(--body-color);\n--white-contrast: var(--body-color);\n--shading-contrast: var(--body-alt-color);\n--bg-contrast: var(--body-color);\n}.u-custom-color-1,\n        .u-body.u-custom-color-1,\n        section.u-custom-color-1:before,\n        .u-custom-color-1 > .u-audio-main-layout-wrapper:before,\n        .u-custom-color-1 > .u-container-layout:before,\n        .u-custom-color-1 > .u-inner-container-layout:before,\n        .u-custom-color-1.u-sidenav:before,\n        .u-container-layout.u-container-layout.u-custom-color-1:before,\n        .u-table-alt-custom-color-1 tr:nth-child(even)\n        {\n            color: var(--custom-color-1-text-color);\n            background-color: var(--custom-color-1);\n        }\n\n        .u-input.u-custom-color-1,\n        .u-field-input.u-custom-color-1,\n        .u-button-style.u-custom-color-1,\n        .u-button-style.u-custom-color-1[class*=\"u-border-\"]\n        {\n            color: var(--custom-color-1-text-color) !important;\n            background-color: var(--custom-color-1) !important;\n        }\n\n        .u-button-style.u-custom-color-1:hover,\n        .u-button-style.u-custom-color-1[class*=\"u-border-\"]:hover,\n        .u-button-style.u-custom-color-1:focus,\n        .u-button-style.u-custom-color-1[class*=\"u-border-\"]:focus,\n        .u-button-style.u-button-style.u-custom-color-1:active,\n        .u-button-style.u-button-style.u-custom-color-1[class*=\"u-border-\"]:active,\n        .u-button-style.u-button-style.u-custom-color-1.active,\n        .u-button-style.u-button-style.u-custom-color-1[class*=\"u-border-\"].active,\n        li.active > .u-button-style.u-button-style.u-custom-color-1,\n        li.active > .u-button-style.u-button-style.u-custom-color-1[class*=\"u-border-\"]\n        {\n            color: var(--custom-color-1-text-color) !important;\n            background-color: var(--custom-color-1-darker) !important;\n        }\n\n        .u-hover-custom-color-1:hover,\n        .u-hover-custom-color-1[class*=\"u-border-\"]:hover,\n        .u-hover-custom-color-1:focus,\n        .u-hover-custom-color-1[class*=\"u-border-\"]:focus,\n        .u-active-custom-color-1.u-active.u-active,\n        .u-active-custom-color-1[class*=\"u-border-\"].u-active.u-active,\n        a.u-button-style.u-hover-custom-color-1:hover,\n        a.u-button-style.u-hover-custom-color-1.hover,\n        a.u-button-style.u-hover-custom-color-1[class*=\"u-border-\"]:hover,\n        a.u-button-style.u-hover-custom-color-1[class*=\"u-border-\"].hover,\n        a.u-button-style:hover > .u-hover-custom-color-1,\n        a.u-button-style:hover > .u-hover-custom-color-1[class*=\"u-border-\"],\n        a.u-button-style.u-hover-custom-color-1:focus,\n        a.u-button-style.u-hover-custom-color-1[class*=\"u-border-\"]:focus,\n        a.u-button-style.u-button-style.u-active-custom-color-1:active,\n        a.u-button-style.u-button-style.u-active-custom-color-1[class*=\"u-border-\"]:active,\n        a.u-button-style.u-button-style.u-active-custom-color-1.active,\n        a.u-button-style.u-button-style.u-active-custom-color-1[class*=\"u-border-\"].active,\n        a.u-button-style.u-button-style.active > .u-active-custom-color-1,\n        a.u-button-style.u-button-style.active > .u-active-custom-color-1[class*=\"u-border-\"],\n        li.active > a.u-button-style.u-button-style.u-active-custom-color-1,\n        li.active > a.u-button-style.u-button-style.u-active-custom-color-1[class*=\"u-border-\"],\n        input.u-field-input.u-field-input.u-active-custom-color-1:checked\n        {\n            color: var(--custom-color-1-text-color) !important;\n            background-color: var(--custom-color-1) !important;\n        }\n\n        a.u-link.u-hover-custom-color-1:hover {\n            color: var(--custom-color-1) !important;\n        }\n\n        \n        \n        .u-custom-color-2,\n        .u-body.u-custom-color-2,\n        section.u-custom-color-2:before,\n        .u-custom-color-2 > .u-audio-main-layout-wrapper:before,\n        .u-custom-color-2 > .u-container-layout:before,\n        .u-custom-color-2 > .u-inner-container-layout:before,\n        .u-custom-color-2.u-sidenav:before,\n        .u-container-layout.u-container-layout.u-custom-color-2:before,\n        .u-table-alt-custom-color-2 tr:nth-child(even)\n        {\n            color: var(--custom-color-2-text-color);\n            background-color: var(--custom-color-2);\n        }\n\n        .u-input.u-custom-color-2,\n        .u-field-input.u-custom-color-2,\n        .u-button-style.u-custom-color-2,\n        .u-button-style.u-custom-color-2[class*=\"u-border-\"]\n        {\n            color: var(--custom-color-2-text-color) !important;\n            background-color: var(--custom-color-2) !important;\n        }\n\n        .u-button-style.u-custom-color-2:hover,\n        .u-button-style.u-custom-color-2[class*=\"u-border-\"]:hover,\n        .u-button-style.u-custom-color-2:focus,\n        .u-button-style.u-custom-color-2[class*=\"u-border-\"]:focus,\n        .u-button-style.u-button-style.u-custom-color-2:active,\n        .u-button-style.u-button-style.u-custom-color-2[class*=\"u-border-\"]:active,\n        .u-button-style.u-button-style.u-custom-color-2.active,\n        .u-button-style.u-button-style.u-custom-color-2[class*=\"u-border-\"].active,\n        li.active > .u-button-style.u-button-style.u-custom-color-2,\n        li.active > .u-button-style.u-button-style.u-custom-color-2[class*=\"u-border-\"]\n        {\n            color: var(--custom-color-2-text-color) !important;\n            background-color: var(--custom-color-2-darker) !important;\n        }\n\n        .u-hover-custom-color-2:hover,\n        .u-hover-custom-color-2[class*=\"u-border-\"]:hover,\n        .u-hover-custom-color-2:focus,\n        .u-hover-custom-color-2[class*=\"u-border-\"]:focus,\n        .u-active-custom-color-2.u-active.u-active,\n        .u-active-custom-color-2[class*=\"u-border-\"].u-active.u-active,\n        a.u-button-style.u-hover-custom-color-2:hover,\n        a.u-button-style.u-hover-custom-color-2.hover,\n        a.u-button-style.u-hover-custom-color-2[class*=\"u-border-\"]:hover,\n        a.u-button-style.u-hover-custom-color-2[class*=\"u-border-\"].hover,\n        a.u-button-style:hover > .u-hover-custom-color-2,\n        a.u-button-style:hover > .u-hover-custom-color-2[class*=\"u-border-\"],\n        a.u-button-style.u-hover-custom-color-2:focus,\n        a.u-button-style.u-hover-custom-color-2[class*=\"u-border-\"]:focus,\n        a.u-button-style.u-button-style.u-active-custom-color-2:active,\n        a.u-button-style.u-button-style.u-active-custom-color-2[class*=\"u-border-\"]:active,\n        a.u-button-style.u-button-style.u-active-custom-color-2.active,\n        a.u-button-style.u-button-style.u-active-custom-color-2[class*=\"u-border-\"].active,\n        a.u-button-style.u-button-style.active > .u-active-custom-color-2,\n        a.u-button-style.u-button-style.active > .u-active-custom-color-2[class*=\"u-border-\"],\n        li.active > a.u-button-style.u-button-style.u-active-custom-color-2,\n        li.active > a.u-button-style.u-button-style.u-active-custom-color-2[class*=\"u-border-\"],\n        input.u-field-input.u-field-input.u-active-custom-color-2:checked\n        {\n            color: var(--custom-color-2-text-color) !important;\n            background-color: var(--custom-color-2) !important;\n        }\n\n        a.u-link.u-hover-custom-color-2:hover {\n            color: var(--custom-color-2) !important;\n        }\n\n        \n        \n        .u-custom-color-3,\n        .u-body.u-custom-color-3,\n        section.u-custom-color-3:before,\n        .u-custom-color-3 > .u-audio-main-layout-wrapper:before,\n        .u-custom-color-3 > .u-container-layout:before,\n        .u-custom-color-3 > .u-inner-container-layout:before,\n        .u-custom-color-3.u-sidenav:before,\n        .u-container-layout.u-container-layout.u-custom-color-3:before,\n        .u-table-alt-custom-color-3 tr:nth-child(even)\n        {\n            color: var(--custom-color-3-text-color);\n            background-color: var(--custom-color-3);\n        }\n\n        .u-input.u-custom-color-3,\n        .u-field-input.u-custom-color-3,\n        .u-button-style.u-custom-color-3,\n        .u-button-style.u-custom-color-3[class*=\"u-border-\"]\n        {\n            color: var(--custom-color-3-text-color) !important;\n            background-color: var(--custom-color-3) !important;\n        }\n\n        .u-button-style.u-custom-color-3:hover,\n        .u-button-style.u-custom-color-3[class*=\"u-border-\"]:hover,\n        .u-button-style.u-custom-color-3:focus,\n        .u-button-style.u-custom-color-3[class*=\"u-border-\"]:focus,\n        .u-button-style.u-button-style.u-custom-color-3:active,\n        .u-button-style.u-button-style.u-custom-color-3[class*=\"u-border-\"]:active,\n        .u-button-style.u-button-style.u-custom-color-3.active,\n        .u-button-style.u-button-style.u-custom-color-3[class*=\"u-border-\"].active,\n        li.active > .u-button-style.u-button-style.u-custom-color-3,\n        li.active > .u-button-style.u-button-style.u-custom-color-3[class*=\"u-border-\"]\n        {\n            color: var(--custom-color-3-text-color) !important;\n            background-color: var(--custom-color-3-darker) !important;\n        }\n\n        .u-hover-custom-color-3:hover,\n        .u-hover-custom-color-3[class*=\"u-border-\"]:hover,\n        .u-hover-custom-color-3:focus,\n        .u-hover-custom-color-3[class*=\"u-border-\"]:focus,\n        .u-active-custom-color-3.u-active.u-active,\n        .u-active-custom-color-3[class*=\"u-border-\"].u-active.u-active,\n        a.u-button-style.u-hover-custom-color-3:hover,\n        a.u-button-style.u-hover-custom-color-3.hover,\n        a.u-button-style.u-hover-custom-color-3[class*=\"u-border-\"]:hover,\n        a.u-button-style.u-hover-custom-color-3[class*=\"u-border-\"].hover,\n        a.u-button-style:hover > .u-hover-custom-color-3,\n        a.u-button-style:hover > .u-hover-custom-color-3[class*=\"u-border-\"],\n        a.u-button-style.u-hover-custom-color-3:focus,\n        a.u-button-style.u-hover-custom-color-3[class*=\"u-border-\"]:focus,\n        a.u-button-style.u-button-style.u-active-custom-color-3:active,\n        a.u-button-style.u-button-style.u-active-custom-color-3[class*=\"u-border-\"]:active,\n        a.u-button-style.u-button-style.u-active-custom-color-3.active,\n        a.u-button-style.u-button-style.u-active-custom-color-3[class*=\"u-border-\"].active,\n        a.u-button-style.u-button-style.active > .u-active-custom-color-3,\n        a.u-button-style.u-button-style.active > .u-active-custom-color-3[class*=\"u-border-\"],\n        li.active > a.u-button-style.u-button-style.u-active-custom-color-3,\n        li.active > a.u-button-style.u-button-style.u-active-custom-color-3[class*=\"u-border-\"],\n        input.u-field-input.u-field-input.u-active-custom-color-3:checked\n        {\n            color: var(--custom-color-3-text-color) !important;\n            background-color: var(--custom-color-3) !important;\n        }\n\n        a.u-link.u-hover-custom-color-3:hover {\n            color: var(--custom-color-3) !important;\n        }\n\n        \n        \n        .u-custom-color-4,\n        .u-body.u-custom-color-4,\n        section.u-custom-color-4:before,\n        .u-custom-color-4 > .u-audio-main-layout-wrapper:before,\n        .u-custom-color-4 > .u-container-layout:before,\n        .u-custom-color-4 > .u-inner-container-layout:before,\n        .u-custom-color-4.u-sidenav:before,\n        .u-container-layout.u-container-layout.u-custom-color-4:before,\n        .u-table-alt-custom-color-4 tr:nth-child(even)\n        {\n            color: var(--custom-color-4-text-color);\n            background-color: var(--custom-color-4);\n        }\n\n        .u-input.u-custom-color-4,\n        .u-field-input.u-custom-color-4,\n        .u-button-style.u-custom-color-4,\n        .u-button-style.u-custom-color-4[class*=\"u-border-\"]\n        {\n            color: var(--custom-color-4-text-color) !important;\n            background-color: var(--custom-color-4) !important;\n        }\n\n        .u-button-style.u-custom-color-4:hover,\n        .u-button-style.u-custom-color-4[class*=\"u-border-\"]:hover,\n        .u-button-style.u-custom-color-4:focus,\n        .u-button-style.u-custom-color-4[class*=\"u-border-\"]:focus,\n        .u-button-style.u-button-style.u-custom-color-4:active,\n        .u-button-style.u-button-style.u-custom-color-4[class*=\"u-border-\"]:active,\n        .u-button-style.u-button-style.u-custom-color-4.active,\n        .u-button-style.u-button-style.u-custom-color-4[class*=\"u-border-\"].active,\n        li.active > .u-button-style.u-button-style.u-custom-color-4,\n        li.active > .u-button-style.u-button-style.u-custom-color-4[class*=\"u-border-\"]\n        {\n            color: var(--custom-color-4-text-color) !important;\n            background-color: var(--custom-color-4-darker) !important;\n        }\n\n        .u-hover-custom-color-4:hover,\n        .u-hover-custom-color-4[class*=\"u-border-\"]:hover,\n        .u-hover-custom-color-4:focus,\n        .u-hover-custom-color-4[class*=\"u-border-\"]:focus,\n        .u-active-custom-color-4.u-active.u-active,\n        .u-active-custom-color-4[class*=\"u-border-\"].u-active.u-active,\n        a.u-button-style.u-hover-custom-color-4:hover,\n        a.u-button-style.u-hover-custom-color-4.hover,\n        a.u-button-style.u-hover-custom-color-4[class*=\"u-border-\"]:hover,\n        a.u-button-style.u-hover-custom-color-4[class*=\"u-border-\"].hover,\n        a.u-button-style:hover > .u-hover-custom-color-4,\n        a.u-button-style:hover > .u-hover-custom-color-4[class*=\"u-border-\"],\n        a.u-button-style.u-hover-custom-color-4:focus,\n        a.u-button-style.u-hover-custom-color-4[class*=\"u-border-\"]:focus,\n        a.u-button-style.u-button-style.u-active-custom-color-4:active,\n        a.u-button-style.u-button-style.u-active-custom-color-4[class*=\"u-border-\"]:active,\n        a.u-button-style.u-button-style.u-active-custom-color-4.active,\n        a.u-button-style.u-button-style.u-active-custom-color-4[class*=\"u-border-\"].active,\n        a.u-button-style.u-button-style.active > .u-active-custom-color-4,\n        a.u-button-style.u-button-style.active > .u-active-custom-color-4[class*=\"u-border-\"],\n        li.active > a.u-button-style.u-button-style.u-active-custom-color-4,\n        li.active > a.u-button-style.u-button-style.u-active-custom-color-4[class*=\"u-border-\"],\n        input.u-field-input.u-field-input.u-active-custom-color-4:checked\n        {\n            color: var(--custom-color-4-text-color) !important;\n            background-color: var(--custom-color-4) !important;\n        }\n\n        a.u-link.u-hover-custom-color-4:hover {\n            color: var(--custom-color-4) !important;\n        }\n\n        \n        \n        .u-custom-color-5,\n        .u-body.u-custom-color-5,\n        section.u-custom-color-5:before,\n        .u-custom-color-5 > .u-audio-main-layout-wrapper:before,\n        .u-custom-color-5 > .u-container-layout:before,\n        .u-custom-color-5 > .u-inner-container-layout:before,\n        .u-custom-color-5.u-sidenav:before,\n        .u-container-layout.u-container-layout.u-custom-color-5:before,\n        .u-table-alt-custom-color-5 tr:nth-child(even)\n        {\n            color: var(--custom-color-5-text-color);\n            background-color: var(--custom-color-5);\n        }\n\n        .u-input.u-custom-color-5,\n        .u-field-input.u-custom-color-5,\n        .u-button-style.u-custom-color-5,\n        .u-button-style.u-custom-color-5[class*=\"u-border-\"]\n        {\n            color: var(--custom-color-5-text-color) !important;\n            background-color: var(--custom-color-5) !important;\n        }\n\n        .u-button-style.u-custom-color-5:hover,\n        .u-button-style.u-custom-color-5[class*=\"u-border-\"]:hover,\n        .u-button-style.u-custom-color-5:focus,\n        .u-button-style.u-custom-color-5[class*=\"u-border-\"]:focus,\n        .u-button-style.u-button-style.u-custom-color-5:active,\n        .u-button-style.u-button-style.u-custom-color-5[class*=\"u-border-\"]:active,\n        .u-button-style.u-button-style.u-custom-color-5.active,\n        .u-button-style.u-button-style.u-custom-color-5[class*=\"u-border-\"].active,\n        li.active > .u-button-style.u-button-style.u-custom-color-5,\n        li.active > .u-button-style.u-button-style.u-custom-color-5[class*=\"u-border-\"]\n        {\n            color: var(--custom-color-5-text-color) !important;\n            background-color: var(--custom-color-5-darker) !important;\n        }\n\n        .u-hover-custom-color-5:hover,\n        .u-hover-custom-color-5[class*=\"u-border-\"]:hover,\n        .u-hover-custom-color-5:focus,\n        .u-hover-custom-color-5[class*=\"u-border-\"]:focus,\n        .u-active-custom-color-5.u-active.u-active,\n        .u-active-custom-color-5[class*=\"u-border-\"].u-active.u-active,\n        a.u-button-style.u-hover-custom-color-5:hover,\n        a.u-button-style.u-hover-custom-color-5.hover,\n        a.u-button-style.u-hover-custom-color-5[class*=\"u-border-\"]:hover,\n        a.u-button-style.u-hover-custom-color-5[class*=\"u-border-\"].hover,\n        a.u-button-style:hover > .u-hover-custom-color-5,\n        a.u-button-style:hover > .u-hover-custom-color-5[class*=\"u-border-\"],\n        a.u-button-style.u-hover-custom-color-5:focus,\n        a.u-button-style.u-hover-custom-color-5[class*=\"u-border-\"]:focus,\n        a.u-button-style.u-button-style.u-active-custom-color-5:active,\n        a.u-button-style.u-button-style.u-active-custom-color-5[class*=\"u-border-\"]:active,\n        a.u-button-style.u-button-style.u-active-custom-color-5.active,\n        a.u-button-style.u-button-style.u-active-custom-color-5[class*=\"u-border-\"].active,\n        a.u-button-style.u-button-style.active > .u-active-custom-color-5,\n        a.u-button-style.u-button-style.active > .u-active-custom-color-5[class*=\"u-border-\"],\n        li.active > a.u-button-style.u-button-style.u-active-custom-color-5,\n        li.active > a.u-button-style.u-button-style.u-active-custom-color-5[class*=\"u-border-\"],\n        input.u-field-input.u-field-input.u-active-custom-color-5:checked\n        {\n            color: var(--custom-color-5-text-color) !important;\n            background-color: var(--custom-color-5) !important;\n        }\n\n        a.u-link.u-hover-custom-color-5:hover {\n            color: var(--custom-color-5) !important;\n        }\n\n        \n        \n        .u-custom-color-6,\n        .u-body.u-custom-color-6,\n        section.u-custom-color-6:before,\n        .u-custom-color-6 > .u-audio-main-layout-wrapper:before,\n        .u-custom-color-6 > .u-container-layout:before,\n        .u-custom-color-6 > .u-inner-container-layout:before,\n        .u-custom-color-6.u-sidenav:before,\n        .u-container-layout.u-container-layout.u-custom-color-6:before,\n        .u-table-alt-custom-color-6 tr:nth-child(even)\n        {\n            color: var(--custom-color-6-text-color);\n            background-color: var(--custom-color-6);\n        }\n\n        .u-input.u-custom-color-6,\n        .u-field-input.u-custom-color-6,\n        .u-button-style.u-custom-color-6,\n        .u-button-style.u-custom-color-6[class*=\"u-border-\"]\n        {\n            color: var(--custom-color-6-text-color) !important;\n            background-color: var(--custom-color-6) !important;\n        }\n\n        .u-button-style.u-custom-color-6:hover,\n        .u-button-style.u-custom-color-6[class*=\"u-border-\"]:hover,\n        .u-button-style.u-custom-color-6:focus,\n        .u-button-style.u-custom-color-6[class*=\"u-border-\"]:focus,\n        .u-button-style.u-button-style.u-custom-color-6:active,\n        .u-button-style.u-button-style.u-custom-color-6[class*=\"u-border-\"]:active,\n        .u-button-style.u-button-style.u-custom-color-6.active,\n        .u-button-style.u-button-style.u-custom-color-6[class*=\"u-border-\"].active,\n        li.active > .u-button-style.u-button-style.u-custom-color-6,\n        li.active > .u-button-style.u-button-style.u-custom-color-6[class*=\"u-border-\"]\n        {\n            color: var(--custom-color-6-text-color) !important;\n            background-color: var(--custom-color-6-darker) !important;\n        }\n\n        .u-hover-custom-color-6:hover,\n        .u-hover-custom-color-6[class*=\"u-border-\"]:hover,\n        .u-hover-custom-color-6:focus,\n        .u-hover-custom-color-6[class*=\"u-border-\"]:focus,\n        .u-active-custom-color-6.u-active.u-active,\n        .u-active-custom-color-6[class*=\"u-border-\"].u-active.u-active,\n        a.u-button-style.u-hover-custom-color-6:hover,\n        a.u-button-style.u-hover-custom-color-6.hover,\n        a.u-button-style.u-hover-custom-color-6[class*=\"u-border-\"]:hover,\n        a.u-button-style.u-hover-custom-color-6[class*=\"u-border-\"].hover,\n        a.u-button-style:hover > .u-hover-custom-color-6,\n        a.u-button-style:hover > .u-hover-custom-color-6[class*=\"u-border-\"],\n        a.u-button-style.u-hover-custom-color-6:focus,\n        a.u-button-style.u-hover-custom-color-6[class*=\"u-border-\"]:focus,\n        a.u-button-style.u-button-style.u-active-custom-color-6:active,\n        a.u-button-style.u-button-style.u-active-custom-color-6[class*=\"u-border-\"]:active,\n        a.u-button-style.u-button-style.u-active-custom-color-6.active,\n        a.u-button-style.u-button-style.u-active-custom-color-6[class*=\"u-border-\"].active,\n        a.u-button-style.u-button-style.active > .u-active-custom-color-6,\n        a.u-button-style.u-button-style.active > .u-active-custom-color-6[class*=\"u-border-\"],\n        li.active > a.u-button-style.u-button-style.u-active-custom-color-6,\n        li.active > a.u-button-style.u-button-style.u-active-custom-color-6[class*=\"u-border-\"],\n        input.u-field-input.u-field-input.u-active-custom-color-6:checked\n        {\n            color: var(--custom-color-6-text-color) !important;\n            background-color: var(--custom-color-6) !important;\n        }\n\n        a.u-link.u-hover-custom-color-6:hover {\n            color: var(--custom-color-6) !important;\n        }\n\n        \n        \n        .u-custom-color-7,\n        .u-body.u-custom-color-7,\n        section.u-custom-color-7:before,\n        .u-custom-color-7 > .u-audio-main-layout-wrapper:before,\n        .u-custom-color-7 > .u-container-layout:before,\n        .u-custom-color-7 > .u-inner-container-layout:before,\n        .u-custom-color-7.u-sidenav:before,\n        .u-container-layout.u-container-layout.u-custom-color-7:before,\n        .u-table-alt-custom-color-7 tr:nth-child(even)\n        {\n            color: var(--custom-color-7-text-color);\n            background-color: var(--custom-color-7);\n        }\n\n        .u-input.u-custom-color-7,\n        .u-field-input.u-custom-color-7,\n        .u-button-style.u-custom-color-7,\n        .u-button-style.u-custom-color-7[class*=\"u-border-\"]\n        {\n            color: var(--custom-color-7-text-color) !important;\n            background-color: var(--custom-color-7) !important;\n        }\n\n        .u-button-style.u-custom-color-7:hover,\n        .u-button-style.u-custom-color-7[class*=\"u-border-\"]:hover,\n        .u-button-style.u-custom-color-7:focus,\n        .u-button-style.u-custom-color-7[class*=\"u-border-\"]:focus,\n        .u-button-style.u-button-style.u-custom-color-7:active,\n        .u-button-style.u-button-style.u-custom-color-7[class*=\"u-border-\"]:active,\n        .u-button-style.u-button-style.u-custom-color-7.active,\n        .u-button-style.u-button-style.u-custom-color-7[class*=\"u-border-\"].active,\n        li.active > .u-button-style.u-button-style.u-custom-color-7,\n        li.active > .u-button-style.u-button-style.u-custom-color-7[class*=\"u-border-\"]\n        {\n            color: var(--custom-color-7-text-color) !important;\n            background-color: var(--custom-color-7-darker) !important;\n        }\n\n        .u-hover-custom-color-7:hover,\n        .u-hover-custom-color-7[class*=\"u-border-\"]:hover,\n        .u-hover-custom-color-7:focus,\n        .u-hover-custom-color-7[class*=\"u-border-\"]:focus,\n        .u-active-custom-color-7.u-active.u-active,\n        .u-active-custom-color-7[class*=\"u-border-\"].u-active.u-active,\n        a.u-button-style.u-hover-custom-color-7:hover,\n        a.u-button-style.u-hover-custom-color-7.hover,\n        a.u-button-style.u-hover-custom-color-7[class*=\"u-border-\"]:hover,\n        a.u-button-style.u-hover-custom-color-7[class*=\"u-border-\"].hover,\n        a.u-button-style:hover > .u-hover-custom-color-7,\n        a.u-button-style:hover > .u-hover-custom-color-7[class*=\"u-border-\"],\n        a.u-button-style.u-hover-custom-color-7:focus,\n        a.u-button-style.u-hover-custom-color-7[class*=\"u-border-\"]:focus,\n        a.u-button-style.u-button-style.u-active-custom-color-7:active,\n        a.u-button-style.u-button-style.u-active-custom-color-7[class*=\"u-border-\"]:active,\n        a.u-button-style.u-button-style.u-active-custom-color-7.active,\n        a.u-button-style.u-button-style.u-active-custom-color-7[class*=\"u-border-\"].active,\n        a.u-button-style.u-button-style.active > .u-active-custom-color-7,\n        a.u-button-style.u-button-style.active > .u-active-custom-color-7[class*=\"u-border-\"],\n        li.active > a.u-button-style.u-button-style.u-active-custom-color-7,\n        li.active > a.u-button-style.u-button-style.u-active-custom-color-7[class*=\"u-border-\"],\n        input.u-field-input.u-field-input.u-active-custom-color-7:checked\n        {\n            color: var(--custom-color-7-text-color) !important;\n            background-color: var(--custom-color-7) !important;\n        }\n\n        a.u-link.u-hover-custom-color-7:hover {\n            color: var(--custom-color-7) !important;\n        }\n\n        \n        \n        .u-custom-color-8,\n        .u-body.u-custom-color-8,\n        section.u-custom-color-8:before,\n        .u-custom-color-8 > .u-audio-main-layout-wrapper:before,\n        .u-custom-color-8 > .u-container-layout:before,\n        .u-custom-color-8 > .u-inner-container-layout:before,\n        .u-custom-color-8.u-sidenav:before,\n        .u-container-layout.u-container-layout.u-custom-color-8:before,\n        .u-table-alt-custom-color-8 tr:nth-child(even)\n        {\n            color: var(--custom-color-8-text-color);\n            background-color: var(--custom-color-8);\n        }\n\n        .u-input.u-custom-color-8,\n        .u-field-input.u-custom-color-8,\n        .u-button-style.u-custom-color-8,\n        .u-button-style.u-custom-color-8[class*=\"u-border-\"]\n        {\n            color: var(--custom-color-8-text-color) !important;\n            background-color: var(--custom-color-8) !important;\n        }\n\n        .u-button-style.u-custom-color-8:hover,\n        .u-button-style.u-custom-color-8[class*=\"u-border-\"]:hover,\n        .u-button-style.u-custom-color-8:focus,\n        .u-button-style.u-custom-color-8[class*=\"u-border-\"]:focus,\n        .u-button-style.u-button-style.u-custom-color-8:active,\n        .u-button-style.u-button-style.u-custom-color-8[class*=\"u-border-\"]:active,\n        .u-button-style.u-button-style.u-custom-color-8.active,\n        .u-button-style.u-button-style.u-custom-color-8[class*=\"u-border-\"].active,\n        li.active > .u-button-style.u-button-style.u-custom-color-8,\n        li.active > .u-button-style.u-button-style.u-custom-color-8[class*=\"u-border-\"]\n        {\n            color: var(--custom-color-8-text-color) !important;\n            background-color: var(--custom-color-8-darker) !important;\n        }\n\n        .u-hover-custom-color-8:hover,\n        .u-hover-custom-color-8[class*=\"u-border-\"]:hover,\n        .u-hover-custom-color-8:focus,\n        .u-hover-custom-color-8[class*=\"u-border-\"]:focus,\n        .u-active-custom-color-8.u-active.u-active,\n        .u-active-custom-color-8[class*=\"u-border-\"].u-active.u-active,\n        a.u-button-style.u-hover-custom-color-8:hover,\n        a.u-button-style.u-hover-custom-color-8.hover,\n        a.u-button-style.u-hover-custom-color-8[class*=\"u-border-\"]:hover,\n        a.u-button-style.u-hover-custom-color-8[class*=\"u-border-\"].hover,\n        a.u-button-style:hover > .u-hover-custom-color-8,\n        a.u-button-style:hover > .u-hover-custom-color-8[class*=\"u-border-\"],\n        a.u-button-style.u-hover-custom-color-8:focus,\n        a.u-button-style.u-hover-custom-color-8[class*=\"u-border-\"]:focus,\n        a.u-button-style.u-button-style.u-active-custom-color-8:active,\n        a.u-button-style.u-button-style.u-active-custom-color-8[class*=\"u-border-\"]:active,\n        a.u-button-style.u-button-style.u-active-custom-color-8.active,\n        a.u-button-style.u-button-style.u-active-custom-color-8[class*=\"u-border-\"].active,\n        a.u-button-style.u-button-style.active > .u-active-custom-color-8,\n        a.u-button-style.u-button-style.active > .u-active-custom-color-8[class*=\"u-border-\"],\n        li.active > a.u-button-style.u-button-style.u-active-custom-color-8,\n        li.active > a.u-button-style.u-button-style.u-active-custom-color-8[class*=\"u-border-\"],\n        input.u-field-input.u-field-input.u-active-custom-color-8:checked\n        {\n            color: var(--custom-color-8-text-color) !important;\n            background-color: var(--custom-color-8) !important;\n        }\n\n        a.u-link.u-hover-custom-color-8:hover {\n            color: var(--custom-color-8) !important;\n        }\n\n        \n        \n        .u-custom-color-9,\n        .u-body.u-custom-color-9,\n        section.u-custom-color-9:before,\n        .u-custom-color-9 > .u-audio-main-layout-wrapper:before,\n        .u-custom-color-9 > .u-container-layout:before,\n        .u-custom-color-9 > .u-inner-container-layout:before,\n        .u-custom-color-9.u-sidenav:before,\n        .u-container-layout.u-container-layout.u-custom-color-9:before,\n        .u-table-alt-custom-color-9 tr:nth-child(even)\n        {\n            color: var(--custom-color-9-text-color);\n            background-color: var(--custom-color-9);\n        }\n\n        .u-input.u-custom-color-9,\n        .u-field-input.u-custom-color-9,\n        .u-button-style.u-custom-color-9,\n        .u-button-style.u-custom-color-9[class*=\"u-border-\"]\n        {\n            color: var(--custom-color-9-text-color) !important;\n            background-color: var(--custom-color-9) !important;\n        }\n\n        .u-button-style.u-custom-color-9:hover,\n        .u-button-style.u-custom-color-9[class*=\"u-border-\"]:hover,\n        .u-button-style.u-custom-color-9:focus,\n        .u-button-style.u-custom-color-9[class*=\"u-border-\"]:focus,\n        .u-button-style.u-button-style.u-custom-color-9:active,\n        .u-button-style.u-button-style.u-custom-color-9[class*=\"u-border-\"]:active,\n        .u-button-style.u-button-style.u-custom-color-9.active,\n        .u-button-style.u-button-style.u-custom-color-9[class*=\"u-border-\"].active,\n        li.active > .u-button-style.u-button-style.u-custom-color-9,\n        li.active > .u-button-style.u-button-style.u-custom-color-9[class*=\"u-border-\"]\n        {\n            color: var(--custom-color-9-text-color) !important;\n            background-color: var(--custom-color-9-darker) !important;\n        }\n\n        .u-hover-custom-color-9:hover,\n        .u-hover-custom-color-9[class*=\"u-border-\"]:hover,\n        .u-hover-custom-color-9:focus,\n        .u-hover-custom-color-9[class*=\"u-border-\"]:focus,\n        .u-active-custom-color-9.u-active.u-active,\n        .u-active-custom-color-9[class*=\"u-border-\"].u-active.u-active,\n        a.u-button-style.u-hover-custom-color-9:hover,\n        a.u-button-style.u-hover-custom-color-9.hover,\n        a.u-button-style.u-hover-custom-color-9[class*=\"u-border-\"]:hover,\n        a.u-button-style.u-hover-custom-color-9[class*=\"u-border-\"].hover,\n        a.u-button-style:hover > .u-hover-custom-color-9,\n        a.u-button-style:hover > .u-hover-custom-color-9[class*=\"u-border-\"],\n        a.u-button-style.u-hover-custom-color-9:focus,\n        a.u-button-style.u-hover-custom-color-9[class*=\"u-border-\"]:focus,\n        a.u-button-style.u-button-style.u-active-custom-color-9:active,\n        a.u-button-style.u-button-style.u-active-custom-color-9[class*=\"u-border-\"]:active,\n        a.u-button-style.u-button-style.u-active-custom-color-9.active,\n        a.u-button-style.u-button-style.u-active-custom-color-9[class*=\"u-border-\"].active,\n        a.u-button-style.u-button-style.active > .u-active-custom-color-9,\n        a.u-button-style.u-button-style.active > .u-active-custom-color-9[class*=\"u-border-\"],\n        li.active > a.u-button-style.u-button-style.u-active-custom-color-9,\n        li.active > a.u-button-style.u-button-style.u-active-custom-color-9[class*=\"u-border-\"],\n        input.u-field-input.u-field-input.u-active-custom-color-9:checked\n        {\n            color: var(--custom-color-9-text-color) !important;\n            background-color: var(--custom-color-9) !important;\n        }\n\n        a.u-link.u-hover-custom-color-9:hover {\n            color: var(--custom-color-9) !important;\n        }\n\n        \n        \n        .u-custom-color-10,\n        .u-body.u-custom-color-10,\n        section.u-custom-color-10:before,\n        .u-custom-color-10 > .u-audio-main-layout-wrapper:before,\n        .u-custom-color-10 > .u-container-layout:before,\n        .u-custom-color-10 > .u-inner-container-layout:before,\n        .u-custom-color-10.u-sidenav:before,\n        .u-container-layout.u-container-layout.u-custom-color-10:before,\n        .u-table-alt-custom-color-10 tr:nth-child(even)\n        {\n            color: var(--custom-color-10-text-color);\n            background-color: var(--custom-color-10);\n        }\n\n        .u-input.u-custom-color-10,\n        .u-field-input.u-custom-color-10,\n        .u-button-style.u-custom-color-10,\n        .u-button-style.u-custom-color-10[class*=\"u-border-\"]\n        {\n            color: var(--custom-color-10-text-color) !important;\n            background-color: var(--custom-color-10) !important;\n        }\n\n        .u-button-style.u-custom-color-10:hover,\n        .u-button-style.u-custom-color-10[class*=\"u-border-\"]:hover,\n        .u-button-style.u-custom-color-10:focus,\n        .u-button-style.u-custom-color-10[class*=\"u-border-\"]:focus,\n        .u-button-style.u-button-style.u-custom-color-10:active,\n        .u-button-style.u-button-style.u-custom-color-10[class*=\"u-border-\"]:active,\n        .u-button-style.u-button-style.u-custom-color-10.active,\n        .u-button-style.u-button-style.u-custom-color-10[class*=\"u-border-\"].active,\n        li.active > .u-button-style.u-button-style.u-custom-color-10,\n        li.active > .u-button-style.u-button-style.u-custom-color-10[class*=\"u-border-\"]\n        {\n            color: var(--custom-color-10-text-color) !important;\n            background-color: var(--custom-color-10-darker) !important;\n        }\n\n        .u-hover-custom-color-10:hover,\n        .u-hover-custom-color-10[class*=\"u-border-\"]:hover,\n        .u-hover-custom-color-10:focus,\n        .u-hover-custom-color-10[class*=\"u-border-\"]:focus,\n        .u-active-custom-color-10.u-active.u-active,\n        .u-active-custom-color-10[class*=\"u-border-\"].u-active.u-active,\n        a.u-button-style.u-hover-custom-color-10:hover,\n        a.u-button-style.u-hover-custom-color-10.hover,\n        a.u-button-style.u-hover-custom-color-10[class*=\"u-border-\"]:hover,\n        a.u-button-style.u-hover-custom-color-10[class*=\"u-border-\"].hover,\n        a.u-button-style:hover > .u-hover-custom-color-10,\n        a.u-button-style:hover > .u-hover-custom-color-10[class*=\"u-border-\"],\n        a.u-button-style.u-hover-custom-color-10:focus,\n        a.u-button-style.u-hover-custom-color-10[class*=\"u-border-\"]:focus,\n        a.u-button-style.u-button-style.u-active-custom-color-10:active,\n        a.u-button-style.u-button-style.u-active-custom-color-10[class*=\"u-border-\"]:active,\n        a.u-button-style.u-button-style.u-active-custom-color-10.active,\n        a.u-button-style.u-button-style.u-active-custom-color-10[class*=\"u-border-\"].active,\n        a.u-button-style.u-button-style.active > .u-active-custom-color-10,\n        a.u-button-style.u-button-style.active > .u-active-custom-color-10[class*=\"u-border-\"],\n        li.active > a.u-button-style.u-button-style.u-active-custom-color-10,\n        li.active > a.u-button-style.u-button-style.u-active-custom-color-10[class*=\"u-border-\"],\n        input.u-field-input.u-field-input.u-active-custom-color-10:checked\n        {\n            color: var(--custom-color-10-text-color) !important;\n            background-color: var(--custom-color-10) !important;\n        }\n\n        a.u-link.u-hover-custom-color-10:hover {\n            color: var(--custom-color-10) !important;\n        }\n\n        \n        \n        .u-custom-color-11,\n        .u-body.u-custom-color-11,\n        section.u-custom-color-11:before,\n        .u-custom-color-11 > .u-audio-main-layout-wrapper:before,\n        .u-custom-color-11 > .u-container-layout:before,\n        .u-custom-color-11 > .u-inner-container-layout:before,\n        .u-custom-color-11.u-sidenav:before,\n        .u-container-layout.u-container-layout.u-custom-color-11:before,\n        .u-table-alt-custom-color-11 tr:nth-child(even)\n        {\n            color: var(--custom-color-11-text-color);\n            background-color: var(--custom-color-11);\n        }\n\n        .u-input.u-custom-color-11,\n        .u-field-input.u-custom-color-11,\n        .u-button-style.u-custom-color-11,\n        .u-button-style.u-custom-color-11[class*=\"u-border-\"]\n        {\n            color: var(--custom-color-11-text-color) !important;\n            background-color: var(--custom-color-11) !important;\n        }\n\n        .u-button-style.u-custom-color-11:hover,\n        .u-button-style.u-custom-color-11[class*=\"u-border-\"]:hover,\n        .u-button-style.u-custom-color-11:focus,\n        .u-button-style.u-custom-color-11[class*=\"u-border-\"]:focus,\n        .u-button-style.u-button-style.u-custom-color-11:active,\n        .u-button-style.u-button-style.u-custom-color-11[class*=\"u-border-\"]:active,\n        .u-button-style.u-button-style.u-custom-color-11.active,\n        .u-button-style.u-button-style.u-custom-color-11[class*=\"u-border-\"].active,\n        li.active > .u-button-style.u-button-style.u-custom-color-11,\n        li.active > .u-button-style.u-button-style.u-custom-color-11[class*=\"u-border-\"]\n        {\n            color: var(--custom-color-11-text-color) !important;\n            background-color: var(--custom-color-11-darker) !important;\n        }\n\n        .u-hover-custom-color-11:hover,\n        .u-hover-custom-color-11[class*=\"u-border-\"]:hover,\n        .u-hover-custom-color-11:focus,\n        .u-hover-custom-color-11[class*=\"u-border-\"]:focus,\n        .u-active-custom-color-11.u-active.u-active,\n        .u-active-custom-color-11[class*=\"u-border-\"].u-active.u-active,\n        a.u-button-style.u-hover-custom-color-11:hover,\n        a.u-button-style.u-hover-custom-color-11.hover,\n        a.u-button-style.u-hover-custom-color-11[class*=\"u-border-\"]:hover,\n        a.u-button-style.u-hover-custom-color-11[class*=\"u-border-\"].hover,\n        a.u-button-style:hover > .u-hover-custom-color-11,\n        a.u-button-style:hover > .u-hover-custom-color-11[class*=\"u-border-\"],\n        a.u-button-style.u-hover-custom-color-11:focus,\n        a.u-button-style.u-hover-custom-color-11[class*=\"u-border-\"]:focus,\n        a.u-button-style.u-button-style.u-active-custom-color-11:active,\n        a.u-button-style.u-button-style.u-active-custom-color-11[class*=\"u-border-\"]:active,\n        a.u-button-style.u-button-style.u-active-custom-color-11.active,\n        a.u-button-style.u-button-style.u-active-custom-color-11[class*=\"u-border-\"].active,\n        a.u-button-style.u-button-style.active > .u-active-custom-color-11,\n        a.u-button-style.u-button-style.active > .u-active-custom-color-11[class*=\"u-border-\"],\n        li.active > a.u-button-style.u-button-style.u-active-custom-color-11,\n        li.active > a.u-button-style.u-button-style.u-active-custom-color-11[class*=\"u-border-\"],\n        input.u-field-input.u-field-input.u-active-custom-color-11:checked\n        {\n            color: var(--custom-color-11-text-color) !important;\n            background-color: var(--custom-color-11) !important;\n        }\n\n        a.u-link.u-hover-custom-color-11:hover {\n            color: var(--custom-color-11) !important;\n        }\n\n        \n        \n        .u-custom-color-12,\n        .u-body.u-custom-color-12,\n        section.u-custom-color-12:before,\n        .u-custom-color-12 > .u-audio-main-layout-wrapper:before,\n        .u-custom-color-12 > .u-container-layout:before,\n        .u-custom-color-12 > .u-inner-container-layout:before,\n        .u-custom-color-12.u-sidenav:before,\n        .u-container-layout.u-container-layout.u-custom-color-12:before,\n        .u-table-alt-custom-color-12 tr:nth-child(even)\n        {\n            color: var(--custom-color-12-text-color);\n            background-color: var(--custom-color-12);\n        }\n\n        .u-input.u-custom-color-12,\n        .u-field-input.u-custom-color-12,\n        .u-button-style.u-custom-color-12,\n        .u-button-style.u-custom-color-12[class*=\"u-border-\"]\n        {\n            color: var(--custom-color-12-text-color) !important;\n            background-color: var(--custom-color-12) !important;\n        }\n\n        .u-button-style.u-custom-color-12:hover,\n        .u-button-style.u-custom-color-12[class*=\"u-border-\"]:hover,\n        .u-button-style.u-custom-color-12:focus,\n        .u-button-style.u-custom-color-12[class*=\"u-border-\"]:focus,\n        .u-button-style.u-button-style.u-custom-color-12:active,\n        .u-button-style.u-button-style.u-custom-color-12[class*=\"u-border-\"]:active,\n        .u-button-style.u-button-style.u-custom-color-12.active,\n        .u-button-style.u-button-style.u-custom-color-12[class*=\"u-border-\"].active,\n        li.active > .u-button-style.u-button-style.u-custom-color-12,\n        li.active > .u-button-style.u-button-style.u-custom-color-12[class*=\"u-border-\"]\n        {\n            color: var(--custom-color-12-text-color) !important;\n            background-color: var(--custom-color-12-darker) !important;\n        }\n\n        .u-hover-custom-color-12:hover,\n        .u-hover-custom-color-12[class*=\"u-border-\"]:hover,\n        .u-hover-custom-color-12:focus,\n        .u-hover-custom-color-12[class*=\"u-border-\"]:focus,\n        .u-active-custom-color-12.u-active.u-active,\n        .u-active-custom-color-12[class*=\"u-border-\"].u-active.u-active,\n        a.u-button-style.u-hover-custom-color-12:hover,\n        a.u-button-style.u-hover-custom-color-12.hover,\n        a.u-button-style.u-hover-custom-color-12[class*=\"u-border-\"]:hover,\n        a.u-button-style.u-hover-custom-color-12[class*=\"u-border-\"].hover,\n        a.u-button-style:hover > .u-hover-custom-color-12,\n        a.u-button-style:hover > .u-hover-custom-color-12[class*=\"u-border-\"],\n        a.u-button-style.u-hover-custom-color-12:focus,\n        a.u-button-style.u-hover-custom-color-12[class*=\"u-border-\"]:focus,\n        a.u-button-style.u-button-style.u-active-custom-color-12:active,\n        a.u-button-style.u-button-style.u-active-custom-color-12[class*=\"u-border-\"]:active,\n        a.u-button-style.u-button-style.u-active-custom-color-12.active,\n        a.u-button-style.u-button-style.u-active-custom-color-12[class*=\"u-border-\"].active,\n        a.u-button-style.u-button-style.active > .u-active-custom-color-12,\n        a.u-button-style.u-button-style.active > .u-active-custom-color-12[class*=\"u-border-\"],\n        li.active > a.u-button-style.u-button-style.u-active-custom-color-12,\n        li.active > a.u-button-style.u-button-style.u-active-custom-color-12[class*=\"u-border-\"],\n        input.u-field-input.u-field-input.u-active-custom-color-12:checked\n        {\n            color: var(--custom-color-12-text-color) !important;\n            background-color: var(--custom-color-12) !important;\n        }\n\n        a.u-link.u-hover-custom-color-12:hover {\n            color: var(--custom-color-12) !important;\n        }\n\n        \n        \n        .u-custom-color-13,\n        .u-body.u-custom-color-13,\n        section.u-custom-color-13:before,\n        .u-custom-color-13 > .u-audio-main-layout-wrapper:before,\n        .u-custom-color-13 > .u-container-layout:before,\n        .u-custom-color-13 > .u-inner-container-layout:before,\n        .u-custom-color-13.u-sidenav:before,\n        .u-container-layout.u-container-layout.u-custom-color-13:before,\n        .u-table-alt-custom-color-13 tr:nth-child(even)\n        {\n            color: var(--custom-color-13-text-color);\n            background-color: var(--custom-color-13);\n        }\n\n        .u-input.u-custom-color-13,\n        .u-field-input.u-custom-color-13,\n        .u-button-style.u-custom-color-13,\n        .u-button-style.u-custom-color-13[class*=\"u-border-\"]\n        {\n            color: var(--custom-color-13-text-color) !important;\n            background-color: var(--custom-color-13) !important;\n        }\n\n        .u-button-style.u-custom-color-13:hover,\n        .u-button-style.u-custom-color-13[class*=\"u-border-\"]:hover,\n        .u-button-style.u-custom-color-13:focus,\n        .u-button-style.u-custom-color-13[class*=\"u-border-\"]:focus,\n        .u-button-style.u-button-style.u-custom-color-13:active,\n        .u-button-style.u-button-style.u-custom-color-13[class*=\"u-border-\"]:active,\n        .u-button-style.u-button-style.u-custom-color-13.active,\n        .u-button-style.u-button-style.u-custom-color-13[class*=\"u-border-\"].active,\n        li.active > .u-button-style.u-button-style.u-custom-color-13,\n        li.active > .u-button-style.u-button-style.u-custom-color-13[class*=\"u-border-\"]\n        {\n            color: var(--custom-color-13-text-color) !important;\n            background-color: var(--custom-color-13-darker) !important;\n        }\n\n        .u-hover-custom-color-13:hover,\n        .u-hover-custom-color-13[class*=\"u-border-\"]:hover,\n        .u-hover-custom-color-13:focus,\n        .u-hover-custom-color-13[class*=\"u-border-\"]:focus,\n        .u-active-custom-color-13.u-active.u-active,\n        .u-active-custom-color-13[class*=\"u-border-\"].u-active.u-active,\n        a.u-button-style.u-hover-custom-color-13:hover,\n        a.u-button-style.u-hover-custom-color-13.hover,\n        a.u-button-style.u-hover-custom-color-13[class*=\"u-border-\"]:hover,\n        a.u-button-style.u-hover-custom-color-13[class*=\"u-border-\"].hover,\n        a.u-button-style:hover > .u-hover-custom-color-13,\n        a.u-button-style:hover > .u-hover-custom-color-13[class*=\"u-border-\"],\n        a.u-button-style.u-hover-custom-color-13:focus,\n        a.u-button-style.u-hover-custom-color-13[class*=\"u-border-\"]:focus,\n        a.u-button-style.u-button-style.u-active-custom-color-13:active,\n        a.u-button-style.u-button-style.u-active-custom-color-13[class*=\"u-border-\"]:active,\n        a.u-button-style.u-button-style.u-active-custom-color-13.active,\n        a.u-button-style.u-button-style.u-active-custom-color-13[class*=\"u-border-\"].active,\n        a.u-button-style.u-button-style.active > .u-active-custom-color-13,\n        a.u-button-style.u-button-style.active > .u-active-custom-color-13[class*=\"u-border-\"],\n        li.active > a.u-button-style.u-button-style.u-active-custom-color-13,\n        li.active > a.u-button-style.u-button-style.u-active-custom-color-13[class*=\"u-border-\"],\n        input.u-field-input.u-field-input.u-active-custom-color-13:checked\n        {\n            color: var(--custom-color-13-text-color) !important;\n            background-color: var(--custom-color-13) !important;\n        }\n\n        a.u-link.u-hover-custom-color-13:hover {\n            color: var(--custom-color-13) !important;\n        }\n\n        \n        \n        .u-custom-color-14,\n        .u-body.u-custom-color-14,\n        section.u-custom-color-14:before,\n        .u-custom-color-14 > .u-audio-main-layout-wrapper:before,\n        .u-custom-color-14 > .u-container-layout:before,\n        .u-custom-color-14 > .u-inner-container-layout:before,\n        .u-custom-color-14.u-sidenav:before,\n        .u-container-layout.u-container-layout.u-custom-color-14:before,\n        .u-table-alt-custom-color-14 tr:nth-child(even)\n        {\n            color: var(--custom-color-14-text-color);\n            background-color: var(--custom-color-14);\n        }\n\n        .u-input.u-custom-color-14,\n        .u-field-input.u-custom-color-14,\n        .u-button-style.u-custom-color-14,\n        .u-button-style.u-custom-color-14[class*=\"u-border-\"]\n        {\n            color: var(--custom-color-14-text-color) !important;\n            background-color: var(--custom-color-14) !important;\n        }\n\n        .u-button-style.u-custom-color-14:hover,\n        .u-button-style.u-custom-color-14[class*=\"u-border-\"]:hover,\n        .u-button-style.u-custom-color-14:focus,\n        .u-button-style.u-custom-color-14[class*=\"u-border-\"]:focus,\n        .u-button-style.u-button-style.u-custom-color-14:active,\n        .u-button-style.u-button-style.u-custom-color-14[class*=\"u-border-\"]:active,\n        .u-button-style.u-button-style.u-custom-color-14.active,\n        .u-button-style.u-button-style.u-custom-color-14[class*=\"u-border-\"].active,\n        li.active > .u-button-style.u-button-style.u-custom-color-14,\n        li.active > .u-button-style.u-button-style.u-custom-color-14[class*=\"u-border-\"]\n        {\n            color: var(--custom-color-14-text-color) !important;\n            background-color: var(--custom-color-14-darker) !important;\n        }\n\n        .u-hover-custom-color-14:hover,\n        .u-hover-custom-color-14[class*=\"u-border-\"]:hover,\n        .u-hover-custom-color-14:focus,\n        .u-hover-custom-color-14[class*=\"u-border-\"]:focus,\n        .u-active-custom-color-14.u-active.u-active,\n        .u-active-custom-color-14[class*=\"u-border-\"].u-active.u-active,\n        a.u-button-style.u-hover-custom-color-14:hover,\n        a.u-button-style.u-hover-custom-color-14.hover,\n        a.u-button-style.u-hover-custom-color-14[class*=\"u-border-\"]:hover,\n        a.u-button-style.u-hover-custom-color-14[class*=\"u-border-\"].hover,\n        a.u-button-style:hover > .u-hover-custom-color-14,\n        a.u-button-style:hover > .u-hover-custom-color-14[class*=\"u-border-\"],\n        a.u-button-style.u-hover-custom-color-14:focus,\n        a.u-button-style.u-hover-custom-color-14[class*=\"u-border-\"]:focus,\n        a.u-button-style.u-button-style.u-active-custom-color-14:active,\n        a.u-button-style.u-button-style.u-active-custom-color-14[class*=\"u-border-\"]:active,\n        a.u-button-style.u-button-style.u-active-custom-color-14.active,\n        a.u-button-style.u-button-style.u-active-custom-color-14[class*=\"u-border-\"].active,\n        a.u-button-style.u-button-style.active > .u-active-custom-color-14,\n        a.u-button-style.u-button-style.active > .u-active-custom-color-14[class*=\"u-border-\"],\n        li.active > a.u-button-style.u-button-style.u-active-custom-color-14,\n        li.active > a.u-button-style.u-button-style.u-active-custom-color-14[class*=\"u-border-\"],\n        input.u-field-input.u-field-input.u-active-custom-color-14:checked\n        {\n            color: var(--custom-color-14-text-color) !important;\n            background-color: var(--custom-color-14) !important;\n        }\n\n        a.u-link.u-hover-custom-color-14:hover {\n            color: var(--custom-color-14) !important;\n        }\n\n        \n        \n        .u-custom-color-15,\n        .u-body.u-custom-color-15,\n        section.u-custom-color-15:before,\n        .u-custom-color-15 > .u-audio-main-layout-wrapper:before,\n        .u-custom-color-15 > .u-container-layout:before,\n        .u-custom-color-15 > .u-inner-container-layout:before,\n        .u-custom-color-15.u-sidenav:before,\n        .u-container-layout.u-container-layout.u-custom-color-15:before,\n        .u-table-alt-custom-color-15 tr:nth-child(even)\n        {\n            color: var(--custom-color-15-text-color);\n            background-color: var(--custom-color-15);\n        }\n\n        .u-input.u-custom-color-15,\n        .u-field-input.u-custom-color-15,\n        .u-button-style.u-custom-color-15,\n        .u-button-style.u-custom-color-15[class*=\"u-border-\"]\n        {\n            color: var(--custom-color-15-text-color) !important;\n            background-color: var(--custom-color-15) !important;\n        }\n\n        .u-button-style.u-custom-color-15:hover,\n        .u-button-style.u-custom-color-15[class*=\"u-border-\"]:hover,\n        .u-button-style.u-custom-color-15:focus,\n        .u-button-style.u-custom-color-15[class*=\"u-border-\"]:focus,\n        .u-button-style.u-button-style.u-custom-color-15:active,\n        .u-button-style.u-button-style.u-custom-color-15[class*=\"u-border-\"]:active,\n        .u-button-style.u-button-style.u-custom-color-15.active,\n        .u-button-style.u-button-style.u-custom-color-15[class*=\"u-border-\"].active,\n        li.active > .u-button-style.u-button-style.u-custom-color-15,\n        li.active > .u-button-style.u-button-style.u-custom-color-15[class*=\"u-border-\"]\n        {\n            color: var(--custom-color-15-text-color) !important;\n            background-color: var(--custom-color-15-darker) !important;\n        }\n\n        .u-hover-custom-color-15:hover,\n        .u-hover-custom-color-15[class*=\"u-border-\"]:hover,\n        .u-hover-custom-color-15:focus,\n        .u-hover-custom-color-15[class*=\"u-border-\"]:focus,\n        .u-active-custom-color-15.u-active.u-active,\n        .u-active-custom-color-15[class*=\"u-border-\"].u-active.u-active,\n        a.u-button-style.u-hover-custom-color-15:hover,\n        a.u-button-style.u-hover-custom-color-15.hover,\n        a.u-button-style.u-hover-custom-color-15[class*=\"u-border-\"]:hover,\n        a.u-button-style.u-hover-custom-color-15[class*=\"u-border-\"].hover,\n        a.u-button-style:hover > .u-hover-custom-color-15,\n        a.u-button-style:hover > .u-hover-custom-color-15[class*=\"u-border-\"],\n        a.u-button-style.u-hover-custom-color-15:focus,\n        a.u-button-style.u-hover-custom-color-15[class*=\"u-border-\"]:focus,\n        a.u-button-style.u-button-style.u-active-custom-color-15:active,\n        a.u-button-style.u-button-style.u-active-custom-color-15[class*=\"u-border-\"]:active,\n        a.u-button-style.u-button-style.u-active-custom-color-15.active,\n        a.u-button-style.u-button-style.u-active-custom-color-15[class*=\"u-border-\"].active,\n        a.u-button-style.u-button-style.active > .u-active-custom-color-15,\n        a.u-button-style.u-button-style.active > .u-active-custom-color-15[class*=\"u-border-\"],\n        li.active > a.u-button-style.u-button-style.u-active-custom-color-15,\n        li.active > a.u-button-style.u-button-style.u-active-custom-color-15[class*=\"u-border-\"],\n        input.u-field-input.u-field-input.u-active-custom-color-15:checked\n        {\n            color: var(--custom-color-15-text-color) !important;\n            background-color: var(--custom-color-15) !important;\n        }\n\n        a.u-link.u-hover-custom-color-15:hover {\n            color: var(--custom-color-15) !important;\n        }\n\n        \n        \n        .u-custom-color-16,\n        .u-body.u-custom-color-16,\n        section.u-custom-color-16:before,\n        .u-custom-color-16 > .u-audio-main-layout-wrapper:before,\n        .u-custom-color-16 > .u-container-layout:before,\n        .u-custom-color-16 > .u-inner-container-layout:before,\n        .u-custom-color-16.u-sidenav:before,\n        .u-container-layout.u-container-layout.u-custom-color-16:before,\n        .u-table-alt-custom-color-16 tr:nth-child(even)\n        {\n            color: var(--custom-color-16-text-color);\n            background-color: var(--custom-color-16);\n        }\n\n        .u-input.u-custom-color-16,\n        .u-field-input.u-custom-color-16,\n        .u-button-style.u-custom-color-16,\n        .u-button-style.u-custom-color-16[class*=\"u-border-\"]\n        {\n            color: var(--custom-color-16-text-color) !important;\n            background-color: var(--custom-color-16) !important;\n        }\n\n        .u-button-style.u-custom-color-16:hover,\n        .u-button-style.u-custom-color-16[class*=\"u-border-\"]:hover,\n        .u-button-style.u-custom-color-16:focus,\n        .u-button-style.u-custom-color-16[class*=\"u-border-\"]:focus,\n        .u-button-style.u-button-style.u-custom-color-16:active,\n        .u-button-style.u-button-style.u-custom-color-16[class*=\"u-border-\"]:active,\n        .u-button-style.u-button-style.u-custom-color-16.active,\n        .u-button-style.u-button-style.u-custom-color-16[class*=\"u-border-\"].active,\n        li.active > .u-button-style.u-button-style.u-custom-color-16,\n        li.active > .u-button-style.u-button-style.u-custom-color-16[class*=\"u-border-\"]\n        {\n            color: var(--custom-color-16-text-color) !important;\n            background-color: var(--custom-color-16-darker) !important;\n        }\n\n        .u-hover-custom-color-16:hover,\n        .u-hover-custom-color-16[class*=\"u-border-\"]:hover,\n        .u-hover-custom-color-16:focus,\n        .u-hover-custom-color-16[class*=\"u-border-\"]:focus,\n        .u-active-custom-color-16.u-active.u-active,\n        .u-active-custom-color-16[class*=\"u-border-\"].u-active.u-active,\n        a.u-button-style.u-hover-custom-color-16:hover,\n        a.u-button-style.u-hover-custom-color-16.hover,\n        a.u-button-style.u-hover-custom-color-16[class*=\"u-border-\"]:hover,\n        a.u-button-style.u-hover-custom-color-16[class*=\"u-border-\"].hover,\n        a.u-button-style:hover > .u-hover-custom-color-16,\n        a.u-button-style:hover > .u-hover-custom-color-16[class*=\"u-border-\"],\n        a.u-button-style.u-hover-custom-color-16:focus,\n        a.u-button-style.u-hover-custom-color-16[class*=\"u-border-\"]:focus,\n        a.u-button-style.u-button-style.u-active-custom-color-16:active,\n        a.u-button-style.u-button-style.u-active-custom-color-16[class*=\"u-border-\"]:active,\n        a.u-button-style.u-button-style.u-active-custom-color-16.active,\n        a.u-button-style.u-button-style.u-active-custom-color-16[class*=\"u-border-\"].active,\n        a.u-button-style.u-button-style.active > .u-active-custom-color-16,\n        a.u-button-style.u-button-style.active > .u-active-custom-color-16[class*=\"u-border-\"],\n        li.active > a.u-button-style.u-button-style.u-active-custom-color-16,\n        li.active > a.u-button-style.u-button-style.u-active-custom-color-16[class*=\"u-border-\"],\n        input.u-field-input.u-field-input.u-active-custom-color-16:checked\n        {\n            color: var(--custom-color-16-text-color) !important;\n            background-color: var(--custom-color-16) !important;\n        }\n\n        a.u-link.u-hover-custom-color-16:hover {\n            color: var(--custom-color-16) !important;\n        }\n\n        \n\n        \n        .u-border-custom-color-1,\n        .u-border-custom-color-1.u-input,\n        .u-border-custom-color-1.u-field-input.u-field-input,\n        .u-separator-custom-color-1:after\n        {\n            border-color: var(--custom-color-1);\n            stroke: var(--custom-color-1);\n        }\n\n        .u-button-style.u-border-custom-color-1\n        {\n            border-color: var(--custom-color-1) !important;\n            color: var(--custom-color-1) !important;\n            background-color: transparent !important;\n        }\n\n        .u-button-style.u-border-custom-color-1:hover,\n        .u-button-style.u-border-custom-color-1:focus\n        {\n            border-color: transparent !important;\n            color: var(--custom-color-1-darker) !important;\n            background-color: transparent !important;\n        }\n\n        .u-border-hover-custom-color-1:hover,\n        .u-border-hover-custom-color-1:focus,\n        .u-border-active-custom-color-1.u-active.u-active,\n        a.u-button-style.u-border-hover-custom-color-1:hover,\n        a.u-button-style:hover > .u-border-hover-custom-color-1,\n        a.u-button-style.u-border-hover-custom-color-1:focus,\n        a.u-button-style.u-button-style.u-border-active-custom-color-1:active,\n        a.u-button-style.u-button-style.u-border-active-custom-color-1.active,\n        a.u-button-style.u-button-style.active > .u-border-active-custom-color-1,\n        li.active > a.u-button-style.u-button-style.u-border-active-custom-color-1,\n        input.u-field-input.u-field-input.u-border-active-custom-color-1:checked\n        {\n            color: var(--custom-color-1) !important;\n            border-color: var(--custom-color-1) !important;\n        }\n\n        .u-link.u-border-custom-color-1[class*=\"u-border-\"]\n        {\n            border-color: var(--custom-color-1) !important;\n        }\n\n        .u-link.u-border-custom-color-1[class*=\"u-border-\"]:hover\n        {\n            border-color: var(--custom-color-1-darker) !important;\n        }\n        \n        \n        .u-border-custom-color-2,\n        .u-border-custom-color-2.u-input,\n        .u-border-custom-color-2.u-field-input.u-field-input,\n        .u-separator-custom-color-2:after\n        {\n            border-color: var(--custom-color-2);\n            stroke: var(--custom-color-2);\n        }\n\n        .u-button-style.u-border-custom-color-2\n        {\n            border-color: var(--custom-color-2) !important;\n            color: var(--custom-color-2) !important;\n            background-color: transparent !important;\n        }\n\n        .u-button-style.u-border-custom-color-2:hover,\n        .u-button-style.u-border-custom-color-2:focus\n        {\n            border-color: transparent !important;\n            color: var(--custom-color-2-darker) !important;\n            background-color: transparent !important;\n        }\n\n        .u-border-hover-custom-color-2:hover,\n        .u-border-hover-custom-color-2:focus,\n        .u-border-active-custom-color-2.u-active.u-active,\n        a.u-button-style.u-border-hover-custom-color-2:hover,\n        a.u-button-style:hover > .u-border-hover-custom-color-2,\n        a.u-button-style.u-border-hover-custom-color-2:focus,\n        a.u-button-style.u-button-style.u-border-active-custom-color-2:active,\n        a.u-button-style.u-button-style.u-border-active-custom-color-2.active,\n        a.u-button-style.u-button-style.active > .u-border-active-custom-color-2,\n        li.active > a.u-button-style.u-button-style.u-border-active-custom-color-2,\n        input.u-field-input.u-field-input.u-border-active-custom-color-2:checked\n        {\n            color: var(--custom-color-2) !important;\n            border-color: var(--custom-color-2) !important;\n        }\n\n        .u-link.u-border-custom-color-2[class*=\"u-border-\"]\n        {\n            border-color: var(--custom-color-2) !important;\n        }\n\n        .u-link.u-border-custom-color-2[class*=\"u-border-\"]:hover\n        {\n            border-color: var(--custom-color-2-darker) !important;\n        }\n        \n        \n        .u-border-custom-color-3,\n        .u-border-custom-color-3.u-input,\n        .u-border-custom-color-3.u-field-input.u-field-input,\n        .u-separator-custom-color-3:after\n        {\n            border-color: var(--custom-color-3);\n            stroke: var(--custom-color-3);\n        }\n\n        .u-button-style.u-border-custom-color-3\n        {\n            border-color: var(--custom-color-3) !important;\n            color: var(--custom-color-3) !important;\n            background-color: transparent !important;\n        }\n\n        .u-button-style.u-border-custom-color-3:hover,\n        .u-button-style.u-border-custom-color-3:focus\n        {\n            border-color: transparent !important;\n            color: var(--custom-color-3-darker) !important;\n            background-color: transparent !important;\n        }\n\n        .u-border-hover-custom-color-3:hover,\n        .u-border-hover-custom-color-3:focus,\n        .u-border-active-custom-color-3.u-active.u-active,\n        a.u-button-style.u-border-hover-custom-color-3:hover,\n        a.u-button-style:hover > .u-border-hover-custom-color-3,\n        a.u-button-style.u-border-hover-custom-color-3:focus,\n        a.u-button-style.u-button-style.u-border-active-custom-color-3:active,\n        a.u-button-style.u-button-style.u-border-active-custom-color-3.active,\n        a.u-button-style.u-button-style.active > .u-border-active-custom-color-3,\n        li.active > a.u-button-style.u-button-style.u-border-active-custom-color-3,\n        input.u-field-input.u-field-input.u-border-active-custom-color-3:checked\n        {\n            color: var(--custom-color-3) !important;\n            border-color: var(--custom-color-3) !important;\n        }\n\n        .u-link.u-border-custom-color-3[class*=\"u-border-\"]\n        {\n            border-color: var(--custom-color-3) !important;\n        }\n\n        .u-link.u-border-custom-color-3[class*=\"u-border-\"]:hover\n        {\n            border-color: var(--custom-color-3-darker) !important;\n        }\n        \n        \n        .u-border-custom-color-4,\n        .u-border-custom-color-4.u-input,\n        .u-border-custom-color-4.u-field-input.u-field-input,\n        .u-separator-custom-color-4:after\n        {\n            border-color: var(--custom-color-4);\n            stroke: var(--custom-color-4);\n        }\n\n        .u-button-style.u-border-custom-color-4\n        {\n            border-color: var(--custom-color-4) !important;\n            color: var(--custom-color-4) !important;\n            background-color: transparent !important;\n        }\n\n        .u-button-style.u-border-custom-color-4:hover,\n        .u-button-style.u-border-custom-color-4:focus\n        {\n            border-color: transparent !important;\n            color: var(--custom-color-4-darker) !important;\n            background-color: transparent !important;\n        }\n\n        .u-border-hover-custom-color-4:hover,\n        .u-border-hover-custom-color-4:focus,\n        .u-border-active-custom-color-4.u-active.u-active,\n        a.u-button-style.u-border-hover-custom-color-4:hover,\n        a.u-button-style:hover > .u-border-hover-custom-color-4,\n        a.u-button-style.u-border-hover-custom-color-4:focus,\n        a.u-button-style.u-button-style.u-border-active-custom-color-4:active,\n        a.u-button-style.u-button-style.u-border-active-custom-color-4.active,\n        a.u-button-style.u-button-style.active > .u-border-active-custom-color-4,\n        li.active > a.u-button-style.u-button-style.u-border-active-custom-color-4,\n        input.u-field-input.u-field-input.u-border-active-custom-color-4:checked\n        {\n            color: var(--custom-color-4) !important;\n            border-color: var(--custom-color-4) !important;\n        }\n\n        .u-link.u-border-custom-color-4[class*=\"u-border-\"]\n        {\n            border-color: var(--custom-color-4) !important;\n        }\n\n        .u-link.u-border-custom-color-4[class*=\"u-border-\"]:hover\n        {\n            border-color: var(--custom-color-4-darker) !important;\n        }\n        \n        \n        .u-border-custom-color-5,\n        .u-border-custom-color-5.u-input,\n        .u-border-custom-color-5.u-field-input.u-field-input,\n        .u-separator-custom-color-5:after\n        {\n            border-color: var(--custom-color-5);\n            stroke: var(--custom-color-5);\n        }\n\n        .u-button-style.u-border-custom-color-5\n        {\n            border-color: var(--custom-color-5) !important;\n            color: var(--custom-color-5) !important;\n            background-color: transparent !important;\n        }\n\n        .u-button-style.u-border-custom-color-5:hover,\n        .u-button-style.u-border-custom-color-5:focus\n        {\n            border-color: transparent !important;\n            color: var(--custom-color-5-darker) !important;\n            background-color: transparent !important;\n        }\n\n        .u-border-hover-custom-color-5:hover,\n        .u-border-hover-custom-color-5:focus,\n        .u-border-active-custom-color-5.u-active.u-active,\n        a.u-button-style.u-border-hover-custom-color-5:hover,\n        a.u-button-style:hover > .u-border-hover-custom-color-5,\n        a.u-button-style.u-border-hover-custom-color-5:focus,\n        a.u-button-style.u-button-style.u-border-active-custom-color-5:active,\n        a.u-button-style.u-button-style.u-border-active-custom-color-5.active,\n        a.u-button-style.u-button-style.active > .u-border-active-custom-color-5,\n        li.active > a.u-button-style.u-button-style.u-border-active-custom-color-5,\n        input.u-field-input.u-field-input.u-border-active-custom-color-5:checked\n        {\n            color: var(--custom-color-5) !important;\n            border-color: var(--custom-color-5) !important;\n        }\n\n        .u-link.u-border-custom-color-5[class*=\"u-border-\"]\n        {\n            border-color: var(--custom-color-5) !important;\n        }\n\n        .u-link.u-border-custom-color-5[class*=\"u-border-\"]:hover\n        {\n            border-color: var(--custom-color-5-darker) !important;\n        }\n        \n        \n        .u-border-custom-color-6,\n        .u-border-custom-color-6.u-input,\n        .u-border-custom-color-6.u-field-input.u-field-input,\n        .u-separator-custom-color-6:after\n        {\n            border-color: var(--custom-color-6);\n            stroke: var(--custom-color-6);\n        }\n\n        .u-button-style.u-border-custom-color-6\n        {\n            border-color: var(--custom-color-6) !important;\n            color: var(--custom-color-6) !important;\n            background-color: transparent !important;\n        }\n\n        .u-button-style.u-border-custom-color-6:hover,\n        .u-button-style.u-border-custom-color-6:focus\n        {\n            border-color: transparent !important;\n            color: var(--custom-color-6-darker) !important;\n            background-color: transparent !important;\n        }\n\n        .u-border-hover-custom-color-6:hover,\n        .u-border-hover-custom-color-6:focus,\n        .u-border-active-custom-color-6.u-active.u-active,\n        a.u-button-style.u-border-hover-custom-color-6:hover,\n        a.u-button-style:hover > .u-border-hover-custom-color-6,\n        a.u-button-style.u-border-hover-custom-color-6:focus,\n        a.u-button-style.u-button-style.u-border-active-custom-color-6:active,\n        a.u-button-style.u-button-style.u-border-active-custom-color-6.active,\n        a.u-button-style.u-button-style.active > .u-border-active-custom-color-6,\n        li.active > a.u-button-style.u-button-style.u-border-active-custom-color-6,\n        input.u-field-input.u-field-input.u-border-active-custom-color-6:checked\n        {\n            color: var(--custom-color-6) !important;\n            border-color: var(--custom-color-6) !important;\n        }\n\n        .u-link.u-border-custom-color-6[class*=\"u-border-\"]\n        {\n            border-color: var(--custom-color-6) !important;\n        }\n\n        .u-link.u-border-custom-color-6[class*=\"u-border-\"]:hover\n        {\n            border-color: var(--custom-color-6-darker) !important;\n        }\n        \n        \n        .u-border-custom-color-7,\n        .u-border-custom-color-7.u-input,\n        .u-border-custom-color-7.u-field-input.u-field-input,\n        .u-separator-custom-color-7:after\n        {\n            border-color: var(--custom-color-7);\n            stroke: var(--custom-color-7);\n        }\n\n        .u-button-style.u-border-custom-color-7\n        {\n            border-color: var(--custom-color-7) !important;\n            color: var(--custom-color-7) !important;\n            background-color: transparent !important;\n        }\n\n        .u-button-style.u-border-custom-color-7:hover,\n        .u-button-style.u-border-custom-color-7:focus\n        {\n            border-color: transparent !important;\n            color: var(--custom-color-7-darker) !important;\n            background-color: transparent !important;\n        }\n\n        .u-border-hover-custom-color-7:hover,\n        .u-border-hover-custom-color-7:focus,\n        .u-border-active-custom-color-7.u-active.u-active,\n        a.u-button-style.u-border-hover-custom-color-7:hover,\n        a.u-button-style:hover > .u-border-hover-custom-color-7,\n        a.u-button-style.u-border-hover-custom-color-7:focus,\n        a.u-button-style.u-button-style.u-border-active-custom-color-7:active,\n        a.u-button-style.u-button-style.u-border-active-custom-color-7.active,\n        a.u-button-style.u-button-style.active > .u-border-active-custom-color-7,\n        li.active > a.u-button-style.u-button-style.u-border-active-custom-color-7,\n        input.u-field-input.u-field-input.u-border-active-custom-color-7:checked\n        {\n            color: var(--custom-color-7) !important;\n            border-color: var(--custom-color-7) !important;\n        }\n\n        .u-link.u-border-custom-color-7[class*=\"u-border-\"]\n        {\n            border-color: var(--custom-color-7) !important;\n        }\n\n        .u-link.u-border-custom-color-7[class*=\"u-border-\"]:hover\n        {\n            border-color: var(--custom-color-7-darker) !important;\n        }\n        \n        \n        .u-border-custom-color-8,\n        .u-border-custom-color-8.u-input,\n        .u-border-custom-color-8.u-field-input.u-field-input,\n        .u-separator-custom-color-8:after\n        {\n            border-color: var(--custom-color-8);\n            stroke: var(--custom-color-8);\n        }\n\n        .u-button-style.u-border-custom-color-8\n        {\n            border-color: var(--custom-color-8) !important;\n            color: var(--custom-color-8) !important;\n            background-color: transparent !important;\n        }\n\n        .u-button-style.u-border-custom-color-8:hover,\n        .u-button-style.u-border-custom-color-8:focus\n        {\n            border-color: transparent !important;\n            color: var(--custom-color-8-darker) !important;\n            background-color: transparent !important;\n        }\n\n        .u-border-hover-custom-color-8:hover,\n        .u-border-hover-custom-color-8:focus,\n        .u-border-active-custom-color-8.u-active.u-active,\n        a.u-button-style.u-border-hover-custom-color-8:hover,\n        a.u-button-style:hover > .u-border-hover-custom-color-8,\n        a.u-button-style.u-border-hover-custom-color-8:focus,\n        a.u-button-style.u-button-style.u-border-active-custom-color-8:active,\n        a.u-button-style.u-button-style.u-border-active-custom-color-8.active,\n        a.u-button-style.u-button-style.active > .u-border-active-custom-color-8,\n        li.active > a.u-button-style.u-button-style.u-border-active-custom-color-8,\n        input.u-field-input.u-field-input.u-border-active-custom-color-8:checked\n        {\n            color: var(--custom-color-8) !important;\n            border-color: var(--custom-color-8) !important;\n        }\n\n        .u-link.u-border-custom-color-8[class*=\"u-border-\"]\n        {\n            border-color: var(--custom-color-8) !important;\n        }\n\n        .u-link.u-border-custom-color-8[class*=\"u-border-\"]:hover\n        {\n            border-color: var(--custom-color-8-darker) !important;\n        }\n        \n        \n        .u-border-custom-color-9,\n        .u-border-custom-color-9.u-input,\n        .u-border-custom-color-9.u-field-input.u-field-input,\n        .u-separator-custom-color-9:after\n        {\n            border-color: var(--custom-color-9);\n            stroke: var(--custom-color-9);\n        }\n\n        .u-button-style.u-border-custom-color-9\n        {\n            border-color: var(--custom-color-9) !important;\n            color: var(--custom-color-9) !important;\n            background-color: transparent !important;\n        }\n\n        .u-button-style.u-border-custom-color-9:hover,\n        .u-button-style.u-border-custom-color-9:focus\n        {\n            border-color: transparent !important;\n            color: var(--custom-color-9-darker) !important;\n            background-color: transparent !important;\n        }\n\n        .u-border-hover-custom-color-9:hover,\n        .u-border-hover-custom-color-9:focus,\n        .u-border-active-custom-color-9.u-active.u-active,\n        a.u-button-style.u-border-hover-custom-color-9:hover,\n        a.u-button-style:hover > .u-border-hover-custom-color-9,\n        a.u-button-style.u-border-hover-custom-color-9:focus,\n        a.u-button-style.u-button-style.u-border-active-custom-color-9:active,\n        a.u-button-style.u-button-style.u-border-active-custom-color-9.active,\n        a.u-button-style.u-button-style.active > .u-border-active-custom-color-9,\n        li.active > a.u-button-style.u-button-style.u-border-active-custom-color-9,\n        input.u-field-input.u-field-input.u-border-active-custom-color-9:checked\n        {\n            color: var(--custom-color-9) !important;\n            border-color: var(--custom-color-9) !important;\n        }\n\n        .u-link.u-border-custom-color-9[class*=\"u-border-\"]\n        {\n            border-color: var(--custom-color-9) !important;\n        }\n\n        .u-link.u-border-custom-color-9[class*=\"u-border-\"]:hover\n        {\n            border-color: var(--custom-color-9-darker) !important;\n        }\n        \n        \n        .u-border-custom-color-10,\n        .u-border-custom-color-10.u-input,\n        .u-border-custom-color-10.u-field-input.u-field-input,\n        .u-separator-custom-color-10:after\n        {\n            border-color: var(--custom-color-10);\n            stroke: var(--custom-color-10);\n        }\n\n        .u-button-style.u-border-custom-color-10\n        {\n            border-color: var(--custom-color-10) !important;\n            color: var(--custom-color-10) !important;\n            background-color: transparent !important;\n        }\n\n        .u-button-style.u-border-custom-color-10:hover,\n        .u-button-style.u-border-custom-color-10:focus\n        {\n            border-color: transparent !important;\n            color: var(--custom-color-10-darker) !important;\n            background-color: transparent !important;\n        }\n\n        .u-border-hover-custom-color-10:hover,\n        .u-border-hover-custom-color-10:focus,\n        .u-border-active-custom-color-10.u-active.u-active,\n        a.u-button-style.u-border-hover-custom-color-10:hover,\n        a.u-button-style:hover > .u-border-hover-custom-color-10,\n        a.u-button-style.u-border-hover-custom-color-10:focus,\n        a.u-button-style.u-button-style.u-border-active-custom-color-10:active,\n        a.u-button-style.u-button-style.u-border-active-custom-color-10.active,\n        a.u-button-style.u-button-style.active > .u-border-active-custom-color-10,\n        li.active > a.u-button-style.u-button-style.u-border-active-custom-color-10,\n        input.u-field-input.u-field-input.u-border-active-custom-color-10:checked\n        {\n            color: var(--custom-color-10) !important;\n            border-color: var(--custom-color-10) !important;\n        }\n\n        .u-link.u-border-custom-color-10[class*=\"u-border-\"]\n        {\n            border-color: var(--custom-color-10) !important;\n        }\n\n        .u-link.u-border-custom-color-10[class*=\"u-border-\"]:hover\n        {\n            border-color: var(--custom-color-10-darker) !important;\n        }\n        \n        \n        .u-border-custom-color-11,\n        .u-border-custom-color-11.u-input,\n        .u-border-custom-color-11.u-field-input.u-field-input,\n        .u-separator-custom-color-11:after\n        {\n            border-color: var(--custom-color-11);\n            stroke: var(--custom-color-11);\n        }\n\n        .u-button-style.u-border-custom-color-11\n        {\n            border-color: var(--custom-color-11) !important;\n            color: var(--custom-color-11) !important;\n            background-color: transparent !important;\n        }\n\n        .u-button-style.u-border-custom-color-11:hover,\n        .u-button-style.u-border-custom-color-11:focus\n        {\n            border-color: transparent !important;\n            color: var(--custom-color-11-darker) !important;\n            background-color: transparent !important;\n        }\n\n        .u-border-hover-custom-color-11:hover,\n        .u-border-hover-custom-color-11:focus,\n        .u-border-active-custom-color-11.u-active.u-active,\n        a.u-button-style.u-border-hover-custom-color-11:hover,\n        a.u-button-style:hover > .u-border-hover-custom-color-11,\n        a.u-button-style.u-border-hover-custom-color-11:focus,\n        a.u-button-style.u-button-style.u-border-active-custom-color-11:active,\n        a.u-button-style.u-button-style.u-border-active-custom-color-11.active,\n        a.u-button-style.u-button-style.active > .u-border-active-custom-color-11,\n        li.active > a.u-button-style.u-button-style.u-border-active-custom-color-11,\n        input.u-field-input.u-field-input.u-border-active-custom-color-11:checked\n        {\n            color: var(--custom-color-11) !important;\n            border-color: var(--custom-color-11) !important;\n        }\n\n        .u-link.u-border-custom-color-11[class*=\"u-border-\"]\n        {\n            border-color: var(--custom-color-11) !important;\n        }\n\n        .u-link.u-border-custom-color-11[class*=\"u-border-\"]:hover\n        {\n            border-color: var(--custom-color-11-darker) !important;\n        }\n        \n        \n        .u-border-custom-color-12,\n        .u-border-custom-color-12.u-input,\n        .u-border-custom-color-12.u-field-input.u-field-input,\n        .u-separator-custom-color-12:after\n        {\n            border-color: var(--custom-color-12);\n            stroke: var(--custom-color-12);\n        }\n\n        .u-button-style.u-border-custom-color-12\n        {\n            border-color: var(--custom-color-12) !important;\n            color: var(--custom-color-12) !important;\n            background-color: transparent !important;\n        }\n\n        .u-button-style.u-border-custom-color-12:hover,\n        .u-button-style.u-border-custom-color-12:focus\n        {\n            border-color: transparent !important;\n            color: var(--custom-color-12-darker) !important;\n            background-color: transparent !important;\n        }\n\n        .u-border-hover-custom-color-12:hover,\n        .u-border-hover-custom-color-12:focus,\n        .u-border-active-custom-color-12.u-active.u-active,\n        a.u-button-style.u-border-hover-custom-color-12:hover,\n        a.u-button-style:hover > .u-border-hover-custom-color-12,\n        a.u-button-style.u-border-hover-custom-color-12:focus,\n        a.u-button-style.u-button-style.u-border-active-custom-color-12:active,\n        a.u-button-style.u-button-style.u-border-active-custom-color-12.active,\n        a.u-button-style.u-button-style.active > .u-border-active-custom-color-12,\n        li.active > a.u-button-style.u-button-style.u-border-active-custom-color-12,\n        input.u-field-input.u-field-input.u-border-active-custom-color-12:checked\n        {\n            color: var(--custom-color-12) !important;\n            border-color: var(--custom-color-12) !important;\n        }\n\n        .u-link.u-border-custom-color-12[class*=\"u-border-\"]\n        {\n            border-color: var(--custom-color-12) !important;\n        }\n\n        .u-link.u-border-custom-color-12[class*=\"u-border-\"]:hover\n        {\n            border-color: var(--custom-color-12-darker) !important;\n        }\n        \n        \n        .u-border-custom-color-13,\n        .u-border-custom-color-13.u-input,\n        .u-border-custom-color-13.u-field-input.u-field-input,\n        .u-separator-custom-color-13:after\n        {\n            border-color: var(--custom-color-13);\n            stroke: var(--custom-color-13);\n        }\n\n        .u-button-style.u-border-custom-color-13\n        {\n            border-color: var(--custom-color-13) !important;\n            color: var(--custom-color-13) !important;\n            background-color: transparent !important;\n        }\n\n        .u-button-style.u-border-custom-color-13:hover,\n        .u-button-style.u-border-custom-color-13:focus\n        {\n            border-color: transparent !important;\n            color: var(--custom-color-13-darker) !important;\n            background-color: transparent !important;\n        }\n\n        .u-border-hover-custom-color-13:hover,\n        .u-border-hover-custom-color-13:focus,\n        .u-border-active-custom-color-13.u-active.u-active,\n        a.u-button-style.u-border-hover-custom-color-13:hover,\n        a.u-button-style:hover > .u-border-hover-custom-color-13,\n        a.u-button-style.u-border-hover-custom-color-13:focus,\n        a.u-button-style.u-button-style.u-border-active-custom-color-13:active,\n        a.u-button-style.u-button-style.u-border-active-custom-color-13.active,\n        a.u-button-style.u-button-style.active > .u-border-active-custom-color-13,\n        li.active > a.u-button-style.u-button-style.u-border-active-custom-color-13,\n        input.u-field-input.u-field-input.u-border-active-custom-color-13:checked\n        {\n            color: var(--custom-color-13) !important;\n            border-color: var(--custom-color-13) !important;\n        }\n\n        .u-link.u-border-custom-color-13[class*=\"u-border-\"]\n        {\n            border-color: var(--custom-color-13) !important;\n        }\n\n        .u-link.u-border-custom-color-13[class*=\"u-border-\"]:hover\n        {\n            border-color: var(--custom-color-13-darker) !important;\n        }\n        \n        \n        .u-border-custom-color-14,\n        .u-border-custom-color-14.u-input,\n        .u-border-custom-color-14.u-field-input.u-field-input,\n        .u-separator-custom-color-14:after\n        {\n            border-color: var(--custom-color-14);\n            stroke: var(--custom-color-14);\n        }\n\n        .u-button-style.u-border-custom-color-14\n        {\n            border-color: var(--custom-color-14) !important;\n            color: var(--custom-color-14) !important;\n            background-color: transparent !important;\n        }\n\n        .u-button-style.u-border-custom-color-14:hover,\n        .u-button-style.u-border-custom-color-14:focus\n        {\n            border-color: transparent !important;\n            color: var(--custom-color-14-darker) !important;\n            background-color: transparent !important;\n        }\n\n        .u-border-hover-custom-color-14:hover,\n        .u-border-hover-custom-color-14:focus,\n        .u-border-active-custom-color-14.u-active.u-active,\n        a.u-button-style.u-border-hover-custom-color-14:hover,\n        a.u-button-style:hover > .u-border-hover-custom-color-14,\n        a.u-button-style.u-border-hover-custom-color-14:focus,\n        a.u-button-style.u-button-style.u-border-active-custom-color-14:active,\n        a.u-button-style.u-button-style.u-border-active-custom-color-14.active,\n        a.u-button-style.u-button-style.active > .u-border-active-custom-color-14,\n        li.active > a.u-button-style.u-button-style.u-border-active-custom-color-14,\n        input.u-field-input.u-field-input.u-border-active-custom-color-14:checked\n        {\n            color: var(--custom-color-14) !important;\n            border-color: var(--custom-color-14) !important;\n        }\n\n        .u-link.u-border-custom-color-14[class*=\"u-border-\"]\n        {\n            border-color: var(--custom-color-14) !important;\n        }\n\n        .u-link.u-border-custom-color-14[class*=\"u-border-\"]:hover\n        {\n            border-color: var(--custom-color-14-darker) !important;\n        }\n        \n        \n        .u-border-custom-color-15,\n        .u-border-custom-color-15.u-input,\n        .u-border-custom-color-15.u-field-input.u-field-input,\n        .u-separator-custom-color-15:after\n        {\n            border-color: var(--custom-color-15);\n            stroke: var(--custom-color-15);\n        }\n\n        .u-button-style.u-border-custom-color-15\n        {\n            border-color: var(--custom-color-15) !important;\n            color: var(--custom-color-15) !important;\n            background-color: transparent !important;\n        }\n\n        .u-button-style.u-border-custom-color-15:hover,\n        .u-button-style.u-border-custom-color-15:focus\n        {\n            border-color: transparent !important;\n            color: var(--custom-color-15-darker) !important;\n            background-color: transparent !important;\n        }\n\n        .u-border-hover-custom-color-15:hover,\n        .u-border-hover-custom-color-15:focus,\n        .u-border-active-custom-color-15.u-active.u-active,\n        a.u-button-style.u-border-hover-custom-color-15:hover,\n        a.u-button-style:hover > .u-border-hover-custom-color-15,\n        a.u-button-style.u-border-hover-custom-color-15:focus,\n        a.u-button-style.u-button-style.u-border-active-custom-color-15:active,\n        a.u-button-style.u-button-style.u-border-active-custom-color-15.active,\n        a.u-button-style.u-button-style.active > .u-border-active-custom-color-15,\n        li.active > a.u-button-style.u-button-style.u-border-active-custom-color-15,\n        input.u-field-input.u-field-input.u-border-active-custom-color-15:checked\n        {\n            color: var(--custom-color-15) !important;\n            border-color: var(--custom-color-15) !important;\n        }\n\n        .u-link.u-border-custom-color-15[class*=\"u-border-\"]\n        {\n            border-color: var(--custom-color-15) !important;\n        }\n\n        .u-link.u-border-custom-color-15[class*=\"u-border-\"]:hover\n        {\n            border-color: var(--custom-color-15-darker) !important;\n        }\n        \n        \n        .u-border-custom-color-16,\n        .u-border-custom-color-16.u-input,\n        .u-border-custom-color-16.u-field-input.u-field-input,\n        .u-separator-custom-color-16:after\n        {\n            border-color: var(--custom-color-16);\n            stroke: var(--custom-color-16);\n        }\n\n        .u-button-style.u-border-custom-color-16\n        {\n            border-color: var(--custom-color-16) !important;\n            color: var(--custom-color-16) !important;\n            background-color: transparent !important;\n        }\n\n        .u-button-style.u-border-custom-color-16:hover,\n        .u-button-style.u-border-custom-color-16:focus\n        {\n            border-color: transparent !important;\n            color: var(--custom-color-16-darker) !important;\n            background-color: transparent !important;\n        }\n\n        .u-border-hover-custom-color-16:hover,\n        .u-border-hover-custom-color-16:focus,\n        .u-border-active-custom-color-16.u-active.u-active,\n        a.u-button-style.u-border-hover-custom-color-16:hover,\n        a.u-button-style:hover > .u-border-hover-custom-color-16,\n        a.u-button-style.u-border-hover-custom-color-16:focus,\n        a.u-button-style.u-button-style.u-border-active-custom-color-16:active,\n        a.u-button-style.u-button-style.u-border-active-custom-color-16.active,\n        a.u-button-style.u-button-style.active > .u-border-active-custom-color-16,\n        li.active > a.u-button-style.u-button-style.u-border-active-custom-color-16,\n        input.u-field-input.u-field-input.u-border-active-custom-color-16:checked\n        {\n            color: var(--custom-color-16) !important;\n            border-color: var(--custom-color-16) !important;\n        }\n\n        .u-link.u-border-custom-color-16[class*=\"u-border-\"]\n        {\n            border-color: var(--custom-color-16) !important;\n        }\n\n        .u-link.u-border-custom-color-16[class*=\"u-border-\"]:hover\n        {\n            border-color: var(--custom-color-16-darker) !important;\n        }\n        \n\n        \n        .u-text-custom-color-1,\n        .u-input.u-text-custom-color-1,\n        .u-input.u-text-custom-color-1[class*=\"u-border-\"],\n        li.active > a.u-button-style.u-text-custom-color-1,\n        li.active > a.u-button-style.u-text-custom-color-1[class*=\"u-border-\"],\n        a.u-button-style.u-text-custom-color-1,\n        a.u-button-style.u-text-custom-color-1[class*=\"u-border-\"]\n        {\n            color: var(--custom-color-1) !important;\n        }\n\n        a.u-button-style.u-text-custom-color-1:hover,\n        a.u-button-style.u-text-custom-color-1[class*=\"u-border-\"]:hover,\n        a.u-button-style.u-text-custom-color-1:focus,\n        a.u-button-style.u-text-custom-color-1[class*=\"u-border-\"]:focus,\n        a.u-button-style.u-button-style.u-text-custom-color-1:active,\n        a.u-button-style.u-button-style.u-text-custom-color-1[class*=\"u-border-\"]:active,\n        a.u-button-style.u-button-style.u-text-custom-color-1.active,\n        a.u-button-style.u-button-style.u-text-custom-color-1[class*=\"u-border-\"].active\n        {\n            color: var(--custom-color-1-darker) !important;\n        }\n\n        a.u-button-style:hover > .u-text-hover-custom-color-1,\n        a.u-button-style:hover > .u-text-hover-custom-color-1[class*=\"u-border-\"],\n        a.u-button-style.u-button-style.u-text-hover-custom-color-1:hover,\n        a.u-button-style.u-button-style.u-text-hover-custom-color-1[class*=\"u-border-\"]:hover,\n        a.u-button-style.u-button-style.u-button-style.u-text-hover-custom-color-1.active,\n        a.u-button-style.u-button-style.u-button-style.u-text-hover-custom-color-1[class*=\"u-border-\"].active,\n        a.u-button-style.u-button-style.u-button-style.u-text-hover-custom-color-1:active,\n        a.u-button-style.u-button-style.u-button-style.u-text-hover-custom-color-1[class*=\"u-border-\"]:active,\n        a.u-button-style.u-button-style.u-text-hover-custom-color-1:focus,\n        a.u-button-style.u-button-style.u-text-hover-custom-color-1[class*=\"u-border-\"]:focus,\n        a.u-button-style.u-button-style.u-button-style.u-button-style.u-text-active-custom-color-1:active,\n        a.u-button-style.u-button-style.u-button-style.u-button-style.u-text-active-custom-color-1[class*=\"u-border-\"]:active,\n        a.u-button-style.u-button-style.u-button-style.u-button-style.u-text-active-custom-color-1.active,\n        a.u-button-style.u-button-style.u-button-style.u-button-style.u-text-active-custom-color-1[class*=\"u-border-\"].active,\n        a.u-button-style.u-button-style.active > .u-text-active-custom-color-1,\n        a.u-button-style.u-button-style.active > .u-text-active-custom-color-1[class*=\"u-border-\"],\n        :not(.level-2) > .u-nav > .u-nav-item > a.u-nav-link.u-text-hover-custom-color-1:hover,\n        :not(.level-2) > .u-nav > .u-nav-item > a.u-nav-link.u-nav-link.u-text-active-custom-color-1.active,\n        .u-text-hover-custom-color-1.u-language-url:hover,\n        .u-text-hover-custom-color-1 .u-language-url:hover,\n        .u-text-hover-custom-color-1.u-carousel-control:hover,\n        .u-popupmenu-items.u-text-hover-custom-color-1 .u-nav-link:hover,\n        .u-popupmenu-items.u-popupmenu-items.u-text-active-custom-color-1 .u-nav-link.active\n        {\n            color: var(--custom-color-1) !important;\n        }\n\n        .u-text-custom-color-1 .u-svg-link,\n        .u-text-hover-custom-color-1:hover .u-svg-link,\n        .u-button-style:hover > .u-text-hover-custom-color-1 .u-svg-link,\n        .u-button-style.u-button-style.active > .u-text-active-custom-color-1 .u-svg-link,\n        .u-text-hover-custom-color-1:focus .u-svg-link\n        {\n            fill: var(--custom-color-1);\n        }\n\n        .u-link.u-text-custom-color-1:hover\n        {\n            color: var(--custom-color-1-darker) !important;\n        }\n\n        a.u-link.u-text-hover-custom-color-1:hover\n        {\n            color: var(--custom-color-1) !important;\n        }\n        \n        \n        .u-text-custom-color-2,\n        .u-input.u-text-custom-color-2,\n        .u-input.u-text-custom-color-2[class*=\"u-border-\"],\n        li.active > a.u-button-style.u-text-custom-color-2,\n        li.active > a.u-button-style.u-text-custom-color-2[class*=\"u-border-\"],\n        a.u-button-style.u-text-custom-color-2,\n        a.u-button-style.u-text-custom-color-2[class*=\"u-border-\"]\n        {\n            color: var(--custom-color-2) !important;\n        }\n\n        a.u-button-style.u-text-custom-color-2:hover,\n        a.u-button-style.u-text-custom-color-2[class*=\"u-border-\"]:hover,\n        a.u-button-style.u-text-custom-color-2:focus,\n        a.u-button-style.u-text-custom-color-2[class*=\"u-border-\"]:focus,\n        a.u-button-style.u-button-style.u-text-custom-color-2:active,\n        a.u-button-style.u-button-style.u-text-custom-color-2[class*=\"u-border-\"]:active,\n        a.u-button-style.u-button-style.u-text-custom-color-2.active,\n        a.u-button-style.u-button-style.u-text-custom-color-2[class*=\"u-border-\"].active\n        {\n            color: var(--custom-color-2-darker) !important;\n        }\n\n        a.u-button-style:hover > .u-text-hover-custom-color-2,\n        a.u-button-style:hover > .u-text-hover-custom-color-2[class*=\"u-border-\"],\n        a.u-button-style.u-button-style.u-text-hover-custom-color-2:hover,\n        a.u-button-style.u-button-style.u-text-hover-custom-color-2[class*=\"u-border-\"]:hover,\n        a.u-button-style.u-button-style.u-button-style.u-text-hover-custom-color-2.active,\n        a.u-button-style.u-button-style.u-button-style.u-text-hover-custom-color-2[class*=\"u-border-\"].active,\n        a.u-button-style.u-button-style.u-button-style.u-text-hover-custom-color-2:active,\n        a.u-button-style.u-button-style.u-button-style.u-text-hover-custom-color-2[class*=\"u-border-\"]:active,\n        a.u-button-style.u-button-style.u-text-hover-custom-color-2:focus,\n        a.u-button-style.u-button-style.u-text-hover-custom-color-2[class*=\"u-border-\"]:focus,\n        a.u-button-style.u-button-style.u-button-style.u-button-style.u-text-active-custom-color-2:active,\n        a.u-button-style.u-button-style.u-button-style.u-button-style.u-text-active-custom-color-2[class*=\"u-border-\"]:active,\n        a.u-button-style.u-button-style.u-button-style.u-button-style.u-text-active-custom-color-2.active,\n        a.u-button-style.u-button-style.u-button-style.u-button-style.u-text-active-custom-color-2[class*=\"u-border-\"].active,\n        a.u-button-style.u-button-style.active > .u-text-active-custom-color-2,\n        a.u-button-style.u-button-style.active > .u-text-active-custom-color-2[class*=\"u-border-\"],\n        :not(.level-2) > .u-nav > .u-nav-item > a.u-nav-link.u-text-hover-custom-color-2:hover,\n        :not(.level-2) > .u-nav > .u-nav-item > a.u-nav-link.u-nav-link.u-text-active-custom-color-2.active,\n        .u-text-hover-custom-color-2.u-language-url:hover,\n        .u-text-hover-custom-color-2 .u-language-url:hover,\n        .u-text-hover-custom-color-2.u-carousel-control:hover,\n        .u-popupmenu-items.u-text-hover-custom-color-2 .u-nav-link:hover,\n        .u-popupmenu-items.u-popupmenu-items.u-text-active-custom-color-2 .u-nav-link.active\n        {\n            color: var(--custom-color-2) !important;\n        }\n\n        .u-text-custom-color-2 .u-svg-link,\n        .u-text-hover-custom-color-2:hover .u-svg-link,\n        .u-button-style:hover > .u-text-hover-custom-color-2 .u-svg-link,\n        .u-button-style.u-button-style.active > .u-text-active-custom-color-2 .u-svg-link,\n        .u-text-hover-custom-color-2:focus .u-svg-link\n        {\n            fill: var(--custom-color-2);\n        }\n\n        .u-link.u-text-custom-color-2:hover\n        {\n            color: var(--custom-color-2-darker) !important;\n        }\n\n        a.u-link.u-text-hover-custom-color-2:hover\n        {\n            color: var(--custom-color-2) !important;\n        }\n        \n        \n        .u-text-custom-color-3,\n        .u-input.u-text-custom-color-3,\n        .u-input.u-text-custom-color-3[class*=\"u-border-\"],\n        li.active > a.u-button-style.u-text-custom-color-3,\n        li.active > a.u-button-style.u-text-custom-color-3[class*=\"u-border-\"],\n        a.u-button-style.u-text-custom-color-3,\n        a.u-button-style.u-text-custom-color-3[class*=\"u-border-\"]\n        {\n            color: var(--custom-color-3) !important;\n        }\n\n        a.u-button-style.u-text-custom-color-3:hover,\n        a.u-button-style.u-text-custom-color-3[class*=\"u-border-\"]:hover,\n        a.u-button-style.u-text-custom-color-3:focus,\n        a.u-button-style.u-text-custom-color-3[class*=\"u-border-\"]:focus,\n        a.u-button-style.u-button-style.u-text-custom-color-3:active,\n        a.u-button-style.u-button-style.u-text-custom-color-3[class*=\"u-border-\"]:active,\n        a.u-button-style.u-button-style.u-text-custom-color-3.active,\n        a.u-button-style.u-button-style.u-text-custom-color-3[class*=\"u-border-\"].active\n        {\n            color: var(--custom-color-3-darker) !important;\n        }\n\n        a.u-button-style:hover > .u-text-hover-custom-color-3,\n        a.u-button-style:hover > .u-text-hover-custom-color-3[class*=\"u-border-\"],\n        a.u-button-style.u-button-style.u-text-hover-custom-color-3:hover,\n        a.u-button-style.u-button-style.u-text-hover-custom-color-3[class*=\"u-border-\"]:hover,\n        a.u-button-style.u-button-style.u-button-style.u-text-hover-custom-color-3.active,\n        a.u-button-style.u-button-style.u-button-style.u-text-hover-custom-color-3[class*=\"u-border-\"].active,\n        a.u-button-style.u-button-style.u-button-style.u-text-hover-custom-color-3:active,\n        a.u-button-style.u-button-style.u-button-style.u-text-hover-custom-color-3[class*=\"u-border-\"]:active,\n        a.u-button-style.u-button-style.u-text-hover-custom-color-3:focus,\n        a.u-button-style.u-button-style.u-text-hover-custom-color-3[class*=\"u-border-\"]:focus,\n        a.u-button-style.u-button-style.u-button-style.u-button-style.u-text-active-custom-color-3:active,\n        a.u-button-style.u-button-style.u-button-style.u-button-style.u-text-active-custom-color-3[class*=\"u-border-\"]:active,\n        a.u-button-style.u-button-style.u-button-style.u-button-style.u-text-active-custom-color-3.active,\n        a.u-button-style.u-button-style.u-button-style.u-button-style.u-text-active-custom-color-3[class*=\"u-border-\"].active,\n        a.u-button-style.u-button-style.active > .u-text-active-custom-color-3,\n        a.u-button-style.u-button-style.active > .u-text-active-custom-color-3[class*=\"u-border-\"],\n        :not(.level-2) > .u-nav > .u-nav-item > a.u-nav-link.u-text-hover-custom-color-3:hover,\n        :not(.level-2) > .u-nav > .u-nav-item > a.u-nav-link.u-nav-link.u-text-active-custom-color-3.active,\n        .u-text-hover-custom-color-3.u-language-url:hover,\n        .u-text-hover-custom-color-3 .u-language-url:hover,\n        .u-text-hover-custom-color-3.u-carousel-control:hover,\n        .u-popupmenu-items.u-text-hover-custom-color-3 .u-nav-link:hover,\n        .u-popupmenu-items.u-popupmenu-items.u-text-active-custom-color-3 .u-nav-link.active\n        {\n            color: var(--custom-color-3) !important;\n        }\n\n        .u-text-custom-color-3 .u-svg-link,\n        .u-text-hover-custom-color-3:hover .u-svg-link,\n        .u-button-style:hover > .u-text-hover-custom-color-3 .u-svg-link,\n        .u-button-style.u-button-style.active > .u-text-active-custom-color-3 .u-svg-link,\n        .u-text-hover-custom-color-3:focus .u-svg-link\n        {\n            fill: var(--custom-color-3);\n        }\n\n        .u-link.u-text-custom-color-3:hover\n        {\n            color: var(--custom-color-3-darker) !important;\n        }\n\n        a.u-link.u-text-hover-custom-color-3:hover\n        {\n            color: var(--custom-color-3) !important;\n        }\n        \n        \n        .u-text-custom-color-4,\n        .u-input.u-text-custom-color-4,\n        .u-input.u-text-custom-color-4[class*=\"u-border-\"],\n        li.active > a.u-button-style.u-text-custom-color-4,\n        li.active > a.u-button-style.u-text-custom-color-4[class*=\"u-border-\"],\n        a.u-button-style.u-text-custom-color-4,\n        a.u-button-style.u-text-custom-color-4[class*=\"u-border-\"]\n        {\n            color: var(--custom-color-4) !important;\n        }\n\n        a.u-button-style.u-text-custom-color-4:hover,\n        a.u-button-style.u-text-custom-color-4[class*=\"u-border-\"]:hover,\n        a.u-button-style.u-text-custom-color-4:focus,\n        a.u-button-style.u-text-custom-color-4[class*=\"u-border-\"]:focus,\n        a.u-button-style.u-button-style.u-text-custom-color-4:active,\n        a.u-button-style.u-button-style.u-text-custom-color-4[class*=\"u-border-\"]:active,\n        a.u-button-style.u-button-style.u-text-custom-color-4.active,\n        a.u-button-style.u-button-style.u-text-custom-color-4[class*=\"u-border-\"].active\n        {\n            color: var(--custom-color-4-darker) !important;\n        }\n\n        a.u-button-style:hover > .u-text-hover-custom-color-4,\n        a.u-button-style:hover > .u-text-hover-custom-color-4[class*=\"u-border-\"],\n        a.u-button-style.u-button-style.u-text-hover-custom-color-4:hover,\n        a.u-button-style.u-button-style.u-text-hover-custom-color-4[class*=\"u-border-\"]:hover,\n        a.u-button-style.u-button-style.u-button-style.u-text-hover-custom-color-4.active,\n        a.u-button-style.u-button-style.u-button-style.u-text-hover-custom-color-4[class*=\"u-border-\"].active,\n        a.u-button-style.u-button-style.u-button-style.u-text-hover-custom-color-4:active,\n        a.u-button-style.u-button-style.u-button-style.u-text-hover-custom-color-4[class*=\"u-border-\"]:active,\n        a.u-button-style.u-button-style.u-text-hover-custom-color-4:focus,\n        a.u-button-style.u-button-style.u-text-hover-custom-color-4[class*=\"u-border-\"]:focus,\n        a.u-button-style.u-button-style.u-button-style.u-button-style.u-text-active-custom-color-4:active,\n        a.u-button-style.u-button-style.u-button-style.u-button-style.u-text-active-custom-color-4[class*=\"u-border-\"]:active,\n        a.u-button-style.u-button-style.u-button-style.u-button-style.u-text-active-custom-color-4.active,\n        a.u-button-style.u-button-style.u-button-style.u-button-style.u-text-active-custom-color-4[class*=\"u-border-\"].active,\n        a.u-button-style.u-button-style.active > .u-text-active-custom-color-4,\n        a.u-button-style.u-button-style.active > .u-text-active-custom-color-4[class*=\"u-border-\"],\n        :not(.level-2) > .u-nav > .u-nav-item > a.u-nav-link.u-text-hover-custom-color-4:hover,\n        :not(.level-2) > .u-nav > .u-nav-item > a.u-nav-link.u-nav-link.u-text-active-custom-color-4.active,\n        .u-text-hover-custom-color-4.u-language-url:hover,\n        .u-text-hover-custom-color-4 .u-language-url:hover,\n        .u-text-hover-custom-color-4.u-carousel-control:hover,\n        .u-popupmenu-items.u-text-hover-custom-color-4 .u-nav-link:hover,\n        .u-popupmenu-items.u-popupmenu-items.u-text-active-custom-color-4 .u-nav-link.active\n        {\n            color: var(--custom-color-4) !important;\n        }\n\n        .u-text-custom-color-4 .u-svg-link,\n        .u-text-hover-custom-color-4:hover .u-svg-link,\n        .u-button-style:hover > .u-text-hover-custom-color-4 .u-svg-link,\n        .u-button-style.u-button-style.active > .u-text-active-custom-color-4 .u-svg-link,\n        .u-text-hover-custom-color-4:focus .u-svg-link\n        {\n            fill: var(--custom-color-4);\n        }\n\n        .u-link.u-text-custom-color-4:hover\n        {\n            color: var(--custom-color-4-darker) !important;\n        }\n\n        a.u-link.u-text-hover-custom-color-4:hover\n        {\n            color: var(--custom-color-4) !important;\n        }\n        \n        \n        .u-text-custom-color-5,\n        .u-input.u-text-custom-color-5,\n        .u-input.u-text-custom-color-5[class*=\"u-border-\"],\n        li.active > a.u-button-style.u-text-custom-color-5,\n        li.active > a.u-button-style.u-text-custom-color-5[class*=\"u-border-\"],\n        a.u-button-style.u-text-custom-color-5,\n        a.u-button-style.u-text-custom-color-5[class*=\"u-border-\"]\n        {\n            color: var(--custom-color-5) !important;\n        }\n\n        a.u-button-style.u-text-custom-color-5:hover,\n        a.u-button-style.u-text-custom-color-5[class*=\"u-border-\"]:hover,\n        a.u-button-style.u-text-custom-color-5:focus,\n        a.u-button-style.u-text-custom-color-5[class*=\"u-border-\"]:focus,\n        a.u-button-style.u-button-style.u-text-custom-color-5:active,\n        a.u-button-style.u-button-style.u-text-custom-color-5[class*=\"u-border-\"]:active,\n        a.u-button-style.u-button-style.u-text-custom-color-5.active,\n        a.u-button-style.u-button-style.u-text-custom-color-5[class*=\"u-border-\"].active\n        {\n            color: var(--custom-color-5-darker) !important;\n        }\n\n        a.u-button-style:hover > .u-text-hover-custom-color-5,\n        a.u-button-style:hover > .u-text-hover-custom-color-5[class*=\"u-border-\"],\n        a.u-button-style.u-button-style.u-text-hover-custom-color-5:hover,\n        a.u-button-style.u-button-style.u-text-hover-custom-color-5[class*=\"u-border-\"]:hover,\n        a.u-button-style.u-button-style.u-button-style.u-text-hover-custom-color-5.active,\n        a.u-button-style.u-button-style.u-button-style.u-text-hover-custom-color-5[class*=\"u-border-\"].active,\n        a.u-button-style.u-button-style.u-button-style.u-text-hover-custom-color-5:active,\n        a.u-button-style.u-button-style.u-button-style.u-text-hover-custom-color-5[class*=\"u-border-\"]:active,\n        a.u-button-style.u-button-style.u-text-hover-custom-color-5:focus,\n        a.u-button-style.u-button-style.u-text-hover-custom-color-5[class*=\"u-border-\"]:focus,\n        a.u-button-style.u-button-style.u-button-style.u-button-style.u-text-active-custom-color-5:active,\n        a.u-button-style.u-button-style.u-button-style.u-button-style.u-text-active-custom-color-5[class*=\"u-border-\"]:active,\n        a.u-button-style.u-button-style.u-button-style.u-button-style.u-text-active-custom-color-5.active,\n        a.u-button-style.u-button-style.u-button-style.u-button-style.u-text-active-custom-color-5[class*=\"u-border-\"].active,\n        a.u-button-style.u-button-style.active > .u-text-active-custom-color-5,\n        a.u-button-style.u-button-style.active > .u-text-active-custom-color-5[class*=\"u-border-\"],\n        :not(.level-2) > .u-nav > .u-nav-item > a.u-nav-link.u-text-hover-custom-color-5:hover,\n        :not(.level-2) > .u-nav > .u-nav-item > a.u-nav-link.u-nav-link.u-text-active-custom-color-5.active,\n        .u-text-hover-custom-color-5.u-language-url:hover,\n        .u-text-hover-custom-color-5 .u-language-url:hover,\n        .u-text-hover-custom-color-5.u-carousel-control:hover,\n        .u-popupmenu-items.u-text-hover-custom-color-5 .u-nav-link:hover,\n        .u-popupmenu-items.u-popupmenu-items.u-text-active-custom-color-5 .u-nav-link.active\n        {\n            color: var(--custom-color-5) !important;\n        }\n\n        .u-text-custom-color-5 .u-svg-link,\n        .u-text-hover-custom-color-5:hover .u-svg-link,\n        .u-button-style:hover > .u-text-hover-custom-color-5 .u-svg-link,\n        .u-button-style.u-button-style.active > .u-text-active-custom-color-5 .u-svg-link,\n        .u-text-hover-custom-color-5:focus .u-svg-link\n        {\n            fill: var(--custom-color-5);\n        }\n\n        .u-link.u-text-custom-color-5:hover\n        {\n            color: var(--custom-color-5-darker) !important;\n        }\n\n        a.u-link.u-text-hover-custom-color-5:hover\n        {\n            color: var(--custom-color-5) !important;\n        }\n        \n        \n        .u-text-custom-color-6,\n        .u-input.u-text-custom-color-6,\n        .u-input.u-text-custom-color-6[class*=\"u-border-\"],\n        li.active > a.u-button-style.u-text-custom-color-6,\n        li.active > a.u-button-style.u-text-custom-color-6[class*=\"u-border-\"],\n        a.u-button-style.u-text-custom-color-6,\n        a.u-button-style.u-text-custom-color-6[class*=\"u-border-\"]\n        {\n            color: var(--custom-color-6) !important;\n        }\n\n        a.u-button-style.u-text-custom-color-6:hover,\n        a.u-button-style.u-text-custom-color-6[class*=\"u-border-\"]:hover,\n        a.u-button-style.u-text-custom-color-6:focus,\n        a.u-button-style.u-text-custom-color-6[class*=\"u-border-\"]:focus,\n        a.u-button-style.u-button-style.u-text-custom-color-6:active,\n        a.u-button-style.u-button-style.u-text-custom-color-6[class*=\"u-border-\"]:active,\n        a.u-button-style.u-button-style.u-text-custom-color-6.active,\n        a.u-button-style.u-button-style.u-text-custom-color-6[class*=\"u-border-\"].active\n        {\n            color: var(--custom-color-6-darker) !important;\n        }\n\n        a.u-button-style:hover > .u-text-hover-custom-color-6,\n        a.u-button-style:hover > .u-text-hover-custom-color-6[class*=\"u-border-\"],\n        a.u-button-style.u-button-style.u-text-hover-custom-color-6:hover,\n        a.u-button-style.u-button-style.u-text-hover-custom-color-6[class*=\"u-border-\"]:hover,\n        a.u-button-style.u-button-style.u-button-style.u-text-hover-custom-color-6.active,\n        a.u-button-style.u-button-style.u-button-style.u-text-hover-custom-color-6[class*=\"u-border-\"].active,\n        a.u-button-style.u-button-style.u-button-style.u-text-hover-custom-color-6:active,\n        a.u-button-style.u-button-style.u-button-style.u-text-hover-custom-color-6[class*=\"u-border-\"]:active,\n        a.u-button-style.u-button-style.u-text-hover-custom-color-6:focus,\n        a.u-button-style.u-button-style.u-text-hover-custom-color-6[class*=\"u-border-\"]:focus,\n        a.u-button-style.u-button-style.u-button-style.u-button-style.u-text-active-custom-color-6:active,\n        a.u-button-style.u-button-style.u-button-style.u-button-style.u-text-active-custom-color-6[class*=\"u-border-\"]:active,\n        a.u-button-style.u-button-style.u-button-style.u-button-style.u-text-active-custom-color-6.active,\n        a.u-button-style.u-button-style.u-button-style.u-button-style.u-text-active-custom-color-6[class*=\"u-border-\"].active,\n        a.u-button-style.u-button-style.active > .u-text-active-custom-color-6,\n        a.u-button-style.u-button-style.active > .u-text-active-custom-color-6[class*=\"u-border-\"],\n        :not(.level-2) > .u-nav > .u-nav-item > a.u-nav-link.u-text-hover-custom-color-6:hover,\n        :not(.level-2) > .u-nav > .u-nav-item > a.u-nav-link.u-nav-link.u-text-active-custom-color-6.active,\n        .u-text-hover-custom-color-6.u-language-url:hover,\n        .u-text-hover-custom-color-6 .u-language-url:hover,\n        .u-text-hover-custom-color-6.u-carousel-control:hover,\n        .u-popupmenu-items.u-text-hover-custom-color-6 .u-nav-link:hover,\n        .u-popupmenu-items.u-popupmenu-items.u-text-active-custom-color-6 .u-nav-link.active\n        {\n            color: var(--custom-color-6) !important;\n        }\n\n        .u-text-custom-color-6 .u-svg-link,\n        .u-text-hover-custom-color-6:hover .u-svg-link,\n        .u-button-style:hover > .u-text-hover-custom-color-6 .u-svg-link,\n        .u-button-style.u-button-style.active > .u-text-active-custom-color-6 .u-svg-link,\n        .u-text-hover-custom-color-6:focus .u-svg-link\n        {\n            fill: var(--custom-color-6);\n        }\n\n        .u-link.u-text-custom-color-6:hover\n        {\n            color: var(--custom-color-6-darker) !important;\n        }\n\n        a.u-link.u-text-hover-custom-color-6:hover\n        {\n            color: var(--custom-color-6) !important;\n        }\n        \n        \n        .u-text-custom-color-7,\n        .u-input.u-text-custom-color-7,\n        .u-input.u-text-custom-color-7[class*=\"u-border-\"],\n        li.active > a.u-button-style.u-text-custom-color-7,\n        li.active > a.u-button-style.u-text-custom-color-7[class*=\"u-border-\"],\n        a.u-button-style.u-text-custom-color-7,\n        a.u-button-style.u-text-custom-color-7[class*=\"u-border-\"]\n        {\n            color: var(--custom-color-7) !important;\n        }\n\n        a.u-button-style.u-text-custom-color-7:hover,\n        a.u-button-style.u-text-custom-color-7[class*=\"u-border-\"]:hover,\n        a.u-button-style.u-text-custom-color-7:focus,\n        a.u-button-style.u-text-custom-color-7[class*=\"u-border-\"]:focus,\n        a.u-button-style.u-button-style.u-text-custom-color-7:active,\n        a.u-button-style.u-button-style.u-text-custom-color-7[class*=\"u-border-\"]:active,\n        a.u-button-style.u-button-style.u-text-custom-color-7.active,\n        a.u-button-style.u-button-style.u-text-custom-color-7[class*=\"u-border-\"].active\n        {\n            color: var(--custom-color-7-darker) !important;\n        }\n\n        a.u-button-style:hover > .u-text-hover-custom-color-7,\n        a.u-button-style:hover > .u-text-hover-custom-color-7[class*=\"u-border-\"],\n        a.u-button-style.u-button-style.u-text-hover-custom-color-7:hover,\n        a.u-button-style.u-button-style.u-text-hover-custom-color-7[class*=\"u-border-\"]:hover,\n        a.u-button-style.u-button-style.u-button-style.u-text-hover-custom-color-7.active,\n        a.u-button-style.u-button-style.u-button-style.u-text-hover-custom-color-7[class*=\"u-border-\"].active,\n        a.u-button-style.u-button-style.u-button-style.u-text-hover-custom-color-7:active,\n        a.u-button-style.u-button-style.u-button-style.u-text-hover-custom-color-7[class*=\"u-border-\"]:active,\n        a.u-button-style.u-button-style.u-text-hover-custom-color-7:focus,\n        a.u-button-style.u-button-style.u-text-hover-custom-color-7[class*=\"u-border-\"]:focus,\n        a.u-button-style.u-button-style.u-button-style.u-button-style.u-text-active-custom-color-7:active,\n        a.u-button-style.u-button-style.u-button-style.u-button-style.u-text-active-custom-color-7[class*=\"u-border-\"]:active,\n        a.u-button-style.u-button-style.u-button-style.u-button-style.u-text-active-custom-color-7.active,\n        a.u-button-style.u-button-style.u-button-style.u-button-style.u-text-active-custom-color-7[class*=\"u-border-\"].active,\n        a.u-button-style.u-button-style.active > .u-text-active-custom-color-7,\n        a.u-button-style.u-button-style.active > .u-text-active-custom-color-7[class*=\"u-border-\"],\n        :not(.level-2) > .u-nav > .u-nav-item > a.u-nav-link.u-text-hover-custom-color-7:hover,\n        :not(.level-2) > .u-nav > .u-nav-item > a.u-nav-link.u-nav-link.u-text-active-custom-color-7.active,\n        .u-text-hover-custom-color-7.u-language-url:hover,\n        .u-text-hover-custom-color-7 .u-language-url:hover,\n        .u-text-hover-custom-color-7.u-carousel-control:hover,\n        .u-popupmenu-items.u-text-hover-custom-color-7 .u-nav-link:hover,\n        .u-popupmenu-items.u-popupmenu-items.u-text-active-custom-color-7 .u-nav-link.active\n        {\n            color: var(--custom-color-7) !important;\n        }\n\n        .u-text-custom-color-7 .u-svg-link,\n        .u-text-hover-custom-color-7:hover .u-svg-link,\n        .u-button-style:hover > .u-text-hover-custom-color-7 .u-svg-link,\n        .u-button-style.u-button-style.active > .u-text-active-custom-color-7 .u-svg-link,\n        .u-text-hover-custom-color-7:focus .u-svg-link\n        {\n            fill: var(--custom-color-7);\n        }\n\n        .u-link.u-text-custom-color-7:hover\n        {\n            color: var(--custom-color-7-darker) !important;\n        }\n\n        a.u-link.u-text-hover-custom-color-7:hover\n        {\n            color: var(--custom-color-7) !important;\n        }\n        \n        \n        .u-text-custom-color-8,\n        .u-input.u-text-custom-color-8,\n        .u-input.u-text-custom-color-8[class*=\"u-border-\"],\n        li.active > a.u-button-style.u-text-custom-color-8,\n        li.active > a.u-button-style.u-text-custom-color-8[class*=\"u-border-\"],\n        a.u-button-style.u-text-custom-color-8,\n        a.u-button-style.u-text-custom-color-8[class*=\"u-border-\"]\n        {\n            color: var(--custom-color-8) !important;\n        }\n\n        a.u-button-style.u-text-custom-color-8:hover,\n        a.u-button-style.u-text-custom-color-8[class*=\"u-border-\"]:hover,\n        a.u-button-style.u-text-custom-color-8:focus,\n        a.u-button-style.u-text-custom-color-8[class*=\"u-border-\"]:focus,\n        a.u-button-style.u-button-style.u-text-custom-color-8:active,\n        a.u-button-style.u-button-style.u-text-custom-color-8[class*=\"u-border-\"]:active,\n        a.u-button-style.u-button-style.u-text-custom-color-8.active,\n        a.u-button-style.u-button-style.u-text-custom-color-8[class*=\"u-border-\"].active\n        {\n            color: var(--custom-color-8-darker) !important;\n        }\n\n        a.u-button-style:hover > .u-text-hover-custom-color-8,\n        a.u-button-style:hover > .u-text-hover-custom-color-8[class*=\"u-border-\"],\n        a.u-button-style.u-button-style.u-text-hover-custom-color-8:hover,\n        a.u-button-style.u-button-style.u-text-hover-custom-color-8[class*=\"u-border-\"]:hover,\n        a.u-button-style.u-button-style.u-button-style.u-text-hover-custom-color-8.active,\n        a.u-button-style.u-button-style.u-button-style.u-text-hover-custom-color-8[class*=\"u-border-\"].active,\n        a.u-button-style.u-button-style.u-button-style.u-text-hover-custom-color-8:active,\n        a.u-button-style.u-button-style.u-button-style.u-text-hover-custom-color-8[class*=\"u-border-\"]:active,\n        a.u-button-style.u-button-style.u-text-hover-custom-color-8:focus,\n        a.u-button-style.u-button-style.u-text-hover-custom-color-8[class*=\"u-border-\"]:focus,\n        a.u-button-style.u-button-style.u-button-style.u-button-style.u-text-active-custom-color-8:active,\n        a.u-button-style.u-button-style.u-button-style.u-button-style.u-text-active-custom-color-8[class*=\"u-border-\"]:active,\n        a.u-button-style.u-button-style.u-button-style.u-button-style.u-text-active-custom-color-8.active,\n        a.u-button-style.u-button-style.u-button-style.u-button-style.u-text-active-custom-color-8[class*=\"u-border-\"].active,\n        a.u-button-style.u-button-style.active > .u-text-active-custom-color-8,\n        a.u-button-style.u-button-style.active > .u-text-active-custom-color-8[class*=\"u-border-\"],\n        :not(.level-2) > .u-nav > .u-nav-item > a.u-nav-link.u-text-hover-custom-color-8:hover,\n        :not(.level-2) > .u-nav > .u-nav-item > a.u-nav-link.u-nav-link.u-text-active-custom-color-8.active,\n        .u-text-hover-custom-color-8.u-language-url:hover,\n        .u-text-hover-custom-color-8 .u-language-url:hover,\n        .u-text-hover-custom-color-8.u-carousel-control:hover,\n        .u-popupmenu-items.u-text-hover-custom-color-8 .u-nav-link:hover,\n        .u-popupmenu-items.u-popupmenu-items.u-text-active-custom-color-8 .u-nav-link.active\n        {\n            color: var(--custom-color-8) !important;\n        }\n\n        .u-text-custom-color-8 .u-svg-link,\n        .u-text-hover-custom-color-8:hover .u-svg-link,\n        .u-button-style:hover > .u-text-hover-custom-color-8 .u-svg-link,\n        .u-button-style.u-button-style.active > .u-text-active-custom-color-8 .u-svg-link,\n        .u-text-hover-custom-color-8:focus .u-svg-link\n        {\n            fill: var(--custom-color-8);\n        }\n\n        .u-link.u-text-custom-color-8:hover\n        {\n            color: var(--custom-color-8-darker) !important;\n        }\n\n        a.u-link.u-text-hover-custom-color-8:hover\n        {\n            color: var(--custom-color-8) !important;\n        }\n        \n        \n        .u-text-custom-color-9,\n        .u-input.u-text-custom-color-9,\n        .u-input.u-text-custom-color-9[class*=\"u-border-\"],\n        li.active > a.u-button-style.u-text-custom-color-9,\n        li.active > a.u-button-style.u-text-custom-color-9[class*=\"u-border-\"],\n        a.u-button-style.u-text-custom-color-9,\n        a.u-button-style.u-text-custom-color-9[class*=\"u-border-\"]\n        {\n            color: var(--custom-color-9) !important;\n        }\n\n        a.u-button-style.u-text-custom-color-9:hover,\n        a.u-button-style.u-text-custom-color-9[class*=\"u-border-\"]:hover,\n        a.u-button-style.u-text-custom-color-9:focus,\n        a.u-button-style.u-text-custom-color-9[class*=\"u-border-\"]:focus,\n        a.u-button-style.u-button-style.u-text-custom-color-9:active,\n        a.u-button-style.u-button-style.u-text-custom-color-9[class*=\"u-border-\"]:active,\n        a.u-button-style.u-button-style.u-text-custom-color-9.active,\n        a.u-button-style.u-button-style.u-text-custom-color-9[class*=\"u-border-\"].active\n        {\n            color: var(--custom-color-9-darker) !important;\n        }\n\n        a.u-button-style:hover > .u-text-hover-custom-color-9,\n        a.u-button-style:hover > .u-text-hover-custom-color-9[class*=\"u-border-\"],\n        a.u-button-style.u-button-style.u-text-hover-custom-color-9:hover,\n        a.u-button-style.u-button-style.u-text-hover-custom-color-9[class*=\"u-border-\"]:hover,\n        a.u-button-style.u-button-style.u-button-style.u-text-hover-custom-color-9.active,\n        a.u-button-style.u-button-style.u-button-style.u-text-hover-custom-color-9[class*=\"u-border-\"].active,\n        a.u-button-style.u-button-style.u-button-style.u-text-hover-custom-color-9:active,\n        a.u-button-style.u-button-style.u-button-style.u-text-hover-custom-color-9[class*=\"u-border-\"]:active,\n        a.u-button-style.u-button-style.u-text-hover-custom-color-9:focus,\n        a.u-button-style.u-button-style.u-text-hover-custom-color-9[class*=\"u-border-\"]:focus,\n        a.u-button-style.u-button-style.u-button-style.u-button-style.u-text-active-custom-color-9:active,\n        a.u-button-style.u-button-style.u-button-style.u-button-style.u-text-active-custom-color-9[class*=\"u-border-\"]:active,\n        a.u-button-style.u-button-style.u-button-style.u-button-style.u-text-active-custom-color-9.active,\n        a.u-button-style.u-button-style.u-button-style.u-button-style.u-text-active-custom-color-9[class*=\"u-border-\"].active,\n        a.u-button-style.u-button-style.active > .u-text-active-custom-color-9,\n        a.u-button-style.u-button-style.active > .u-text-active-custom-color-9[class*=\"u-border-\"],\n        :not(.level-2) > .u-nav > .u-nav-item > a.u-nav-link.u-text-hover-custom-color-9:hover,\n        :not(.level-2) > .u-nav > .u-nav-item > a.u-nav-link.u-nav-link.u-text-active-custom-color-9.active,\n        .u-text-hover-custom-color-9.u-language-url:hover,\n        .u-text-hover-custom-color-9 .u-language-url:hover,\n        .u-text-hover-custom-color-9.u-carousel-control:hover,\n        .u-popupmenu-items.u-text-hover-custom-color-9 .u-nav-link:hover,\n        .u-popupmenu-items.u-popupmenu-items.u-text-active-custom-color-9 .u-nav-link.active\n        {\n            color: var(--custom-color-9) !important;\n        }\n\n        .u-text-custom-color-9 .u-svg-link,\n        .u-text-hover-custom-color-9:hover .u-svg-link,\n        .u-button-style:hover > .u-text-hover-custom-color-9 .u-svg-link,\n        .u-button-style.u-button-style.active > .u-text-active-custom-color-9 .u-svg-link,\n        .u-text-hover-custom-color-9:focus .u-svg-link\n        {\n            fill: var(--custom-color-9);\n        }\n\n        .u-link.u-text-custom-color-9:hover\n        {\n            color: var(--custom-color-9-darker) !important;\n        }\n\n        a.u-link.u-text-hover-custom-color-9:hover\n        {\n            color: var(--custom-color-9) !important;\n        }\n        \n        \n        .u-text-custom-color-10,\n        .u-input.u-text-custom-color-10,\n        .u-input.u-text-custom-color-10[class*=\"u-border-\"],\n        li.active > a.u-button-style.u-text-custom-color-10,\n        li.active > a.u-button-style.u-text-custom-color-10[class*=\"u-border-\"],\n        a.u-button-style.u-text-custom-color-10,\n        a.u-button-style.u-text-custom-color-10[class*=\"u-border-\"]\n        {\n            color: var(--custom-color-10) !important;\n        }\n\n        a.u-button-style.u-text-custom-color-10:hover,\n        a.u-button-style.u-text-custom-color-10[class*=\"u-border-\"]:hover,\n        a.u-button-style.u-text-custom-color-10:focus,\n        a.u-button-style.u-text-custom-color-10[class*=\"u-border-\"]:focus,\n        a.u-button-style.u-button-style.u-text-custom-color-10:active,\n        a.u-button-style.u-button-style.u-text-custom-color-10[class*=\"u-border-\"]:active,\n        a.u-button-style.u-button-style.u-text-custom-color-10.active,\n        a.u-button-style.u-button-style.u-text-custom-color-10[class*=\"u-border-\"].active\n        {\n            color: var(--custom-color-10-darker) !important;\n        }\n\n        a.u-button-style:hover > .u-text-hover-custom-color-10,\n        a.u-button-style:hover > .u-text-hover-custom-color-10[class*=\"u-border-\"],\n        a.u-button-style.u-button-style.u-text-hover-custom-color-10:hover,\n        a.u-button-style.u-button-style.u-text-hover-custom-color-10[class*=\"u-border-\"]:hover,\n        a.u-button-style.u-button-style.u-button-style.u-text-hover-custom-color-10.active,\n        a.u-button-style.u-button-style.u-button-style.u-text-hover-custom-color-10[class*=\"u-border-\"].active,\n        a.u-button-style.u-button-style.u-button-style.u-text-hover-custom-color-10:active,\n        a.u-button-style.u-button-style.u-button-style.u-text-hover-custom-color-10[class*=\"u-border-\"]:active,\n        a.u-button-style.u-button-style.u-text-hover-custom-color-10:focus,\n        a.u-button-style.u-button-style.u-text-hover-custom-color-10[class*=\"u-border-\"]:focus,\n        a.u-button-style.u-button-style.u-button-style.u-button-style.u-text-active-custom-color-10:active,\n        a.u-button-style.u-button-style.u-button-style.u-button-style.u-text-active-custom-color-10[class*=\"u-border-\"]:active,\n        a.u-button-style.u-button-style.u-button-style.u-button-style.u-text-active-custom-color-10.active,\n        a.u-button-style.u-button-style.u-button-style.u-button-style.u-text-active-custom-color-10[class*=\"u-border-\"].active,\n        a.u-button-style.u-button-style.active > .u-text-active-custom-color-10,\n        a.u-button-style.u-button-style.active > .u-text-active-custom-color-10[class*=\"u-border-\"],\n        :not(.level-2) > .u-nav > .u-nav-item > a.u-nav-link.u-text-hover-custom-color-10:hover,\n        :not(.level-2) > .u-nav > .u-nav-item > a.u-nav-link.u-nav-link.u-text-active-custom-color-10.active,\n        .u-text-hover-custom-color-10.u-language-url:hover,\n        .u-text-hover-custom-color-10 .u-language-url:hover,\n        .u-text-hover-custom-color-10.u-carousel-control:hover,\n        .u-popupmenu-items.u-text-hover-custom-color-10 .u-nav-link:hover,\n        .u-popupmenu-items.u-popupmenu-items.u-text-active-custom-color-10 .u-nav-link.active\n        {\n            color: var(--custom-color-10) !important;\n        }\n\n        .u-text-custom-color-10 .u-svg-link,\n        .u-text-hover-custom-color-10:hover .u-svg-link,\n        .u-button-style:hover > .u-text-hover-custom-color-10 .u-svg-link,\n        .u-button-style.u-button-style.active > .u-text-active-custom-color-10 .u-svg-link,\n        .u-text-hover-custom-color-10:focus .u-svg-link\n        {\n            fill: var(--custom-color-10);\n        }\n\n        .u-link.u-text-custom-color-10:hover\n        {\n            color: var(--custom-color-10-darker) !important;\n        }\n\n        a.u-link.u-text-hover-custom-color-10:hover\n        {\n            color: var(--custom-color-10) !important;\n        }\n        \n        \n        .u-text-custom-color-11,\n        .u-input.u-text-custom-color-11,\n        .u-input.u-text-custom-color-11[class*=\"u-border-\"],\n        li.active > a.u-button-style.u-text-custom-color-11,\n        li.active > a.u-button-style.u-text-custom-color-11[class*=\"u-border-\"],\n        a.u-button-style.u-text-custom-color-11,\n        a.u-button-style.u-text-custom-color-11[class*=\"u-border-\"]\n        {\n            color: var(--custom-color-11) !important;\n        }\n\n        a.u-button-style.u-text-custom-color-11:hover,\n        a.u-button-style.u-text-custom-color-11[class*=\"u-border-\"]:hover,\n        a.u-button-style.u-text-custom-color-11:focus,\n        a.u-button-style.u-text-custom-color-11[class*=\"u-border-\"]:focus,\n        a.u-button-style.u-button-style.u-text-custom-color-11:active,\n        a.u-button-style.u-button-style.u-text-custom-color-11[class*=\"u-border-\"]:active,\n        a.u-button-style.u-button-style.u-text-custom-color-11.active,\n        a.u-button-style.u-button-style.u-text-custom-color-11[class*=\"u-border-\"].active\n        {\n            color: var(--custom-color-11-darker) !important;\n        }\n\n        a.u-button-style:hover > .u-text-hover-custom-color-11,\n        a.u-button-style:hover > .u-text-hover-custom-color-11[class*=\"u-border-\"],\n        a.u-button-style.u-button-style.u-text-hover-custom-color-11:hover,\n        a.u-button-style.u-button-style.u-text-hover-custom-color-11[class*=\"u-border-\"]:hover,\n        a.u-button-style.u-button-style.u-button-style.u-text-hover-custom-color-11.active,\n        a.u-button-style.u-button-style.u-button-style.u-text-hover-custom-color-11[class*=\"u-border-\"].active,\n        a.u-button-style.u-button-style.u-button-style.u-text-hover-custom-color-11:active,\n        a.u-button-style.u-button-style.u-button-style.u-text-hover-custom-color-11[class*=\"u-border-\"]:active,\n        a.u-button-style.u-button-style.u-text-hover-custom-color-11:focus,\n        a.u-button-style.u-button-style.u-text-hover-custom-color-11[class*=\"u-border-\"]:focus,\n        a.u-button-style.u-button-style.u-button-style.u-button-style.u-text-active-custom-color-11:active,\n        a.u-button-style.u-button-style.u-button-style.u-button-style.u-text-active-custom-color-11[class*=\"u-border-\"]:active,\n        a.u-button-style.u-button-style.u-button-style.u-button-style.u-text-active-custom-color-11.active,\n        a.u-button-style.u-button-style.u-button-style.u-button-style.u-text-active-custom-color-11[class*=\"u-border-\"].active,\n        a.u-button-style.u-button-style.active > .u-text-active-custom-color-11,\n        a.u-button-style.u-button-style.active > .u-text-active-custom-color-11[class*=\"u-border-\"],\n        :not(.level-2) > .u-nav > .u-nav-item > a.u-nav-link.u-text-hover-custom-color-11:hover,\n        :not(.level-2) > .u-nav > .u-nav-item > a.u-nav-link.u-nav-link.u-text-active-custom-color-11.active,\n        .u-text-hover-custom-color-11.u-language-url:hover,\n        .u-text-hover-custom-color-11 .u-language-url:hover,\n        .u-text-hover-custom-color-11.u-carousel-control:hover,\n        .u-popupmenu-items.u-text-hover-custom-color-11 .u-nav-link:hover,\n        .u-popupmenu-items.u-popupmenu-items.u-text-active-custom-color-11 .u-nav-link.active\n        {\n            color: var(--custom-color-11) !important;\n        }\n\n        .u-text-custom-color-11 .u-svg-link,\n        .u-text-hover-custom-color-11:hover .u-svg-link,\n        .u-button-style:hover > .u-text-hover-custom-color-11 .u-svg-link,\n        .u-button-style.u-button-style.active > .u-text-active-custom-color-11 .u-svg-link,\n        .u-text-hover-custom-color-11:focus .u-svg-link\n        {\n            fill: var(--custom-color-11);\n        }\n\n        .u-link.u-text-custom-color-11:hover\n        {\n            color: var(--custom-color-11-darker) !important;\n        }\n\n        a.u-link.u-text-hover-custom-color-11:hover\n        {\n            color: var(--custom-color-11) !important;\n        }\n        \n        \n        .u-text-custom-color-12,\n        .u-input.u-text-custom-color-12,\n        .u-input.u-text-custom-color-12[class*=\"u-border-\"],\n        li.active > a.u-button-style.u-text-custom-color-12,\n        li.active > a.u-button-style.u-text-custom-color-12[class*=\"u-border-\"],\n        a.u-button-style.u-text-custom-color-12,\n        a.u-button-style.u-text-custom-color-12[class*=\"u-border-\"]\n        {\n            color: var(--custom-color-12) !important;\n        }\n\n        a.u-button-style.u-text-custom-color-12:hover,\n        a.u-button-style.u-text-custom-color-12[class*=\"u-border-\"]:hover,\n        a.u-button-style.u-text-custom-color-12:focus,\n        a.u-button-style.u-text-custom-color-12[class*=\"u-border-\"]:focus,\n        a.u-button-style.u-button-style.u-text-custom-color-12:active,\n        a.u-button-style.u-button-style.u-text-custom-color-12[class*=\"u-border-\"]:active,\n        a.u-button-style.u-button-style.u-text-custom-color-12.active,\n        a.u-button-style.u-button-style.u-text-custom-color-12[class*=\"u-border-\"].active\n        {\n            color: var(--custom-color-12-darker) !important;\n        }\n\n        a.u-button-style:hover > .u-text-hover-custom-color-12,\n        a.u-button-style:hover > .u-text-hover-custom-color-12[class*=\"u-border-\"],\n        a.u-button-style.u-button-style.u-text-hover-custom-color-12:hover,\n        a.u-button-style.u-button-style.u-text-hover-custom-color-12[class*=\"u-border-\"]:hover,\n        a.u-button-style.u-button-style.u-button-style.u-text-hover-custom-color-12.active,\n        a.u-button-style.u-button-style.u-button-style.u-text-hover-custom-color-12[class*=\"u-border-\"].active,\n        a.u-button-style.u-button-style.u-button-style.u-text-hover-custom-color-12:active,\n        a.u-button-style.u-button-style.u-button-style.u-text-hover-custom-color-12[class*=\"u-border-\"]:active,\n        a.u-button-style.u-button-style.u-text-hover-custom-color-12:focus,\n        a.u-button-style.u-button-style.u-text-hover-custom-color-12[class*=\"u-border-\"]:focus,\n        a.u-button-style.u-button-style.u-button-style.u-button-style.u-text-active-custom-color-12:active,\n        a.u-button-style.u-button-style.u-button-style.u-button-style.u-text-active-custom-color-12[class*=\"u-border-\"]:active,\n        a.u-button-style.u-button-style.u-button-style.u-button-style.u-text-active-custom-color-12.active,\n        a.u-button-style.u-button-style.u-button-style.u-button-style.u-text-active-custom-color-12[class*=\"u-border-\"].active,\n        a.u-button-style.u-button-style.active > .u-text-active-custom-color-12,\n        a.u-button-style.u-button-style.active > .u-text-active-custom-color-12[class*=\"u-border-\"],\n        :not(.level-2) > .u-nav > .u-nav-item > a.u-nav-link.u-text-hover-custom-color-12:hover,\n        :not(.level-2) > .u-nav > .u-nav-item > a.u-nav-link.u-nav-link.u-text-active-custom-color-12.active,\n        .u-text-hover-custom-color-12.u-language-url:hover,\n        .u-text-hover-custom-color-12 .u-language-url:hover,\n        .u-text-hover-custom-color-12.u-carousel-control:hover,\n        .u-popupmenu-items.u-text-hover-custom-color-12 .u-nav-link:hover,\n        .u-popupmenu-items.u-popupmenu-items.u-text-active-custom-color-12 .u-nav-link.active\n        {\n            color: var(--custom-color-12) !important;\n        }\n\n        .u-text-custom-color-12 .u-svg-link,\n        .u-text-hover-custom-color-12:hover .u-svg-link,\n        .u-button-style:hover > .u-text-hover-custom-color-12 .u-svg-link,\n        .u-button-style.u-button-style.active > .u-text-active-custom-color-12 .u-svg-link,\n        .u-text-hover-custom-color-12:focus .u-svg-link\n        {\n            fill: var(--custom-color-12);\n        }\n\n        .u-link.u-text-custom-color-12:hover\n        {\n            color: var(--custom-color-12-darker) !important;\n        }\n\n        a.u-link.u-text-hover-custom-color-12:hover\n        {\n            color: var(--custom-color-12) !important;\n        }\n        \n        \n        .u-text-custom-color-13,\n        .u-input.u-text-custom-color-13,\n        .u-input.u-text-custom-color-13[class*=\"u-border-\"],\n        li.active > a.u-button-style.u-text-custom-color-13,\n        li.active > a.u-button-style.u-text-custom-color-13[class*=\"u-border-\"],\n        a.u-button-style.u-text-custom-color-13,\n        a.u-button-style.u-text-custom-color-13[class*=\"u-border-\"]\n        {\n            color: var(--custom-color-13) !important;\n        }\n\n        a.u-button-style.u-text-custom-color-13:hover,\n        a.u-button-style.u-text-custom-color-13[class*=\"u-border-\"]:hover,\n        a.u-button-style.u-text-custom-color-13:focus,\n        a.u-button-style.u-text-custom-color-13[class*=\"u-border-\"]:focus,\n        a.u-button-style.u-button-style.u-text-custom-color-13:active,\n        a.u-button-style.u-button-style.u-text-custom-color-13[class*=\"u-border-\"]:active,\n        a.u-button-style.u-button-style.u-text-custom-color-13.active,\n        a.u-button-style.u-button-style.u-text-custom-color-13[class*=\"u-border-\"].active\n        {\n            color: var(--custom-color-13-darker) !important;\n        }\n\n        a.u-button-style:hover > .u-text-hover-custom-color-13,\n        a.u-button-style:hover > .u-text-hover-custom-color-13[class*=\"u-border-\"],\n        a.u-button-style.u-button-style.u-text-hover-custom-color-13:hover,\n        a.u-button-style.u-button-style.u-text-hover-custom-color-13[class*=\"u-border-\"]:hover,\n        a.u-button-style.u-button-style.u-button-style.u-text-hover-custom-color-13.active,\n        a.u-button-style.u-button-style.u-button-style.u-text-hover-custom-color-13[class*=\"u-border-\"].active,\n        a.u-button-style.u-button-style.u-button-style.u-text-hover-custom-color-13:active,\n        a.u-button-style.u-button-style.u-button-style.u-text-hover-custom-color-13[class*=\"u-border-\"]:active,\n        a.u-button-style.u-button-style.u-text-hover-custom-color-13:focus,\n        a.u-button-style.u-button-style.u-text-hover-custom-color-13[class*=\"u-border-\"]:focus,\n        a.u-button-style.u-button-style.u-button-style.u-button-style.u-text-active-custom-color-13:active,\n        a.u-button-style.u-button-style.u-button-style.u-button-style.u-text-active-custom-color-13[class*=\"u-border-\"]:active,\n        a.u-button-style.u-button-style.u-button-style.u-button-style.u-text-active-custom-color-13.active,\n        a.u-button-style.u-button-style.u-button-style.u-button-style.u-text-active-custom-color-13[class*=\"u-border-\"].active,\n        a.u-button-style.u-button-style.active > .u-text-active-custom-color-13,\n        a.u-button-style.u-button-style.active > .u-text-active-custom-color-13[class*=\"u-border-\"],\n        :not(.level-2) > .u-nav > .u-nav-item > a.u-nav-link.u-text-hover-custom-color-13:hover,\n        :not(.level-2) > .u-nav > .u-nav-item > a.u-nav-link.u-nav-link.u-text-active-custom-color-13.active,\n        .u-text-hover-custom-color-13.u-language-url:hover,\n        .u-text-hover-custom-color-13 .u-language-url:hover,\n        .u-text-hover-custom-color-13.u-carousel-control:hover,\n        .u-popupmenu-items.u-text-hover-custom-color-13 .u-nav-link:hover,\n        .u-popupmenu-items.u-popupmenu-items.u-text-active-custom-color-13 .u-nav-link.active\n        {\n            color: var(--custom-color-13) !important;\n        }\n\n        .u-text-custom-color-13 .u-svg-link,\n        .u-text-hover-custom-color-13:hover .u-svg-link,\n        .u-button-style:hover > .u-text-hover-custom-color-13 .u-svg-link,\n        .u-button-style.u-button-style.active > .u-text-active-custom-color-13 .u-svg-link,\n        .u-text-hover-custom-color-13:focus .u-svg-link\n        {\n            fill: var(--custom-color-13);\n        }\n\n        .u-link.u-text-custom-color-13:hover\n        {\n            color: var(--custom-color-13-darker) !important;\n        }\n\n        a.u-link.u-text-hover-custom-color-13:hover\n        {\n            color: var(--custom-color-13) !important;\n        }\n        \n        \n        .u-text-custom-color-14,\n        .u-input.u-text-custom-color-14,\n        .u-input.u-text-custom-color-14[class*=\"u-border-\"],\n        li.active > a.u-button-style.u-text-custom-color-14,\n        li.active > a.u-button-style.u-text-custom-color-14[class*=\"u-border-\"],\n        a.u-button-style.u-text-custom-color-14,\n        a.u-button-style.u-text-custom-color-14[class*=\"u-border-\"]\n        {\n            color: var(--custom-color-14) !important;\n        }\n\n        a.u-button-style.u-text-custom-color-14:hover,\n        a.u-button-style.u-text-custom-color-14[class*=\"u-border-\"]:hover,\n        a.u-button-style.u-text-custom-color-14:focus,\n        a.u-button-style.u-text-custom-color-14[class*=\"u-border-\"]:focus,\n        a.u-button-style.u-button-style.u-text-custom-color-14:active,\n        a.u-button-style.u-button-style.u-text-custom-color-14[class*=\"u-border-\"]:active,\n        a.u-button-style.u-button-style.u-text-custom-color-14.active,\n        a.u-button-style.u-button-style.u-text-custom-color-14[class*=\"u-border-\"].active\n        {\n            color: var(--custom-color-14-darker) !important;\n        }\n\n        a.u-button-style:hover > .u-text-hover-custom-color-14,\n        a.u-button-style:hover > .u-text-hover-custom-color-14[class*=\"u-border-\"],\n        a.u-button-style.u-button-style.u-text-hover-custom-color-14:hover,\n        a.u-button-style.u-button-style.u-text-hover-custom-color-14[class*=\"u-border-\"]:hover,\n        a.u-button-style.u-button-style.u-button-style.u-text-hover-custom-color-14.active,\n        a.u-button-style.u-button-style.u-button-style.u-text-hover-custom-color-14[class*=\"u-border-\"].active,\n        a.u-button-style.u-button-style.u-button-style.u-text-hover-custom-color-14:active,\n        a.u-button-style.u-button-style.u-button-style.u-text-hover-custom-color-14[class*=\"u-border-\"]:active,\n        a.u-button-style.u-button-style.u-text-hover-custom-color-14:focus,\n        a.u-button-style.u-button-style.u-text-hover-custom-color-14[class*=\"u-border-\"]:focus,\n        a.u-button-style.u-button-style.u-button-style.u-button-style.u-text-active-custom-color-14:active,\n        a.u-button-style.u-button-style.u-button-style.u-button-style.u-text-active-custom-color-14[class*=\"u-border-\"]:active,\n        a.u-button-style.u-button-style.u-button-style.u-button-style.u-text-active-custom-color-14.active,\n        a.u-button-style.u-button-style.u-button-style.u-button-style.u-text-active-custom-color-14[class*=\"u-border-\"].active,\n        a.u-button-style.u-button-style.active > .u-text-active-custom-color-14,\n        a.u-button-style.u-button-style.active > .u-text-active-custom-color-14[class*=\"u-border-\"],\n        :not(.level-2) > .u-nav > .u-nav-item > a.u-nav-link.u-text-hover-custom-color-14:hover,\n        :not(.level-2) > .u-nav > .u-nav-item > a.u-nav-link.u-nav-link.u-text-active-custom-color-14.active,\n        .u-text-hover-custom-color-14.u-language-url:hover,\n        .u-text-hover-custom-color-14 .u-language-url:hover,\n        .u-text-hover-custom-color-14.u-carousel-control:hover,\n        .u-popupmenu-items.u-text-hover-custom-color-14 .u-nav-link:hover,\n        .u-popupmenu-items.u-popupmenu-items.u-text-active-custom-color-14 .u-nav-link.active\n        {\n            color: var(--custom-color-14) !important;\n        }\n\n        .u-text-custom-color-14 .u-svg-link,\n        .u-text-hover-custom-color-14:hover .u-svg-link,\n        .u-button-style:hover > .u-text-hover-custom-color-14 .u-svg-link,\n        .u-button-style.u-button-style.active > .u-text-active-custom-color-14 .u-svg-link,\n        .u-text-hover-custom-color-14:focus .u-svg-link\n        {\n            fill: var(--custom-color-14);\n        }\n\n        .u-link.u-text-custom-color-14:hover\n        {\n            color: var(--custom-color-14-darker) !important;\n        }\n\n        a.u-link.u-text-hover-custom-color-14:hover\n        {\n            color: var(--custom-color-14) !important;\n        }\n        \n        \n        .u-text-custom-color-15,\n        .u-input.u-text-custom-color-15,\n        .u-input.u-text-custom-color-15[class*=\"u-border-\"],\n        li.active > a.u-button-style.u-text-custom-color-15,\n        li.active > a.u-button-style.u-text-custom-color-15[class*=\"u-border-\"],\n        a.u-button-style.u-text-custom-color-15,\n        a.u-button-style.u-text-custom-color-15[class*=\"u-border-\"]\n        {\n            color: var(--custom-color-15) !important;\n        }\n\n        a.u-button-style.u-text-custom-color-15:hover,\n        a.u-button-style.u-text-custom-color-15[class*=\"u-border-\"]:hover,\n        a.u-button-style.u-text-custom-color-15:focus,\n        a.u-button-style.u-text-custom-color-15[class*=\"u-border-\"]:focus,\n        a.u-button-style.u-button-style.u-text-custom-color-15:active,\n        a.u-button-style.u-button-style.u-text-custom-color-15[class*=\"u-border-\"]:active,\n        a.u-button-style.u-button-style.u-text-custom-color-15.active,\n        a.u-button-style.u-button-style.u-text-custom-color-15[class*=\"u-border-\"].active\n        {\n            color: var(--custom-color-15-darker) !important;\n        }\n\n        a.u-button-style:hover > .u-text-hover-custom-color-15,\n        a.u-button-style:hover > .u-text-hover-custom-color-15[class*=\"u-border-\"],\n        a.u-button-style.u-button-style.u-text-hover-custom-color-15:hover,\n        a.u-button-style.u-button-style.u-text-hover-custom-color-15[class*=\"u-border-\"]:hover,\n        a.u-button-style.u-button-style.u-button-style.u-text-hover-custom-color-15.active,\n        a.u-button-style.u-button-style.u-button-style.u-text-hover-custom-color-15[class*=\"u-border-\"].active,\n        a.u-button-style.u-button-style.u-button-style.u-text-hover-custom-color-15:active,\n        a.u-button-style.u-button-style.u-button-style.u-text-hover-custom-color-15[class*=\"u-border-\"]:active,\n        a.u-button-style.u-button-style.u-text-hover-custom-color-15:focus,\n        a.u-button-style.u-button-style.u-text-hover-custom-color-15[class*=\"u-border-\"]:focus,\n        a.u-button-style.u-button-style.u-button-style.u-button-style.u-text-active-custom-color-15:active,\n        a.u-button-style.u-button-style.u-button-style.u-button-style.u-text-active-custom-color-15[class*=\"u-border-\"]:active,\n        a.u-button-style.u-button-style.u-button-style.u-button-style.u-text-active-custom-color-15.active,\n        a.u-button-style.u-button-style.u-button-style.u-button-style.u-text-active-custom-color-15[class*=\"u-border-\"].active,\n        a.u-button-style.u-button-style.active > .u-text-active-custom-color-15,\n        a.u-button-style.u-button-style.active > .u-text-active-custom-color-15[class*=\"u-border-\"],\n        :not(.level-2) > .u-nav > .u-nav-item > a.u-nav-link.u-text-hover-custom-color-15:hover,\n        :not(.level-2) > .u-nav > .u-nav-item > a.u-nav-link.u-nav-link.u-text-active-custom-color-15.active,\n        .u-text-hover-custom-color-15.u-language-url:hover,\n        .u-text-hover-custom-color-15 .u-language-url:hover,\n        .u-text-hover-custom-color-15.u-carousel-control:hover,\n        .u-popupmenu-items.u-text-hover-custom-color-15 .u-nav-link:hover,\n        .u-popupmenu-items.u-popupmenu-items.u-text-active-custom-color-15 .u-nav-link.active\n        {\n            color: var(--custom-color-15) !important;\n        }\n\n        .u-text-custom-color-15 .u-svg-link,\n        .u-text-hover-custom-color-15:hover .u-svg-link,\n        .u-button-style:hover > .u-text-hover-custom-color-15 .u-svg-link,\n        .u-button-style.u-button-style.active > .u-text-active-custom-color-15 .u-svg-link,\n        .u-text-hover-custom-color-15:focus .u-svg-link\n        {\n            fill: var(--custom-color-15);\n        }\n\n        .u-link.u-text-custom-color-15:hover\n        {\n            color: var(--custom-color-15-darker) !important;\n        }\n\n        a.u-link.u-text-hover-custom-color-15:hover\n        {\n            color: var(--custom-color-15) !important;\n        }\n        \n        \n        .u-text-custom-color-16,\n        .u-input.u-text-custom-color-16,\n        .u-input.u-text-custom-color-16[class*=\"u-border-\"],\n        li.active > a.u-button-style.u-text-custom-color-16,\n        li.active > a.u-button-style.u-text-custom-color-16[class*=\"u-border-\"],\n        a.u-button-style.u-text-custom-color-16,\n        a.u-button-style.u-text-custom-color-16[class*=\"u-border-\"]\n        {\n            color: var(--custom-color-16) !important;\n        }\n\n        a.u-button-style.u-text-custom-color-16:hover,\n        a.u-button-style.u-text-custom-color-16[class*=\"u-border-\"]:hover,\n        a.u-button-style.u-text-custom-color-16:focus,\n        a.u-button-style.u-text-custom-color-16[class*=\"u-border-\"]:focus,\n        a.u-button-style.u-button-style.u-text-custom-color-16:active,\n        a.u-button-style.u-button-style.u-text-custom-color-16[class*=\"u-border-\"]:active,\n        a.u-button-style.u-button-style.u-text-custom-color-16.active,\n        a.u-button-style.u-button-style.u-text-custom-color-16[class*=\"u-border-\"].active\n        {\n            color: var(--custom-color-16-darker) !important;\n        }\n\n        a.u-button-style:hover > .u-text-hover-custom-color-16,\n        a.u-button-style:hover > .u-text-hover-custom-color-16[class*=\"u-border-\"],\n        a.u-button-style.u-button-style.u-text-hover-custom-color-16:hover,\n        a.u-button-style.u-button-style.u-text-hover-custom-color-16[class*=\"u-border-\"]:hover,\n        a.u-button-style.u-button-style.u-button-style.u-text-hover-custom-color-16.active,\n        a.u-button-style.u-button-style.u-button-style.u-text-hover-custom-color-16[class*=\"u-border-\"].active,\n        a.u-button-style.u-button-style.u-button-style.u-text-hover-custom-color-16:active,\n        a.u-button-style.u-button-style.u-button-style.u-text-hover-custom-color-16[class*=\"u-border-\"]:active,\n        a.u-button-style.u-button-style.u-text-hover-custom-color-16:focus,\n        a.u-button-style.u-button-style.u-text-hover-custom-color-16[class*=\"u-border-\"]:focus,\n        a.u-button-style.u-button-style.u-button-style.u-button-style.u-text-active-custom-color-16:active,\n        a.u-button-style.u-button-style.u-button-style.u-button-style.u-text-active-custom-color-16[class*=\"u-border-\"]:active,\n        a.u-button-style.u-button-style.u-button-style.u-button-style.u-text-active-custom-color-16.active,\n        a.u-button-style.u-button-style.u-button-style.u-button-style.u-text-active-custom-color-16[class*=\"u-border-\"].active,\n        a.u-button-style.u-button-style.active > .u-text-active-custom-color-16,\n        a.u-button-style.u-button-style.active > .u-text-active-custom-color-16[class*=\"u-border-\"],\n        :not(.level-2) > .u-nav > .u-nav-item > a.u-nav-link.u-text-hover-custom-color-16:hover,\n        :not(.level-2) > .u-nav > .u-nav-item > a.u-nav-link.u-nav-link.u-text-active-custom-color-16.active,\n        .u-text-hover-custom-color-16.u-language-url:hover,\n        .u-text-hover-custom-color-16 .u-language-url:hover,\n        .u-text-hover-custom-color-16.u-carousel-control:hover,\n        .u-popupmenu-items.u-text-hover-custom-color-16 .u-nav-link:hover,\n        .u-popupmenu-items.u-popupmenu-items.u-text-active-custom-color-16 .u-nav-link.active\n        {\n            color: var(--custom-color-16) !important;\n        }\n\n        .u-text-custom-color-16 .u-svg-link,\n        .u-text-hover-custom-color-16:hover .u-svg-link,\n        .u-button-style:hover > .u-text-hover-custom-color-16 .u-svg-link,\n        .u-button-style.u-button-style.active > .u-text-active-custom-color-16 .u-svg-link,\n        .u-text-hover-custom-color-16:focus .u-svg-link\n        {\n            fill: var(--custom-color-16);\n        }\n\n        .u-link.u-text-custom-color-16:hover\n        {\n            color: var(--custom-color-16-darker) !important;\n        }\n\n        a.u-link.u-text-hover-custom-color-16:hover\n        {\n            color: var(--custom-color-16) !important;\n        }</style><style id=\"typography\" typography=\"Normal-1\">\n        .u-body\n        {\n        --title-font-weight: 400;\n        --title-font-size: 6rem;\n        --title-line-height: 1.1;\n        --title-margin-top: 20px;\n        --title-margin-bottom: 20px;\n        --subtitle-font-weight: 400;\n        --subtitle-font-size: 3rem;\n        --subtitle-line-height: 1.1;\n        --subtitle-margin-top: 20px;\n        --subtitle-margin-bottom: 20px;\n        --h1-font-weight: 400;\n        --h1-font-size: 4.5rem;\n        --h1-line-height: 1.1;\n        --h1-margin-top: 20px;\n        --h1-margin-bottom: 20px;\n        --h2-font-weight: 400;\n        --h2-font-size: 3rem;\n        --h2-line-height: 1.1;\n        --h2-margin-top: 20px;\n        --h2-margin-bottom: 20px;\n        --h3-font-weight: 400;\n        --h3-font-size: 2.25rem;\n        --h3-line-height: 1.2;\n        --h3-margin-top: 20px;\n        --h3-margin-bottom: 20px;\n        --h4-font-weight: 400;\n        --h4-font-size: 1.5rem;\n        --h4-line-height: 1.2;\n        --h4-margin-top: 20px;\n        --h4-margin-bottom: 20px;\n        --h5-font-weight: 400;\n        --h5-font-size: 1.25rem;\n        --h5-line-height: 1.2;\n        --h5-margin-top: 20px;\n        --h5-margin-bottom: 20px;\n        --h6-font-weight: 400;\n        --h6-font-size: 1.125rem;\n        --h6-line-height: 1.2;\n        --h6-margin-top: 20px;\n        --h6-margin-bottom: 20px;\n        --largeText-font-size: 1.5rem;\n        --largeText-margin-top: 20px;\n        --largeText-margin-bottom: 20px;\n        --smallText-font-size: 0.875rem;\n        --smallText-margin-top: 20px;\n        --smallText-margin-bottom: 20px;\n        --text-font-size: 1.125rem;\n        --text-margin-top: 20px;\n        --text-margin-bottom: 20px;\n        --text-line-height: 1.6;\n        --hyperlink-font-size: 1.125rem;\n        --hyperlink-color: var(--palette-1-base);\n        --hyperlink-line-height: 1.6;\n        --hyperlink-alt-text-color: var(--palette-1-light-2);\n        --hyperlink-hover-color: var(--palette-1-base-darker);\n        --hyperlink-hover-alt-text-color: var(--grey-30-darker);\n        --button-margin-top: 20px;\n        --button-margin-bottom: 20px;\n        --button-background-color: var(--palette-1-base);\n        --button-color: var(--white);\n        --button-alt-background-color: var(--palette-1-light-2);\n        --button-alt-color: var(--black);\n        --button-hover-background-color: var(--palette-1-base-darker);\n        --button-hover-color: var(--white-darker);\n        --button-hover-alt-background-color: var(--palette-1-light-2-darker);\n        --button-hover-alt-color: var(--white);\n        --button-hover-background-color: var(--palette-1-base-darker);\n        --button-hover-color: var(--white-darker);\n        --button-hover-alt-background-color: var(--palette-1-light-2-darker);\n        --button-hover-alt-color: var(--white);\n        --button-active-background-color: var(--palette-1-base-darker);\n        --button-active-color: var(--white-darker);\n        --button-active-alt-background-color: var(--palette-1-light-2-darker);\n        --button-active-alt-color: var(--white);\n        --blockquote-font-size: 1.125rem;\n        --blockquote-font-style: italic;\n        --blockquote-padding-left: 20px;\n        --blockquote-border-width: 4px;\n        --blockquote-border-color: var(--palette-1-base);\n        --blockquote-margin-top: 20px;\n        --blockquote-margin-bottom: 20px;\n        --blockquote-line-height: 1.6;\n        --metadata-margin-top: 20px;\n        --metadata-margin-bottom: 20px;\n        --metadata-line-height: 1.6;\n        --list-font-size: 1.125rem;\n        --list-margin-top: 20px;\n        --list-margin-bottom: 20px;\n        --list-line-height: 1.6;\n        --orderedlist-font-size: 1.125rem;\n        --orderedlist-margin-top: 20px;\n        --orderedlist-margin-bottom: 20px;\n        --orderedlist-line-height: 1.6;\n        --postContent-font-size: 1.125rem;\n        --postContent-margin-top: 20px;\n        --postContent-margin-bottom: 20px;\n        --postContent-line-height: 1.6;\n        --theme-sheet-width-xl: 1140px;\n        --theme-sheet-width-lg: 940px;\n        --theme-sheet-width-md: 720px;\n        --theme-sheet-width-sm: 540px;\n        --theme-sheet-width-xs: 340px;\n        --form-input-border-width: 1px;\n        --form-input-border-color: var(--grey-30);\n        --form-input-borders: top right bottom left;\n        --form-input-background-color: var(--white);\n        --form-input-color: var(--black);\n        --title-font-size-lg: 4.5rem;\n        --title-font-size-sm: 3.75rem;\n        --title-font-size-xs: 3rem;\n        --subtitle-font-size-sm: 2.25rem;\n        --subtitle-font-size-xs: 1.875rem;\n        --h1-font-size-lg: 3.75rem;\n        --h1-font-size-sm: 3rem;\n        --h1-font-size-xs: 2.25rem;\n        --h2-font-size-sm: 2.25rem;\n        --h2-font-size-xs: 1.875rem;\n        --h3-font-size-sm: 1.875rem;\n        --h3-font-size-xs: 1.5rem;\n        --text-font-size-sm: 1rem;\n        --hyperlink-font-size-sm: 1rem;\n        --blockquote-font-size-sm: 1rem;\n        --list-font-size-sm: 1rem;\n        --orderedlist-font-size-sm: 1rem;\n        --postContent-font-size-sm: 1rem;\n        }\n\n        /** common-rules **/\n        h1.u-title\n        {\n        font-weight: var(--title-font-weight);\n        font-size: var(--title-font-size);\n        line-height: var(--title-line-height);\n        margin-top: var(--title-margin-top);\n        margin-bottom: var(--title-margin-bottom);\n        }\n        h2.u-subtitle\n        {\n        font-weight: var(--subtitle-font-weight);\n        font-size: var(--subtitle-font-size);\n        line-height: var(--subtitle-line-height);\n        margin-top: var(--subtitle-margin-top);\n        margin-bottom: var(--subtitle-margin-bottom);\n        }\n        h1:not(.u-title)\n        {\n        font-weight: var(--h1-font-weight);\n        font-size: var(--h1-font-size);\n        line-height: var(--h1-line-height);\n        margin-top: var(--h1-margin-top);\n        margin-bottom: var(--h1-margin-bottom);\n        }\n        h2:not(.u-subtitle)\n        {\n        font-weight: var(--h2-font-weight);\n        font-size: var(--h2-font-size);\n        line-height: var(--h2-line-height);\n        margin-top: var(--h2-margin-top);\n        margin-bottom: var(--h2-margin-bottom);\n        }\n        h3\n        {\n        font-weight: var(--h3-font-weight);\n        font-size: var(--h3-font-size);\n        line-height: var(--h3-line-height);\n        margin-top: var(--h3-margin-top);\n        margin-bottom: var(--h3-margin-bottom);\n        }\n        h4\n        {\n        font-weight: var(--h4-font-weight);\n        font-size: var(--h4-font-size);\n        line-height: var(--h4-line-height);\n        margin-top: var(--h4-margin-top);\n        margin-bottom: var(--h4-margin-bottom);\n        }\n        h5\n        {\n        font-weight: var(--h5-font-weight);\n        font-size: var(--h5-font-size);\n        line-height: var(--h5-line-height);\n        margin-top: var(--h5-margin-top);\n        margin-bottom: var(--h5-margin-bottom);\n        }\n        h6\n        {\n        font-weight: var(--h6-font-weight);\n        font-size: var(--h6-font-size);\n        line-height: var(--h6-line-height);\n        margin-top: var(--h6-margin-top);\n        margin-bottom: var(--h6-margin-bottom);\n        }\n        p.u-large-text\n        {\n        font-size: var(--largeText-font-size);\n        margin-top: var(--largeText-margin-top);\n        margin-bottom: var(--largeText-margin-bottom);\n        }\n        p.u-small-text\n        {\n        font-size: var(--smallText-font-size);\n        margin-top: var(--smallText-margin-top);\n        margin-bottom: var(--smallText-margin-bottom);\n        }\n        p:not(.u-text-variant)\n        {\n        font-size: var(--text-font-size);\n        margin-top: var(--text-margin-top);\n        margin-bottom: var(--text-margin-bottom);\n        line-height: var(--text-line-height);\n        }\n        a\n        {\n        font-size: var(--hyperlink-font-size);\n        line-height: var(--hyperlink-line-height);\n        }\n        .u-btn\n        {\n        margin-top: var(--button-margin-top);\n        margin-bottom: var(--button-margin-bottom);\n        }\n        blockquote\n        {\n        font-size: var(--blockquote-font-size);\n        font-style: var(--blockquote-font-style);\n        padding-left: var(--blockquote-padding-left);\n        border-width: var(--blockquote-border-width);\n        margin-top: var(--blockquote-margin-top);\n        margin-bottom: var(--blockquote-margin-bottom);\n        line-height: var(--blockquote-line-height);\n        }\n        .u-metadata\n        {\n        margin-top: var(--metadata-margin-top);\n        margin-bottom: var(--metadata-margin-bottom);\n        line-height: var(--metadata-line-height);\n        }\n        ul:not(.u-unstyled)\n        {\n        font-size: var(--list-font-size);\n        margin-top: var(--list-margin-top);\n        margin-bottom: var(--list-margin-bottom);\n        line-height: var(--list-line-height);\n        }\n        ol\n        {\n        font-size: var(--orderedlist-font-size);\n        margin-top: var(--orderedlist-margin-top);\n        margin-bottom: var(--orderedlist-margin-bottom);\n        line-height: var(--orderedlist-line-height);\n        }\n        .u-post-content\n        {\n        font-size: var(--postContent-font-size);\n        margin-top: var(--postContent-margin-top);\n        margin-bottom: var(--postContent-margin-bottom);\n        line-height: var(--postContent-line-height);\n        }\n        .u-input\n        {\n        border-width: var(--form-input-border-width);\n        borders: var(--form-input-borders);\n        }\n        /** common-rules **/\n\n        /** publish-rules **/\n        /*begin-media rules*/\n        @media (max-width: 1199px) {\n        h1.u-title\n        {\n        font-size: var(--title-font-size-lg);\n        }\n        }\n        @media (max-width: 767px) {\n        h1.u-title\n        {\n        font-size: var(--title-font-size-sm);\n        }\n        }\n        @media (max-width: 575px) {\n        h1.u-title\n        {\n        font-size: var(--title-font-size-xs);\n        }\n        }\n        @media (max-width: 767px) {\n        h2.u-subtitle\n        {\n        font-size: var(--subtitle-font-size-sm);\n        }\n        }\n        @media (max-width: 575px) {\n        h2.u-subtitle\n        {\n        font-size: var(--subtitle-font-size-xs);\n        }\n        }\n        @media (max-width: 1199px) {\n        h1:not(.u-title)\n        {\n        font-size: var(--h1-font-size-lg);\n        }\n        }\n        @media (max-width: 767px) {\n        h1:not(.u-title)\n        {\n        font-size: var(--h1-font-size-sm);\n        }\n        }\n        @media (max-width: 575px) {\n        h1:not(.u-title)\n        {\n        font-size: var(--h1-font-size-xs);\n        }\n        }\n        @media (max-width: 767px) {\n        h2:not(.u-subtitle)\n        {\n        font-size: var(--h2-font-size-sm);\n        }\n        }\n        @media (max-width: 575px) {\n        h2:not(.u-subtitle)\n        {\n        font-size: var(--h2-font-size-xs);\n        }\n        }\n        @media (max-width: 767px) {\n        h3\n        {\n        font-size: var(--h3-font-size-sm);\n        }\n        }\n        @media (max-width: 575px) {\n        h3\n        {\n        font-size: var(--h3-font-size-xs);\n        }\n        }\n        @media (max-width: 767px) {\n        p:not(.u-text-variant)\n        {\n        font-size: var(--text-font-size-sm);\n        }\n        }\n        @media (max-width: 767px) {\n        a\n        {\n        font-size: var(--hyperlink-font-size-sm);\n        }\n        }\n        @media (max-width: 767px) {\n        blockquote\n        {\n        font-size: var(--blockquote-font-size-sm);\n        }\n        }\n        @media (max-width: 767px) {\n        ul:not(.u-unstyled)\n        {\n        font-size: var(--list-font-size-sm);\n        }\n        }\n        @media (max-width: 767px) {\n        ol\n        {\n        font-size: var(--orderedlist-font-size-sm);\n        }\n        }\n        @media (max-width: 767px) {\n        .u-post-content\n        {\n        font-size: var(--postContent-font-size-sm);\n        }\n        }\n        /*end-media rules*/\n        /** publish-rules **/\n\n        \n\n        /** cms-rules **/\n        /*begin-responsive rules*/\n        .u-lg h1.u-title\n        {\n        font-size: var(--title-font-size-lg);\n        }\n        .u-md h1.u-title\n        {\n        font-size: var(--title-font-size-lg);\n        }\n        .u-sm h1.u-title\n        {\n        font-size: var(--title-font-size-sm);\n        }\n        .u-xs h1.u-title\n        {\n        font-size: var(--title-font-size-xs);\n        }\n        .u-sm h2.u-subtitle\n        {\n        font-size: var(--subtitle-font-size-sm);\n        }\n        .u-xs h2.u-subtitle\n        {\n        font-size: var(--subtitle-font-size-xs);\n        }\n        .u-lg h1:not(.u-title)\n        {\n        font-size: var(--h1-font-size-lg);\n        }\n        .u-md h1:not(.u-title)\n        {\n        font-size: var(--h1-font-size-lg);\n        }\n        .u-sm h1:not(.u-title)\n        {\n        font-size: var(--h1-font-size-sm);\n        }\n        .u-xs h1:not(.u-title)\n        {\n        font-size: var(--h1-font-size-xs);\n        }\n        .u-sm h2:not(.u-subtitle)\n        {\n        font-size: var(--h2-font-size-sm);\n        }\n        .u-xs h2:not(.u-subtitle)\n        {\n        font-size: var(--h2-font-size-xs);\n        }\n        .u-sm h3\n        {\n        font-size: var(--h3-font-size-sm);\n        }\n        .u-xs h3\n        {\n        font-size: var(--h3-font-size-xs);\n        }\n        .u-sm p:not(.u-text-variant)\n        {\n        font-size: var(--text-font-size-sm);\n        }\n        .u-xs p:not(.u-text-variant)\n        {\n        font-size: var(--text-font-size-sm);\n        }\n        .u-sm a\n        {\n        font-size: var(--hyperlink-font-size-sm);\n        }\n        .u-xs a\n        {\n        font-size: var(--hyperlink-font-size-sm);\n        }\n        .u-sm blockquote\n        {\n        font-size: var(--blockquote-font-size-sm);\n        }\n        .u-xs blockquote\n        {\n        font-size: var(--blockquote-font-size-sm);\n        }\n        .u-sm ul:not(.u-unstyled)\n        {\n        font-size: var(--list-font-size-sm);\n        }\n        .u-xs ul:not(.u-unstyled)\n        {\n        font-size: var(--list-font-size-sm);\n        }\n        .u-sm ol\n        {\n        font-size: var(--orderedlist-font-size-sm);\n        }\n        .u-xs ol\n        {\n        font-size: var(--orderedlist-font-size-sm);\n        }\n        .u-sm .u-post-content\n        {\n        font-size: var(--postContent-font-size-sm);\n        }\n        .u-xs .u-post-content\n        {\n        font-size: var(--postContent-font-size-sm);\n        }\n        /*end-responsive rules*/\n        /** cms-rules **/\n\n        /** color-rules **/\n        .u-overlap.u-overlap-transparent:not(.u-overlap-contrast) .u-header :not(.u-nav-item) > a,\n        .u-gradient > .u-container-layout > a,\n        .u-image:not(.u-shading) > .u-container-layout > a,\n        a\n        {\n        color: var(--hyperlink-color);\n        }\n        .u-overlap.u-overlap-transparent:not(.u-overlap-contrast) .u-header :not(.u-nav-item) > a:hover,\n        .u-gradient > .u-container-layout > a:hover,\n        .u-image:not(.u-shading) > .u-container-layout > a:hover,\n        a:hover\n        {\n        color: var(--hyperlink-hover-color);\n        }\n        .u-overlap.u-overlap-transparent:not(.u-overlap-contrast) .u-header :not(.u-nav-item) > .u-btn,\n        .u-gradient > .u-container-layout > .u-btn,\n        .u-image:not(.u-shading) > .u-container-layout > .u-btn,\n        .u-btn\n        {\n        background-color: var(--button-background-color);\n        color: var(--button-color);\n        }\n        .u-overlap.u-overlap-transparent:not(.u-overlap-contrast) .u-header :not(.u-nav-item) > .u-btn:hover,\n        .u-gradient > .u-container-layout > .u-btn:hover,\n        .u-image:not(.u-shading) > .u-container-layout > .u-btn:hover,\n        .u-btn:hover\n        {\n        background-color: var(--button-hover-background-color);\n        color: var(--button-hover-color);\n        }\n        .u-overlap.u-overlap-transparent:not(.u-overlap-contrast) .u-header :not(.u-nav-item) > .u-btn:focus,\n        .u-gradient > .u-container-layout > .u-btn:focus,\n        .u-image:not(.u-shading) > .u-container-layout > .u-btn:focus,\n        .u-btn:focus\n        {\n        background-color: var(--button-hover-background-color);\n        color: var(--button-hover-color);\n        }\n        .u-overlap.u-overlap-transparent:not(.u-overlap-contrast) .u-header :not(.u-nav-item) > .u-btn:active,\n        .u-gradient > .u-container-layout > .u-btn:active,\n        .u-image:not(.u-shading) > .u-container-layout > .u-btn:active,\n        .u-btn:active\n        {\n        background-color: var(--button-active-background-color);\n        color: var(--button-active-color);\n        }\n        .u-overlap.u-overlap-transparent:not(.u-overlap-contrast) .u-header :not(.u-nav-item) > blockquote,\n        .u-gradient > .u-container-layout > blockquote,\n        .u-image:not(.u-shading) > .u-container-layout > blockquote,\n        blockquote\n        {\n        border-color: var(--blockquote-border-color);\n        }\n        .u-overlap.u-overlap-transparent:not(.u-overlap-contrast) .u-header :not(.u-nav-item) > .u-input,\n        .u-gradient > .u-container-layout > .u-input,\n        .u-image:not(.u-shading) > .u-container-layout > .u-input,\n        .u-input\n        {\n        border-color: var(--form-input-border-color);\n        background-color: var(--form-input-background-color);\n        color: var(--form-input-color);\n        }\n        /** color-rules **/\n\n        /** alt-color-rules **/\n        .u-custom-color-1 a,.u-custom-color-2 a,.u-custom-color-5 a,.u-custom-color-6 a,.u-custom-color-7 a,.u-custom-color-8 a,.u-custom-color-10 a,.u-custom-color-11 a,.u-custom-color-12 a,.u-custom-color-13 a,.u-custom-color-14 a,.u-body-color a,.u-palette-1-base a,.u-palette-1-dark-3 a,.u-palette-1-dark-2 a,.u-palette-1-dark-1 a,.u-palette-1 a,.u-palette-1-light-1 a,.u-palette-2-base a,.u-palette-2-dark-3 a,.u-palette-2-dark-2 a,.u-palette-2-dark-1 a,.u-palette-2 a,.u-palette-2-light-1 a,.u-palette-3-dark-3 a,.u-palette-3-dark-2 a,.u-palette-3-dark-1 a,.u-palette-4-base a,.u-palette-4-dark-3 a,.u-palette-4-dark-2 a,.u-palette-4-dark-1 a,.u-palette-5-dark-3 a,.u-palette-5-dark-2 a,.u-palette-5-dark-1 a,.u-grey-40 a,.u-grey-30 a,.u-grey-90 a,.u-grey-80 a,.u-grey-75 a,.u-black a,.u-grey-70 a,.u-grey-60 a,.u-grey-50 a,.u-grey-dark-3 a,.u-grey-dark-2 a,.u-grey-dark-1 a,.u-grey a,.u-shading a,.u-overlap-contrast .u-header a:not(.u-nav-link):not(.u-btn)\n        {\n        color: var(--hyperlink-alt-text-color);\n        }\n        .u-custom-color-1 a:hover,.u-custom-color-2 a:hover,.u-custom-color-5 a:hover,.u-custom-color-6 a:hover,.u-custom-color-7 a:hover,.u-custom-color-8 a:hover,.u-custom-color-10 a:hover,.u-custom-color-11 a:hover,.u-custom-color-12 a:hover,.u-custom-color-13 a:hover,.u-custom-color-14 a:hover,.u-body-color a:hover,.u-palette-1-base a:hover,.u-palette-1-dark-3 a:hover,.u-palette-1-dark-2 a:hover,.u-palette-1-dark-1 a:hover,.u-palette-1 a:hover,.u-palette-1-light-1 a:hover,.u-palette-2-base a:hover,.u-palette-2-dark-3 a:hover,.u-palette-2-dark-2 a:hover,.u-palette-2-dark-1 a:hover,.u-palette-2 a:hover,.u-palette-2-light-1 a:hover,.u-palette-3-dark-3 a:hover,.u-palette-3-dark-2 a:hover,.u-palette-3-dark-1 a:hover,.u-palette-4-base a:hover,.u-palette-4-dark-3 a:hover,.u-palette-4-dark-2 a:hover,.u-palette-4-dark-1 a:hover,.u-palette-5-dark-3 a:hover,.u-palette-5-dark-2 a:hover,.u-palette-5-dark-1 a:hover,.u-grey-40 a:hover,.u-grey-30 a:hover,.u-grey-90 a:hover,.u-grey-80 a:hover,.u-grey-75 a:hover,.u-black a:hover,.u-grey-70 a:hover,.u-grey-60 a:hover,.u-grey-50 a:hover,.u-grey-dark-3 a:hover,.u-grey-dark-2 a:hover,.u-grey-dark-1 a:hover,.u-grey a:hover\n        {\n        color: var(--hyperlink-hover-alt-text-color);\n        }\n        .u-custom-color-1 .u-btn,.u-custom-color-2 .u-btn,.u-custom-color-5 .u-btn,.u-custom-color-6 .u-btn,.u-custom-color-7 .u-btn,.u-custom-color-8 .u-btn,.u-custom-color-10 .u-btn,.u-custom-color-11 .u-btn,.u-custom-color-12 .u-btn,.u-custom-color-13 .u-btn,.u-custom-color-14 .u-btn,.u-body-color .u-btn,.u-palette-1-base .u-btn,.u-palette-1-dark-3 .u-btn,.u-palette-1-dark-2 .u-btn,.u-palette-1-dark-1 .u-btn,.u-palette-1 .u-btn,.u-palette-1-light-1 .u-btn,.u-palette-2-base .u-btn,.u-palette-2-dark-3 .u-btn,.u-palette-2-dark-2 .u-btn,.u-palette-2-dark-1 .u-btn,.u-palette-2 .u-btn,.u-palette-2-light-1 .u-btn,.u-palette-3-dark-3 .u-btn,.u-palette-3-dark-2 .u-btn,.u-palette-3-dark-1 .u-btn,.u-palette-4-base .u-btn,.u-palette-4-dark-3 .u-btn,.u-palette-4-dark-2 .u-btn,.u-palette-4-dark-1 .u-btn,.u-palette-5-dark-3 .u-btn,.u-palette-5-dark-2 .u-btn,.u-palette-5-dark-1 .u-btn,.u-grey-40 .u-btn,.u-grey-30 .u-btn,.u-grey-90 .u-btn,.u-grey-80 .u-btn,.u-grey-75 .u-btn,.u-black .u-btn,.u-grey-70 .u-btn,.u-grey-60 .u-btn,.u-grey-50 .u-btn,.u-grey-dark-3 .u-btn,.u-grey-dark-2 .u-btn,.u-grey-dark-1 .u-btn,.u-grey .u-btn,.u-shading .u-btn,.u-overlap-contrast .u-header .u-btn\n        {\n        background-color: var(--button-alt-background-color);\n        color: var(--button-alt-color);\n        }\n        .u-custom-color-1 .u-btn:hover,.u-custom-color-2 .u-btn:hover,.u-custom-color-5 .u-btn:hover,.u-custom-color-6 .u-btn:hover,.u-custom-color-7 .u-btn:hover,.u-custom-color-8 .u-btn:hover,.u-custom-color-10 .u-btn:hover,.u-custom-color-11 .u-btn:hover,.u-custom-color-12 .u-btn:hover,.u-custom-color-13 .u-btn:hover,.u-custom-color-14 .u-btn:hover,.u-body-color .u-btn:hover,.u-palette-1-base .u-btn:hover,.u-palette-1-dark-3 .u-btn:hover,.u-palette-1-dark-2 .u-btn:hover,.u-palette-1-dark-1 .u-btn:hover,.u-palette-1 .u-btn:hover,.u-palette-1-light-1 .u-btn:hover,.u-palette-2-base .u-btn:hover,.u-palette-2-dark-3 .u-btn:hover,.u-palette-2-dark-2 .u-btn:hover,.u-palette-2-dark-1 .u-btn:hover,.u-palette-2 .u-btn:hover,.u-palette-2-light-1 .u-btn:hover,.u-palette-3-dark-3 .u-btn:hover,.u-palette-3-dark-2 .u-btn:hover,.u-palette-3-dark-1 .u-btn:hover,.u-palette-4-base .u-btn:hover,.u-palette-4-dark-3 .u-btn:hover,.u-palette-4-dark-2 .u-btn:hover,.u-palette-4-dark-1 .u-btn:hover,.u-palette-5-dark-3 .u-btn:hover,.u-palette-5-dark-2 .u-btn:hover,.u-palette-5-dark-1 .u-btn:hover,.u-grey-40 .u-btn:hover,.u-grey-30 .u-btn:hover,.u-grey-90 .u-btn:hover,.u-grey-80 .u-btn:hover,.u-grey-75 .u-btn:hover,.u-black .u-btn:hover,.u-grey-70 .u-btn:hover,.u-grey-60 .u-btn:hover,.u-grey-50 .u-btn:hover,.u-grey-dark-3 .u-btn:hover,.u-grey-dark-2 .u-btn:hover,.u-grey-dark-1 .u-btn:hover,.u-grey .u-btn:hover,.u-shading .u-btn:hover,.u-overlap-contrast .u-header .u-btn:hover\n        {\n        background-color: var(--button-hover-alt-background-color);\n        color: var(--button-hover-alt-color);\n        }\n        .u-custom-color-1 .u-btn:active,.u-custom-color-2 .u-btn:active,.u-custom-color-5 .u-btn:active,.u-custom-color-6 .u-btn:active,.u-custom-color-7 .u-btn:active,.u-custom-color-8 .u-btn:active,.u-custom-color-10 .u-btn:active,.u-custom-color-11 .u-btn:active,.u-custom-color-12 .u-btn:active,.u-custom-color-13 .u-btn:active,.u-custom-color-14 .u-btn:active,.u-body-color .u-btn:active,.u-palette-1-base .u-btn:active,.u-palette-1-dark-3 .u-btn:active,.u-palette-1-dark-2 .u-btn:active,.u-palette-1-dark-1 .u-btn:active,.u-palette-1 .u-btn:active,.u-palette-1-light-1 .u-btn:active,.u-palette-2-base .u-btn:active,.u-palette-2-dark-3 .u-btn:active,.u-palette-2-dark-2 .u-btn:active,.u-palette-2-dark-1 .u-btn:active,.u-palette-2 .u-btn:active,.u-palette-2-light-1 .u-btn:active,.u-palette-3-dark-3 .u-btn:active,.u-palette-3-dark-2 .u-btn:active,.u-palette-3-dark-1 .u-btn:active,.u-palette-4-base .u-btn:active,.u-palette-4-dark-3 .u-btn:active,.u-palette-4-dark-2 .u-btn:active,.u-palette-4-dark-1 .u-btn:active,.u-palette-5-dark-3 .u-btn:active,.u-palette-5-dark-2 .u-btn:active,.u-palette-5-dark-1 .u-btn:active,.u-grey-40 .u-btn:active,.u-grey-30 .u-btn:active,.u-grey-90 .u-btn:active,.u-grey-80 .u-btn:active,.u-grey-75 .u-btn:active,.u-black .u-btn:active,.u-grey-70 .u-btn:active,.u-grey-60 .u-btn:active,.u-grey-50 .u-btn:active,.u-grey-dark-3 .u-btn:active,.u-grey-dark-2 .u-btn:active,.u-grey-dark-1 .u-btn:active,.u-grey .u-btn:active,.u-shading .u-btn:active,.u-overlap-contrast .u-header .u-btn:active\n        {\n        background-color: var(--button-active-alt-background-color);\n        color: var(--button-active-alt-color);\n        }\n        /** alt-color-rules **/\n    </style><style id=\"font-scheme\" font-scheme=\"custom-font-family-7\" heading-font=\"'Fira Mono'\" text-font=\"'Open Sans',sans-serif\">.u-body {\n   --text-font: 'Open Sans',sans-serif;\n   --heading-font: 'Fira Mono';\n}</style>","appVersion":"6.0.3","publicUrl":null,"customDomainUrl":null,"datePublished":null,"isTrial":true,"serverSiteId":null}
